CMD: /Users/lucasmuller/Desktop/Githubg/Rawls_v3/.venv/bin/python /Users/lucasmuller/Desktop/Githubg/Rawls_v3/main.py /Users/lucasmuller/Desktop/Githubg/Rawls_v3/hypothesis_testing/hypothesis_2/configs/american/hypothesis_2_american_condition_26_config.yaml /Users/lucasmuller/Desktop/Githubg/Rawls_v3/hypothesis_testing/hypothesis_2/results/american/hypothesis_2_american_condition_26_config_results.json
[TECH] Loading configuration from: /Users/lucasmuller/Desktop/Githubg/Rawls_v3/hypothesis_testing/hypothesis_2/configs/american/hypothesis_2_american_condition_26_config.yaml
2025-10-18 16:41:40,444 - utils.seed_manager - INFO - Generated seed 1866149029 from configuration hash
2025-10-18 16:41:40,444 - utils.language_manager - INFO - Language set to: English
[TECH] Language set to: English
════════════════════════════════════════════════════════════
🧪 FROHLICH EXPERIMENT STARTING
════════════════════════════════════════════════════════════
Experiment ID: 71488ce1
Participants: 3
Language: English
Max Phase 2 rounds: 10
Configuration file: hypothesis_2_american_condition_26_config.yaml
Started at: 16:41:40

[DEBUG] ✅ FORMAL VOTING: Using structured consensus building with confirmation and secret ballot
[DEBUG]    • Voting initiated via end-of-round prompts only
[DEBUG]    • Voting requires confirmation from all participants
[DEBUG]    • Consensus reached via unanimous secret ballot
[TECH] Tracing policy: participant-only spans; utility agents untraced
🤖 Initializing Agents...
2025-10-18 16:41:40,444 - experiment_agents.participant_agent - INFO - Creating 3 participant agents with dynamic temperature detection...
2025-10-18 16:41:40,444 - experiment_agents.participant_agent - INFO - Creating agent: Agent_1 (model: openai/gpt-oss-120b, temp: 0.2088977231433743)
2025-10-18 16:41:40,444 - experiment_agents.participant_agent - INFO - Creating agent Agent_1 with dynamic temperature detection
2025-10-18 16:41:40,464 - utils.language_manager - INFO - Loaded translations for English
2025-10-18 16:41:41,128 - httpx - INFO - HTTP Request: POST https://openrouter.ai/api/v1/chat/completions "HTTP/1.1 200 OK"
2025-10-18 16:41:41,322 - utils.dynamic_model_capabilities - INFO - ✅ openai/gpt-oss-120b supports temperature (discovered during creation)
2025-10-18 16:41:41,322 - experiment_agents.participant_agent - INFO - ✅ Agent_1: Temperature 0.2088977231433743 active (method: successful_creation)
2025-10-18 16:41:41,322 - experiment_agents.participant_agent - INFO - ✅ Successfully initialized agent Agent_1
2025-10-18 16:41:41,322 - experiment_agents.participant_agent - INFO - Creating agent: Agent_2 (model: x-ai/grok-4-fast, temp: 0.2088977231433743)
2025-10-18 16:41:41,322 - experiment_agents.participant_agent - INFO - Creating agent Agent_2 with dynamic temperature detection
2025-10-18 16:41:41,632 - httpx - INFO - HTTP Request: POST https://openrouter.ai/api/v1/chat/completions "HTTP/1.1 200 OK"
2025-10-18 16:41:42,090 - utils.dynamic_model_capabilities - INFO - ✅ x-ai/grok-4-fast supports temperature (discovered during creation)
2025-10-18 16:41:42,091 - experiment_agents.participant_agent - INFO - ✅ Agent_2: Temperature 0.2088977231433743 active (method: successful_creation)
2025-10-18 16:41:42,091 - experiment_agents.participant_agent - INFO - ✅ Successfully initialized agent Agent_2
2025-10-18 16:41:42,091 - experiment_agents.participant_agent - INFO - Creating agent: Agent_3 (model: x-ai/grok-4-fast, temp: 0.2088977231433743)
2025-10-18 16:41:42,091 - experiment_agents.participant_agent - INFO - Creating agent Agent_3 with dynamic temperature detection
2025-10-18 16:41:42,374 - httpx - INFO - HTTP Request: POST https://openrouter.ai/api/v1/chat/completions "HTTP/1.1 200 OK"
2025-10-18 16:41:43,024 - experiment_agents.participant_agent - INFO - ✅ Agent_3: Temperature 0.2088977231433743 active (method: successful_creation)
2025-10-18 16:41:43,024 - experiment_agents.participant_agent - INFO - ✅ Successfully initialized agent Agent_3
2025-10-18 16:41:43,024 - experiment_agents.participant_agent - INFO - ✅ Successfully created 3 participant agents
2025-10-18 16:41:43,024 - experiment_agents.utility_agent - INFO - Creating utility agents with model: gemini-2.0-flash-lite (tracing disabled)
2025-10-18 16:41:43,049 - utils.gemini_client - INFO - Successfully initialized Gemini client with OpenAI-compatible endpoint
2025-10-18 16:41:43,597 - httpx - INFO - HTTP Request: POST https://generativelanguage.googleapis.com/v1beta/openai/chat/completions "HTTP/1.1 200 OK"
2025-10-18 16:41:43,598 - utils.dynamic_model_capabilities - INFO - ✅ gemini-2.0-flash-lite supports temperature (discovered during creation)
2025-10-18 16:41:44,161 - httpx - INFO - HTTP Request: POST https://generativelanguage.googleapis.com/v1beta/openai/chat/completions "HTTP/1.1 200 OK"
2025-10-18 16:41:44,163 - experiment_agents.utility_agent - INFO - ✅ Utility agents initialized successfully
2025-10-18 16:41:44,163 - core.experiment_manager - INFO - ✅ Experiment manager initialized with 3 participants
  ✅ Agent_1 (gpt-oss-120b) [0.0s]
  ✅ Agent_2 (grok-4-fast) [0.0s]
  ✅ Agent_3 (grok-4-fast) [0.0s]

✨ All agents ready in 3.7s

2025-10-18 16:41:44,163 - utils.seed_manager - INFO - Generated seed 1866149029 from configuration hash
2025-10-18 16:41:44,163 - utils.seed_manager - INFO - Experiment random seed set to: 1866149029
[TECH] Experiment seed: 1866149029 (generated)
[TECH] Tracing experiment: Frohlich Experiment - 71488ce1-8784-47fc-a08c-cc78758230a3
[TECH] Trace ID: trace_fc2a4c7faf384c3c97aac21b1adbf5d7
📖 PHASE 1: Individual Familiarization
━━━━━━━━━━━━━━━━━━━━━━━━━━━━━━━━━━━━━━━━━━━━━━━━━━
Running parallel familiarization for 3 participants...

[TECH] Phase 1 executing with language: English
  Agent_1: Initial ranking [██░░░░░░░░░░░░░░░░░░] 10.0%
  Agent_2: Initial ranking [██░░░░░░░░░░░░░░░░░░] 10.0%
  Agent_3: Initial ranking [██░░░░░░░░░░░░░░░░░░] 10.0%
2025-10-18 16:41:44,506 - httpx - INFO - HTTP Request: POST https://openrouter.ai/api/v1/chat/completions "HTTP/1.1 200 OK"
2025-10-18 16:41:44,559 - httpx - INFO - HTTP Request: POST https://openrouter.ai/api/v1/chat/completions "HTTP/1.1 200 OK"
2025-10-18 16:41:44,768 - httpx - INFO - HTTP Request: POST https://openrouter.ai/api/v1/chat/completions "HTTP/1.1 200 OK"
2025-10-18 16:41:45,664 - httpx - INFO - HTTP Request: POST https://api.openai.com/v1/traces/ingest "HTTP/1.1 204 No Content"
2025-10-18 16:41:45,828 - httpx - INFO - HTTP Request: POST https://generativelanguage.googleapis.com/v1beta/openai/chat/completions "HTTP/1.1 200 OK"
2025-10-18 16:41:46,435 - httpx - INFO - HTTP Request: POST https://openrouter.ai/api/v1/chat/completions "HTTP/1.1 200 OK"
  Agent_1: Learning principles [█████░░░░░░░░░░░░░░░] 25.0%
2025-10-18 16:41:47,326 - httpx - INFO - HTTP Request: POST https://generativelanguage.googleapis.com/v1beta/openai/chat/completions "HTTP/1.1 200 OK"
2025-10-18 16:41:47,377 - httpx - INFO - HTTP Request: POST https://generativelanguage.googleapis.com/v1beta/openai/chat/completions "HTTP/1.1 200 OK"
2025-10-18 16:41:47,571 - httpx - INFO - HTTP Request: POST https://openrouter.ai/api/v1/chat/completions "HTTP/1.1 200 OK"
2025-10-18 16:41:47,704 - httpx - INFO - HTTP Request: POST https://openrouter.ai/api/v1/chat/completions "HTTP/1.1 200 OK"
2025-10-18 16:41:47,980 - httpx - INFO - HTTP Request: POST https://openrouter.ai/api/v1/chat/completions "HTTP/1.1 200 OK"
2025-10-18 16:41:48,434 - httpx - INFO - HTTP Request: POST https://openrouter.ai/api/v1/chat/completions "HTTP/1.1 200 OK"
  Agent_3: Learning principles [█████░░░░░░░░░░░░░░░] 25.0%
2025-10-18 16:41:50,494 - httpx - INFO - HTTP Request: POST https://openrouter.ai/api/v1/chat/completions "HTTP/1.1 200 OK"
  Agent_1: Post-explanation ranking [████████░░░░░░░░░░░░] 40.0%
2025-10-18 16:41:51,054 - httpx - INFO - HTTP Request: POST https://openrouter.ai/api/v1/chat/completions "HTTP/1.1 200 OK"
2025-10-18 16:41:51,108 - httpx - INFO - HTTP Request: POST https://api.openai.com/v1/traces/ingest "HTTP/1.1 204 No Content"
  Agent_2: Learning principles [█████░░░░░░░░░░░░░░░] 25.0%
2025-10-18 16:41:52,411 - httpx - INFO - HTTP Request: POST https://generativelanguage.googleapis.com/v1beta/openai/chat/completions "HTTP/1.1 200 OK"
2025-10-18 16:41:52,697 - httpx - INFO - HTTP Request: POST https://openrouter.ai/api/v1/chat/completions "HTTP/1.1 200 OK"
2025-10-18 16:41:52,813 - httpx - INFO - HTTP Request: POST https://openrouter.ai/api/v1/chat/completions "HTTP/1.1 200 OK"
  Agent_1: Application round 1 [██████████░░░░░░░░░░] 50.0%
2025-10-18 16:41:54,614 - httpx - INFO - HTTP Request: POST https://openrouter.ai/api/v1/chat/completions "HTTP/1.1 200 OK"
2025-10-18 16:41:55,090 - httpx - INFO - HTTP Request: POST https://openrouter.ai/api/v1/chat/completions "HTTP/1.1 200 OK"
2025-10-18 16:41:56,556 - httpx - INFO - HTTP Request: POST https://api.openai.com/v1/traces/ingest "HTTP/1.1 204 No Content"
  Agent_3: Post-explanation ranking [████████░░░░░░░░░░░░] 40.0%
2025-10-18 16:41:58,747 - httpx - INFO - HTTP Request: POST https://generativelanguage.googleapis.com/v1beta/openai/chat/completions "HTTP/1.1 200 OK"
2025-10-18 16:41:58,949 - httpx - INFO - HTTP Request: POST https://openrouter.ai/api/v1/chat/completions "HTTP/1.1 200 OK"
2025-10-18 16:41:58,993 - httpx - INFO - HTTP Request: POST https://openrouter.ai/api/v1/chat/completions "HTTP/1.1 200 OK"
2025-10-18 16:41:59,117 - httpx - INFO - HTTP Request: POST https://openrouter.ai/api/v1/chat/completions "HTTP/1.1 200 OK"
  Agent_1: Application round 2 [████████████░░░░░░░░] 60.0%
2025-10-18 16:42:01,294 - httpx - INFO - HTTP Request: POST https://openrouter.ai/api/v1/chat/completions "HTTP/1.1 200 OK"
2025-10-18 16:42:02,073 - httpx - INFO - HTTP Request: POST https://api.openai.com/v1/traces/ingest "HTTP/1.1 204 No Content"
2025-10-18 16:42:02,219 - httpx - INFO - HTTP Request: POST https://generativelanguage.googleapis.com/v1beta/openai/chat/completions "HTTP/1.1 200 OK"
2025-10-18 16:42:02,611 - httpx - INFO - HTTP Request: POST https://openrouter.ai/api/v1/chat/completions "HTTP/1.1 200 OK"
  Agent_2: Post-explanation ranking [████████░░░░░░░░░░░░] 40.0%
2025-10-18 16:42:03,100 - httpx - INFO - HTTP Request: POST https://openrouter.ai/api/v1/chat/completions "HTTP/1.1 200 OK"
2025-10-18 16:42:04,204 - httpx - INFO - HTTP Request: POST https://generativelanguage.googleapis.com/v1beta/openai/chat/completions "HTTP/1.1 200 OK"
2025-10-18 16:42:04,683 - httpx - INFO - HTTP Request: POST https://openrouter.ai/api/v1/chat/completions "HTTP/1.1 200 OK"
  Agent_3: Application round 1 [██████████░░░░░░░░░░] 50.0%
2025-10-18 16:42:06,425 - httpx - INFO - HTTP Request: POST https://generativelanguage.googleapis.com/v1beta/openai/chat/completions "HTTP/1.1 200 OK"
2025-10-18 16:42:06,576 - httpx - INFO - HTTP Request: POST https://openrouter.ai/api/v1/chat/completions "HTTP/1.1 200 OK"
  Agent_1: Application round 3 [██████████████░░░░░░] 70.0%
2025-10-18 16:42:07,001 - httpx - INFO - HTTP Request: POST https://openrouter.ai/api/v1/chat/completions "HTTP/1.1 200 OK"
2025-10-18 16:42:07,130 - httpx - INFO - HTTP Request: POST https://openrouter.ai/api/v1/chat/completions "HTTP/1.1 200 OK"
2025-10-18 16:42:07,584 - httpx - INFO - HTTP Request: POST https://api.openai.com/v1/traces/ingest "HTTP/1.1 204 No Content"
2025-10-18 16:42:07,904 - httpx - INFO - HTTP Request: POST https://api.openai.com/v1/traces/ingest "HTTP/1.1 204 No Content"
2025-10-18 16:42:08,076 - httpx - INFO - HTTP Request: POST https://generativelanguage.googleapis.com/v1beta/openai/chat/completions "HTTP/1.1 200 OK"
2025-10-18 16:42:08,551 - httpx - INFO - HTTP Request: POST https://openrouter.ai/api/v1/chat/completions "HTTP/1.1 200 OK"
2025-10-18 16:42:09,235 - httpx - INFO - HTTP Request: POST https://generativelanguage.googleapis.com/v1beta/openai/chat/completions "HTTP/1.1 200 OK"
2025-10-18 16:42:09,817 - httpx - INFO - HTTP Request: POST https://openrouter.ai/api/v1/chat/completions "HTTP/1.1 200 OK"
  Agent_1: Application round 4 [████████████████░░░░] 80.0%
2025-10-18 16:42:11,012 - httpx - INFO - HTTP Request: POST https://openrouter.ai/api/v1/chat/completions "HTTP/1.1 200 OK"
  Agent_2: Application round 1 [██████████░░░░░░░░░░] 50.0%
2025-10-18 16:42:11,694 - httpx - INFO - HTTP Request: POST https://openrouter.ai/api/v1/chat/completions "HTTP/1.1 200 OK"
2025-10-18 16:42:11,871 - httpx - INFO - HTTP Request: POST https://generativelanguage.googleapis.com/v1beta/openai/chat/completions "HTTP/1.1 200 OK"
2025-10-18 16:42:12,490 - httpx - INFO - HTTP Request: POST https://openrouter.ai/api/v1/chat/completions "HTTP/1.1 200 OK"
2025-10-18 16:42:13,303 - httpx - INFO - HTTP Request: POST https://api.openai.com/v1/traces/ingest "HTTP/1.1 204 No Content"
  Agent_1: Final ranking [██████████████████░░] 90.0%
2025-10-18 16:42:14,429 - httpx - INFO - HTTP Request: POST https://generativelanguage.googleapis.com/v1beta/openai/chat/completions "HTTP/1.1 200 OK"
2025-10-18 16:42:14,931 - httpx - INFO - HTTP Request: POST https://openrouter.ai/api/v1/chat/completions "HTTP/1.1 200 OK"
2025-10-18 16:42:14,962 - httpx - INFO - HTTP Request: POST https://openrouter.ai/api/v1/chat/completions "HTTP/1.1 200 OK"
  Agent_3: Application round 2 [████████████░░░░░░░░] 60.0%
2025-10-18 16:42:16,036 - httpx - INFO - HTTP Request: POST https://generativelanguage.googleapis.com/v1beta/openai/chat/completions "HTTP/1.1 200 OK"
2025-10-18 16:42:16,129 - httpx - INFO - HTTP Request: POST https://openrouter.ai/api/v1/chat/completions "HTTP/1.1 200 OK"
2025-10-18 16:42:16,590 - httpx - INFO - HTTP Request: POST https://openrouter.ai/api/v1/chat/completions "HTTP/1.1 200 OK"
2025-10-18 16:42:17,874 - httpx - INFO - HTTP Request: POST https://generativelanguage.googleapis.com/v1beta/openai/chat/completions "HTTP/1.1 200 OK"
2025-10-18 16:42:18,352 - httpx - INFO - HTTP Request: POST https://openrouter.ai/api/v1/chat/completions "HTTP/1.1 200 OK"
2025-10-18 16:42:19,007 - httpx - INFO - HTTP Request: POST https://api.openai.com/v1/traces/ingest "HTTP/1.1 204 No Content"
  Agent_1: Completed [████████████████████] 100.0%
  Agent_2: Application round 2 [████████████░░░░░░░░] 60.0%
2025-10-18 16:42:24,354 - httpx - INFO - HTTP Request: POST https://openrouter.ai/api/v1/chat/completions "HTTP/1.1 200 OK"
2025-10-18 16:42:24,787 - httpx - INFO - HTTP Request: POST https://api.openai.com/v1/traces/ingest "HTTP/1.1 204 No Content"
  Agent_3: Application round 3 [██████████████░░░░░░] 70.0%
2025-10-18 16:42:27,191 - httpx - INFO - HTTP Request: POST https://openrouter.ai/api/v1/chat/completions "HTTP/1.1 200 OK"
2025-10-18 16:42:27,283 - httpx - INFO - HTTP Request: POST https://generativelanguage.googleapis.com/v1beta/openai/chat/completions "HTTP/1.1 200 OK"
2025-10-18 16:42:27,839 - httpx - INFO - HTTP Request: POST https://openrouter.ai/api/v1/chat/completions "HTTP/1.1 200 OK"
2025-10-18 16:42:29,692 - httpx - INFO - HTTP Request: POST https://generativelanguage.googleapis.com/v1beta/openai/chat/completions "HTTP/1.1 200 OK"
2025-10-18 16:42:30,249 - httpx - INFO - HTTP Request: POST https://api.openai.com/v1/traces/ingest "HTTP/1.1 204 No Content"
2025-10-18 16:42:30,531 - httpx - INFO - HTTP Request: POST https://openrouter.ai/api/v1/chat/completions "HTTP/1.1 200 OK"
  Agent_2: Application round 3 [██████████████░░░░░░] 70.0%
2025-10-18 16:42:36,634 - httpx - INFO - HTTP Request: POST https://openrouter.ai/api/v1/chat/completions "HTTP/1.1 200 OK"
2025-10-18 16:42:39,254 - httpx - INFO - HTTP Request: POST https://generativelanguage.googleapis.com/v1beta/openai/chat/completions "HTTP/1.1 200 OK"
2025-10-18 16:42:39,726 - httpx - INFO - HTTP Request: POST https://openrouter.ai/api/v1/chat/completions "HTTP/1.1 200 OK"
2025-10-18 16:42:40,758 - httpx - INFO - HTTP Request: POST https://api.openai.com/v1/traces/ingest "HTTP/1.1 204 No Content"
  Agent_3: Application round 4 [████████████████░░░░] 80.0%
2025-10-18 16:42:41,454 - httpx - INFO - HTTP Request: POST https://openrouter.ai/api/v1/chat/completions "HTTP/1.1 200 OK"
2025-10-18 16:42:43,929 - httpx - INFO - HTTP Request: POST https://generativelanguage.googleapis.com/v1beta/openai/chat/completions "HTTP/1.1 200 OK"
2025-10-18 16:42:44,335 - httpx - INFO - HTTP Request: POST https://openrouter.ai/api/v1/chat/completions "HTTP/1.1 200 OK"
2025-10-18 16:42:46,196 - httpx - INFO - HTTP Request: POST https://api.openai.com/v1/traces/ingest "HTTP/1.1 204 No Content"
  Agent_2: Application round 4 [████████████████░░░░] 80.0%
2025-10-18 16:42:50,818 - httpx - INFO - HTTP Request: POST https://openrouter.ai/api/v1/chat/completions "HTTP/1.1 200 OK"
2025-10-18 16:42:51,593 - httpx - INFO - HTTP Request: POST https://api.openai.com/v1/traces/ingest "HTTP/1.1 204 No Content"
2025-10-18 16:42:54,459 - httpx - INFO - HTTP Request: POST https://generativelanguage.googleapis.com/v1beta/openai/chat/completions "HTTP/1.1 200 OK"
2025-10-18 16:42:55,059 - httpx - INFO - HTTP Request: POST https://openrouter.ai/api/v1/chat/completions "HTTP/1.1 200 OK"
2025-10-18 16:42:56,984 - httpx - INFO - HTTP Request: POST https://api.openai.com/v1/traces/ingest "HTTP/1.1 204 No Content"
  Agent_3: Final ranking [██████████████████░░] 90.0%
2025-10-18 16:42:59,563 - httpx - INFO - HTTP Request: POST https://openrouter.ai/api/v1/chat/completions "HTTP/1.1 200 OK"
2025-10-18 16:43:01,790 - httpx - INFO - HTTP Request: POST https://generativelanguage.googleapis.com/v1beta/openai/chat/completions "HTTP/1.1 200 OK"
2025-10-18 16:43:02,139 - httpx - INFO - HTTP Request: POST https://openrouter.ai/api/v1/chat/completions "HTTP/1.1 200 OK"
2025-10-18 16:43:02,457 - httpx - INFO - HTTP Request: POST https://api.openai.com/v1/traces/ingest "HTTP/1.1 204 No Content"
  Agent_2: Final ranking [██████████████████░░] 90.0%
2025-10-18 16:43:07,908 - httpx - INFO - HTTP Request: POST https://api.openai.com/v1/traces/ingest "HTTP/1.1 204 No Content"
2025-10-18 16:43:07,962 - httpx - INFO - HTTP Request: POST https://openrouter.ai/api/v1/chat/completions "HTTP/1.1 200 OK"
2025-10-18 16:43:10,315 - httpx - INFO - HTTP Request: POST https://generativelanguage.googleapis.com/v1beta/openai/chat/completions "HTTP/1.1 200 OK"
2025-10-18 16:43:10,899 - httpx - INFO - HTTP Request: POST https://openrouter.ai/api/v1/chat/completions "HTTP/1.1 200 OK"
2025-10-18 16:43:13,327 - httpx - INFO - HTTP Request: POST https://api.openai.com/v1/traces/ingest "HTTP/1.1 204 No Content"
  Agent_3: Completed [████████████████████] 100.0%
2025-10-18 16:43:18,812 - httpx - INFO - HTTP Request: POST https://api.openai.com/v1/traces/ingest "HTTP/1.1 204 No Content"
  Agent_2: Completed [████████████████████] 100.0%

 Phase 1 Complete - Duration: 1m 40s
  Agent_1: $7.60 earned
  Agent_2: $7.00 earned
  Agent_3: $7.40 earned

💬 PHASE 2: Group Discussion
━━━━━━━━━━━━━━━━━━━━━━━━━━━━━━━━━━━━━━━━━━━━━━━━━━
Beginning group discussion (max 10 rounds)...

🗣️  Round 1 (1/10)
   Speaking order: Agent_1 → Agent_2 → Agent_3
   💭 Agent_1 is thinking...
2025-10-18 16:43:25,507 - httpx - INFO - HTTP Request: POST https://openrouter.ai/api/v1/chat/completions "HTTP/1.1 200 OK"
2025-10-18 16:43:29,097 - httpx - INFO - HTTP Request: POST https://openrouter.ai/api/v1/chat/completions "HTTP/1.1 200 OK"
2025-10-18 16:43:29,361 - httpx - INFO - HTTP Request: POST https://api.openai.com/v1/traces/ingest "HTTP/1.1 204 No Content"
   ✅ Agent_1 responded (1553 chars) [5.3s]
2025-10-18 16:43:31,022 - httpx - INFO - HTTP Request: POST https://generativelanguage.googleapis.com/v1beta/openai/chat/completions "HTTP/1.1 200 OK"
   💭 Agent_2 is thinking...
2025-10-18 16:43:31,659 - httpx - INFO - HTTP Request: POST https://openrouter.ai/api/v1/chat/completions "HTTP/1.1 200 OK"
2025-10-18 16:43:34,877 - httpx - INFO - HTTP Request: POST https://api.openai.com/v1/traces/ingest "HTTP/1.1 204 No Content"
2025-10-18 16:43:41,661 - httpx - INFO - HTTP Request: POST https://openrouter.ai/api/v1/chat/completions "HTTP/1.1 200 OK"
   ✅ Agent_2 responded (1252 chars) [13.3s]
2025-10-18 16:43:45,080 - httpx - INFO - HTTP Request: POST https://generativelanguage.googleapis.com/v1beta/openai/chat/completions "HTTP/1.1 200 OK"
   💭 Agent_3 is thinking...
2025-10-18 16:43:45,443 - httpx - INFO - HTTP Request: POST https://api.openai.com/v1/traces/ingest "HTTP/1.1 204 No Content"
2025-10-18 16:43:45,771 - httpx - INFO - HTTP Request: POST https://openrouter.ai/api/v1/chat/completions "HTTP/1.1 200 OK"
2025-10-18 16:43:57,207 - httpx - INFO - HTTP Request: POST https://openrouter.ai/api/v1/chat/completions "HTTP/1.1 200 OK"
   ✅ Agent_3 responded (1351 chars) [14.9s]
2025-10-18 16:44:00,930 - httpx - INFO - HTTP Request: POST https://generativelanguage.googleapis.com/v1beta/openai/chat/completions "HTTP/1.1 200 OK"
2025-10-18 16:44:01,069 - httpx - INFO - HTTP Request: POST https://api.openai.com/v1/traces/ingest "HTTP/1.1 204 No Content"
2025-10-18 16:44:01,523 - httpx - INFO - HTTP Request: POST https://openrouter.ai/api/v1/chat/completions "HTTP/1.1 200 OK"
2025-10-18 16:44:03,995 - httpx - INFO - HTTP Request: POST https://openrouter.ai/api/v1/chat/completions "HTTP/1.1 200 OK"
2025-10-18 16:44:06,482 - httpx - INFO - HTTP Request: POST https://api.openai.com/v1/traces/ingest "HTTP/1.1 204 No Content"
2025-10-18 16:44:21,425 - httpx - INFO - HTTP Request: POST https://openrouter.ai/api/v1/chat/completions "HTTP/1.1 200 OK"
2025-10-18 16:44:22,121 - httpx - INFO - HTTP Request: POST https://api.openai.com/v1/traces/ingest "HTTP/1.1 204 No Content"
2025-10-18 16:44:39,099 - httpx - INFO - HTTP Request: POST https://openrouter.ai/api/v1/chat/completions "HTTP/1.1 200 OK"
🗳️  Voting initiated (Round 1)
2025-10-18 16:44:39,891 - httpx - INFO - HTTP Request: POST https://openrouter.ai/api/v1/chat/completions "HTTP/1.1 200 OK"
2025-10-18 16:44:42,133 - httpx - INFO - HTTP Request: POST https://openrouter.ai/api/v1/chat/completions "HTTP/1.1 200 OK"
2025-10-18 16:44:42,987 - httpx - INFO - HTTP Request: POST https://api.openai.com/v1/traces/ingest "HTTP/1.1 204 No Content"
2025-10-18 16:44:43,399 - core.two_stage_voting_manager - INFO - Starting two-stage voting for Agent_1
2025-10-18 16:44:43,890 - httpx - INFO - HTTP Request: POST https://openrouter.ai/api/v1/chat/completions "HTTP/1.1 200 OK"
2025-10-18 16:44:45,359 - core.two_stage_voting_manager - INFO - Two-stage voting success - Agent_1 principle_selection: '1' -> 1 (attempt 1)
2025-10-18 16:44:45,360 - core.two_stage_voting_manager - INFO - Completed two-stage voting for Agent_1: principle 1, amount None
2025-10-18 16:44:45,360 - core.two_stage_voting_manager - INFO - Starting two-stage voting for Agent_2
2025-10-18 16:44:45,865 - httpx - INFO - HTTP Request: POST https://openrouter.ai/api/v1/chat/completions "HTTP/1.1 200 OK"
2025-10-18 16:44:47,217 - core.two_stage_voting_manager - INFO - Two-stage voting success - Agent_2 principle_selection: '1' -> 1 (attempt 1)
2025-10-18 16:44:47,217 - core.two_stage_voting_manager - INFO - Completed two-stage voting for Agent_2: principle 1, amount None
2025-10-18 16:44:47,217 - core.two_stage_voting_manager - INFO - Starting two-stage voting for Agent_3
2025-10-18 16:44:48,035 - httpx - INFO - HTTP Request: POST https://openrouter.ai/api/v1/chat/completions "HTTP/1.1 200 OK"
2025-10-18 16:44:48,525 - httpx - INFO - HTTP Request: POST https://api.openai.com/v1/traces/ingest "HTTP/1.1 204 No Content"
2025-10-18 16:44:48,961 - core.two_stage_voting_manager - INFO - Two-stage voting success - Agent_3 principle_selection: '1' -> 1 (attempt 1)
2025-10-18 16:44:48,961 - core.two_stage_voting_manager - INFO - Completed two-stage voting for Agent_3: principle 1, amount None
2025-10-18 16:44:48,961 - core.two_stage_voting_manager - INFO - Two-stage voting completed successfully for all participants
2025-10-18 16:44:48,961 - core.two_stage_voting_manager - INFO - Consensus reached: maximizing_floor with constraint None
 Consensus Reached! Principle: maximizing_floor

2025-10-18 16:44:48,963 - utils.language_manager - INFO - Language set to: English
2025-10-18 16:44:48,965 - utils.language_manager - INFO - Loaded translations for English
2025-10-18 16:44:49,500 - httpx - INFO - HTTP Request: POST https://openrouter.ai/api/v1/chat/completions "HTTP/1.1 200 OK"
2025-10-18 16:44:53,941 - httpx - INFO - HTTP Request: POST https://api.openai.com/v1/traces/ingest "HTTP/1.1 204 No Content"
2025-10-18 16:44:56,722 - utils.language_manager - INFO - Language set to: English
2025-10-18 16:44:56,724 - utils.language_manager - INFO - Loaded translations for English
2025-10-18 16:44:58,531 - httpx - INFO - HTTP Request: POST https://openrouter.ai/api/v1/chat/completions "HTTP/1.1 200 OK"
2025-10-18 16:44:59,341 - httpx - INFO - HTTP Request: POST https://api.openai.com/v1/traces/ingest "HTTP/1.1 204 No Content"
2025-10-18 16:45:20,300 - utils.language_manager - INFO - Language set to: English
2025-10-18 16:45:20,302 - utils.language_manager - INFO - Loaded translations for English
2025-10-18 16:45:20,304 - utils.memory_manager - INFO - Memory approaching limit for Agent_3, attempting compression...
2025-10-18 16:45:22,485 - httpx - INFO - HTTP Request: POST https://openrouter.ai/api/v1/chat/completions "HTTP/1.1 200 OK"
2025-10-18 16:45:25,240 - httpx - INFO - HTTP Request: POST https://api.openai.com/v1/traces/ingest "HTTP/1.1 204 No Content"
2025-10-18 16:45:34,641 - utils.memory_manager - INFO - Memory compressed from 21248 to 10270 characters
2025-10-18 16:45:35,142 - httpx - INFO - HTTP Request: POST https://openrouter.ai/api/v1/chat/completions "HTTP/1.1 200 OK"
2025-10-18 16:45:35,756 - httpx - INFO - HTTP Request: POST https://api.openai.com/v1/traces/ingest "HTTP/1.1 204 No Content"
2025-10-18 16:45:49,684 - httpx - INFO - HTTP Request: POST https://openrouter.ai/api/v1/chat/completions "HTTP/1.1 200 OK"
2025-10-18 16:45:49,753 - httpx - INFO - HTTP Request: POST https://openrouter.ai/api/v1/chat/completions "HTTP/1.1 200 OK"
2025-10-18 16:45:49,825 - httpx - INFO - HTTP Request: POST https://openrouter.ai/api/v1/chat/completions "HTTP/1.1 200 OK"
2025-10-18 16:45:51,141 - httpx - INFO - HTTP Request: POST https://generativelanguage.googleapis.com/v1beta/openai/chat/completions "HTTP/1.1 200 OK"
2025-10-18 16:45:51,362 - httpx - INFO - HTTP Request: POST https://api.openai.com/v1/traces/ingest "HTTP/1.1 204 No Content"
2025-10-18 16:45:51,688 - httpx - INFO - HTTP Request: POST https://api.openai.com/v1/traces/ingest "HTTP/1.1 204 No Content"
2025-10-18 16:45:52,129 - httpx - INFO - HTTP Request: POST https://generativelanguage.googleapis.com/v1beta/openai/chat/completions "HTTP/1.1 200 OK"
2025-10-18 16:45:52,188 - httpx - INFO - HTTP Request: POST https://generativelanguage.googleapis.com/v1beta/openai/chat/completions "HTTP/1.1 200 OK"
 Phase 2 Complete with consensus - Duration: 2m 27s
   Rounds conducted: 1
   Final earnings:
     Agent_1: $7.09
     Agent_2: $7.46
     Agent_3: $5.59

[TECH] Experiment 71488ce1-8784-47fc-a08c-cc78758230a3 completed successfully in 248.03 seconds
2025-10-18 16:45:52,829 - httpx - INFO - HTTP Request: POST https://generativelanguage.googleapis.com/v1beta/openai/chat/completions "HTTP/1.1 200 OK"
[TECH] Consensus validation successful - discussion aligns with recorded consensus
[TECH] Transcript saved to: /Users/lucasmuller/Desktop/Githubg/Rawls_v3/transcript_71488ce1-8784-47fc-a08c-cc78758230a3.json
2025-10-18 16:45:52,836 - core.experiment_manager - INFO - Results saved to: /Users/lucasmuller/Desktop/Githubg/Rawls_v3/hypothesis_testing/hypothesis_2/results/american/hypothesis_2_american_condition_26_config_results.json
2025-10-18 16:45:52,836 - core.experiment_manager - INFO - Seed used: 1866149029 (generated)
[TECH] Results saved to: /Users/lucasmuller/Desktop/Githubg/Rawls_v3/hypothesis_testing/hypothesis_2/results/american/hypothesis_2_american_condition_26_config_results.json
[DEBUG] Trace: https://platform.openai.com/logs/trace?trace_id=trace_fc2a4c7faf384c3c97aac21b1adbf5d7
════════════════════════════════════════════════════════════
✅ EXPERIMENT COMPLETED
════════════════════════════════════════════════════════════
Total Duration: 4m 12s
Consensus: ✅ maximizing_floor
Transcript saved: /Users/lucasmuller/Desktop/Githubg/Rawls_v3/transcript_71488ce1-8784-47fc-a08c-cc78758230a3.json
Errors: None
Results saved: /Users/lucasmuller/Desktop/Githubg/Rawls_v3/hypothesis_testing/hypothesis_2/results/american/hypothesis_2_american_condition_26_config_results.json
🔗 Trace: https://platform.openai.com/logs/trace?trace_id=trace_fc2a4c7faf384c3c97aac21b1adbf5d7


Frohlich Experiment Results (ID: 71488ce1-8784-47fc-a08c-cc78758230a3)
Completed in 248.03 seconds

PHASE 1 RESULTS:
  Agent_1: $7.60 (Initial pref: maximizing_floor, Final pref: maximizing_floor)
  Agent_2: $7.00 (Initial pref: maximizing_floor, Final pref: maximizing_floor)
  Agent_3: $7.40 (Initial pref: maximizing_floor, Final pref: maximizing_floor)
  Average Phase 1 earnings: $7.33

PHASE 2 RESULTS:
  Consensus reached on: maximizing_floor
  Rounds to consensus: 1
  Phase 2 earnings:
    Agent_1: $7.09
    Agent_2: $7.46
    Agent_3: $5.59
  Average Phase 2 earnings: $6.71

TOTAL EARNINGS:
  Agent_1: $14.69
  Agent_2: $14.46
  Agent_3: $12.99

HIGHEST EARNER: Agent_1 with $14.69

RETURN CODE: 0  DURATION: 253.2s
