CMD: /Users/lucasmuller/Desktop/Githubg/Rawls_v3/.venv/bin/python /Users/lucasmuller/Desktop/Githubg/Rawls_v3/main.py /Users/lucasmuller/Desktop/Githubg/Rawls_v3/hypothesis_testing/hypothesis_2/configs/american/hypothesis_2_american_condition_21_config.yaml /Users/lucasmuller/Desktop/Githubg/Rawls_v3/hypothesis_testing/hypothesis_2/results/american/hypothesis_2_american_condition_21_config_results.json
[TECH] Loading configuration from: /Users/lucasmuller/Desktop/Githubg/Rawls_v3/hypothesis_testing/hypothesis_2/configs/american/hypothesis_2_american_condition_21_config.yaml
2025-10-18 16:36:39,875 - utils.seed_manager - INFO - Generated seed 1831307698 from configuration hash
2025-10-18 16:36:39,876 - utils.language_manager - INFO - Language set to: English
[TECH] Language set to: English
════════════════════════════════════════════════════════════
🧪 FROHLICH EXPERIMENT STARTING
════════════════════════════════════════════════════════════
Experiment ID: dc7e2d3c
Participants: 3
Language: English
Max Phase 2 rounds: 10
Configuration file: hypothesis_2_american_condition_21_config.yaml
Started at: 16:36:39

[DEBUG] ✅ FORMAL VOTING: Using structured consensus building with confirmation and secret ballot
[DEBUG]    • Voting initiated via end-of-round prompts only
[DEBUG]    • Voting requires confirmation from all participants
[DEBUG]    • Consensus reached via unanimous secret ballot
[TECH] Tracing policy: participant-only spans; utility agents untraced
🤖 Initializing Agents...
2025-10-18 16:36:39,876 - experiment_agents.participant_agent - INFO - Creating 3 participant agents with dynamic temperature detection...
2025-10-18 16:36:39,876 - experiment_agents.participant_agent - INFO - Creating agent: Agent_1 (model: openai/gpt-oss-120b, temp: 0.47217217295409364)
2025-10-18 16:36:39,876 - experiment_agents.participant_agent - INFO - Creating agent Agent_1 with dynamic temperature detection
2025-10-18 16:36:39,893 - utils.language_manager - INFO - Loaded translations for English
2025-10-18 16:36:40,558 - httpx - INFO - HTTP Request: POST https://openrouter.ai/api/v1/chat/completions "HTTP/1.1 200 OK"
2025-10-18 16:36:40,732 - utils.dynamic_model_capabilities - INFO - ✅ openai/gpt-oss-120b supports temperature (discovered during creation)
2025-10-18 16:36:40,732 - experiment_agents.participant_agent - INFO - ✅ Agent_1: Temperature 0.47217217295409364 active (method: successful_creation)
2025-10-18 16:36:40,732 - experiment_agents.participant_agent - INFO - ✅ Successfully initialized agent Agent_1
2025-10-18 16:36:40,732 - experiment_agents.participant_agent - INFO - Creating agent: Agent_2 (model: openai/gpt-oss-120b, temp: 0.47217217295409364)
2025-10-18 16:36:40,732 - experiment_agents.participant_agent - INFO - Creating agent Agent_2 with dynamic temperature detection
2025-10-18 16:36:41,120 - httpx - INFO - HTTP Request: POST https://openrouter.ai/api/v1/chat/completions "HTTP/1.1 200 OK"
2025-10-18 16:36:41,229 - experiment_agents.participant_agent - INFO - ✅ Agent_2: Temperature 0.47217217295409364 active (method: successful_creation)
2025-10-18 16:36:41,229 - experiment_agents.participant_agent - INFO - ✅ Successfully initialized agent Agent_2
2025-10-18 16:36:41,229 - experiment_agents.participant_agent - INFO - Creating agent: Agent_3 (model: x-ai/grok-4-fast, temp: 0.47217217295409364)
2025-10-18 16:36:41,229 - experiment_agents.participant_agent - INFO - Creating agent Agent_3 with dynamic temperature detection
2025-10-18 16:36:41,532 - httpx - INFO - HTTP Request: POST https://openrouter.ai/api/v1/chat/completions "HTTP/1.1 200 OK"
2025-10-18 16:36:42,106 - utils.dynamic_model_capabilities - INFO - ✅ x-ai/grok-4-fast supports temperature (discovered during creation)
2025-10-18 16:36:42,106 - experiment_agents.participant_agent - INFO - ✅ Agent_3: Temperature 0.47217217295409364 active (method: successful_creation)
2025-10-18 16:36:42,106 - experiment_agents.participant_agent - INFO - ✅ Successfully initialized agent Agent_3
2025-10-18 16:36:42,106 - experiment_agents.participant_agent - INFO - ✅ Successfully created 3 participant agents
2025-10-18 16:36:42,106 - experiment_agents.utility_agent - INFO - Creating utility agents with model: gemini-2.0-flash-lite (tracing disabled)
2025-10-18 16:36:42,143 - utils.gemini_client - INFO - Successfully initialized Gemini client with OpenAI-compatible endpoint
2025-10-18 16:36:42,753 - httpx - INFO - HTTP Request: POST https://generativelanguage.googleapis.com/v1beta/openai/chat/completions "HTTP/1.1 200 OK"
2025-10-18 16:36:42,757 - utils.dynamic_model_capabilities - INFO - ✅ gemini-2.0-flash-lite supports temperature (discovered during creation)
2025-10-18 16:36:43,327 - httpx - INFO - HTTP Request: POST https://generativelanguage.googleapis.com/v1beta/openai/chat/completions "HTTP/1.1 200 OK"
2025-10-18 16:36:43,329 - experiment_agents.utility_agent - INFO - ✅ Utility agents initialized successfully
2025-10-18 16:36:43,329 - core.experiment_manager - INFO - ✅ Experiment manager initialized with 3 participants
  ✅ Agent_1 (gpt-oss-120b) [0.0s]
  ✅ Agent_2 (gpt-oss-120b) [0.0s]
  ✅ Agent_3 (grok-4-fast) [0.0s]

✨ All agents ready in 3.5s

2025-10-18 16:36:43,329 - utils.seed_manager - INFO - Generated seed 1831307698 from configuration hash
2025-10-18 16:36:43,329 - utils.seed_manager - INFO - Experiment random seed set to: 1831307698
[TECH] Experiment seed: 1831307698 (generated)
[TECH] Tracing experiment: Frohlich Experiment - dc7e2d3c-557e-4474-bd63-461907dde53e
[TECH] Trace ID: trace_a347b8f210c94bceb04186feda169fe0
📖 PHASE 1: Individual Familiarization
━━━━━━━━━━━━━━━━━━━━━━━━━━━━━━━━━━━━━━━━━━━━━━━━━━
Running parallel familiarization for 3 participants...

[TECH] Phase 1 executing with language: English
  Agent_1: Initial ranking [██░░░░░░░░░░░░░░░░░░] 10.0%
  Agent_2: Initial ranking [██░░░░░░░░░░░░░░░░░░] 10.0%
  Agent_3: Initial ranking [██░░░░░░░░░░░░░░░░░░] 10.0%
2025-10-18 16:36:43,675 - httpx - INFO - HTTP Request: POST https://openrouter.ai/api/v1/chat/completions "HTTP/1.1 200 OK"
2025-10-18 16:36:43,728 - httpx - INFO - HTTP Request: POST https://openrouter.ai/api/v1/chat/completions "HTTP/1.1 200 OK"
2025-10-18 16:36:43,765 - httpx - INFO - HTTP Request: POST https://openrouter.ai/api/v1/chat/completions "HTTP/1.1 200 OK"
2025-10-18 16:36:44,905 - httpx - INFO - HTTP Request: POST https://generativelanguage.googleapis.com/v1beta/openai/chat/completions "HTTP/1.1 200 OK"
2025-10-18 16:36:45,034 - httpx - INFO - HTTP Request: POST https://api.openai.com/v1/traces/ingest "HTTP/1.1 204 No Content"
2025-10-18 16:36:45,224 - httpx - INFO - HTTP Request: POST https://generativelanguage.googleapis.com/v1beta/openai/chat/completions "HTTP/1.1 200 OK"
2025-10-18 16:36:45,281 - httpx - INFO - HTTP Request: POST https://openrouter.ai/api/v1/chat/completions "HTTP/1.1 200 OK"
2025-10-18 16:36:45,594 - httpx - INFO - HTTP Request: POST https://openrouter.ai/api/v1/chat/completions "HTTP/1.1 200 OK"
  Agent_1: Learning principles [█████░░░░░░░░░░░░░░░] 25.0%
  Agent_2: Learning principles [█████░░░░░░░░░░░░░░░] 25.0%
2025-10-18 16:36:46,350 - httpx - INFO - HTTP Request: POST https://openrouter.ai/api/v1/chat/completions "HTTP/1.1 200 OK"
2025-10-18 16:36:46,603 - httpx - INFO - HTTP Request: POST https://openrouter.ai/api/v1/chat/completions "HTTP/1.1 200 OK"
2025-10-18 16:36:46,747 - httpx - INFO - HTTP Request: POST https://generativelanguage.googleapis.com/v1beta/openai/chat/completions "HTTP/1.1 200 OK"
2025-10-18 16:36:47,063 - httpx - INFO - HTTP Request: POST https://openrouter.ai/api/v1/chat/completions "HTTP/1.1 200 OK"
  Agent_3: Learning principles [█████░░░░░░░░░░░░░░░] 25.0%
2025-10-18 16:36:49,652 - httpx - INFO - HTTP Request: POST https://openrouter.ai/api/v1/chat/completions "HTTP/1.1 200 OK"
2025-10-18 16:36:50,198 - httpx - INFO - HTTP Request: POST https://openrouter.ai/api/v1/chat/completions "HTTP/1.1 200 OK"
2025-10-18 16:36:50,483 - httpx - INFO - HTTP Request: POST https://api.openai.com/v1/traces/ingest "HTTP/1.1 204 No Content"
  Agent_2: Post-explanation ranking [████████░░░░░░░░░░░░] 40.0%
2025-10-18 16:36:50,902 - httpx - INFO - HTTP Request: POST https://openrouter.ai/api/v1/chat/completions "HTTP/1.1 200 OK"
2025-10-18 16:36:51,169 - httpx - INFO - HTTP Request: POST https://openrouter.ai/api/v1/chat/completions "HTTP/1.1 200 OK"
  Agent_1: Post-explanation ranking [████████░░░░░░░░░░░░] 40.0%
2025-10-18 16:36:51,815 - httpx - INFO - HTTP Request: POST https://openrouter.ai/api/v1/chat/completions "HTTP/1.1 200 OK"
2025-10-18 16:36:53,079 - httpx - INFO - HTTP Request: POST https://generativelanguage.googleapis.com/v1beta/openai/chat/completions "HTTP/1.1 200 OK"
2025-10-18 16:36:53,462 - httpx - INFO - HTTP Request: POST https://openrouter.ai/api/v1/chat/completions "HTTP/1.1 200 OK"
  Agent_1: Application round 1 [██████████░░░░░░░░░░] 50.0%
2025-10-18 16:36:55,127 - httpx - INFO - HTTP Request: POST https://generativelanguage.googleapis.com/v1beta/openai/chat/completions "HTTP/1.1 200 OK"
2025-10-18 16:36:55,303 - httpx - INFO - HTTP Request: POST https://openrouter.ai/api/v1/chat/completions "HTTP/1.1 200 OK"
2025-10-18 16:36:55,514 - httpx - INFO - HTTP Request: POST https://openrouter.ai/api/v1/chat/completions "HTTP/1.1 200 OK"
2025-10-18 16:36:55,954 - httpx - INFO - HTTP Request: POST https://openrouter.ai/api/v1/chat/completions "HTTP/1.1 200 OK"
2025-10-18 16:36:56,115 - httpx - INFO - HTTP Request: POST https://api.openai.com/v1/traces/ingest "HTTP/1.1 204 No Content"
  Agent_2: Application round 1 [██████████░░░░░░░░░░] 50.0%
2025-10-18 16:36:56,867 - httpx - INFO - HTTP Request: POST https://openrouter.ai/api/v1/chat/completions "HTTP/1.1 200 OK"
2025-10-18 16:36:57,795 - httpx - INFO - HTTP Request: POST https://generativelanguage.googleapis.com/v1beta/openai/chat/completions "HTTP/1.1 200 OK"
2025-10-18 16:36:58,191 - httpx - INFO - HTTP Request: POST https://openrouter.ai/api/v1/chat/completions "HTTP/1.1 200 OK"
2025-10-18 16:36:58,472 - httpx - INFO - HTTP Request: POST https://generativelanguage.googleapis.com/v1beta/openai/chat/completions "HTTP/1.1 200 OK"
2025-10-18 16:36:58,841 - httpx - INFO - HTTP Request: POST https://openrouter.ai/api/v1/chat/completions "HTTP/1.1 200 OK"
  Agent_2: Application round 2 [████████████░░░░░░░░] 60.0%
2025-10-18 16:37:00,137 - httpx - INFO - HTTP Request: POST https://openrouter.ai/api/v1/chat/completions "HTTP/1.1 200 OK"
  Agent_3: Post-explanation ranking [████████░░░░░░░░░░░░] 40.0%
2025-10-18 16:37:01,063 - httpx - INFO - HTTP Request: POST https://openrouter.ai/api/v1/chat/completions "HTTP/1.1 200 OK"
2025-10-18 16:37:01,422 - httpx - INFO - HTTP Request: POST https://generativelanguage.googleapis.com/v1beta/openai/chat/completions "HTTP/1.1 200 OK"
  Agent_1: Application round 2 [████████████░░░░░░░░] 60.0%
2025-10-18 16:37:01,639 - httpx - INFO - HTTP Request: POST https://api.openai.com/v1/traces/ingest "HTTP/1.1 204 No Content"
2025-10-18 16:37:01,870 - httpx - INFO - HTTP Request: POST https://openrouter.ai/api/v1/chat/completions "HTTP/1.1 200 OK"
2025-10-18 16:37:01,945 - httpx - INFO - HTTP Request: POST https://api.openai.com/v1/traces/ingest "HTTP/1.1 204 No Content"
2025-10-18 16:37:02,079 - httpx - INFO - HTTP Request: POST https://openrouter.ai/api/v1/chat/completions "HTTP/1.1 200 OK"
2025-10-18 16:37:04,043 - httpx - INFO - HTTP Request: POST https://generativelanguage.googleapis.com/v1beta/openai/chat/completions "HTTP/1.1 200 OK"
2025-10-18 16:37:04,319 - httpx - INFO - HTTP Request: POST https://openrouter.ai/api/v1/chat/completions "HTTP/1.1 200 OK"
  Agent_2: Application round 3 [██████████████░░░░░░] 70.0%
2025-10-18 16:37:04,939 - httpx - INFO - HTTP Request: POST https://generativelanguage.googleapis.com/v1beta/openai/chat/completions "HTTP/1.1 200 OK"
2025-10-18 16:37:04,954 - httpx - INFO - HTTP Request: POST https://openrouter.ai/api/v1/chat/completions "HTTP/1.1 200 OK"
2025-10-18 16:37:05,442 - httpx - INFO - HTTP Request: POST https://openrouter.ai/api/v1/chat/completions "HTTP/1.1 200 OK"
2025-10-18 16:37:05,826 - httpx - INFO - HTTP Request: POST https://generativelanguage.googleapis.com/v1beta/openai/chat/completions "HTTP/1.1 200 OK"
2025-10-18 16:37:06,390 - httpx - INFO - HTTP Request: POST https://openrouter.ai/api/v1/chat/completions "HTTP/1.1 200 OK"
2025-10-18 16:37:07,469 - httpx - INFO - HTTP Request: POST https://api.openai.com/v1/traces/ingest "HTTP/1.1 204 No Content"
  Agent_1: Application round 3 [██████████████░░░░░░] 70.0%
2025-10-18 16:37:07,941 - httpx - INFO - HTTP Request: POST https://openrouter.ai/api/v1/chat/completions "HTTP/1.1 200 OK"
  Agent_3: Application round 1 [██████████░░░░░░░░░░] 50.0%
2025-10-18 16:37:08,802 - httpx - INFO - HTTP Request: POST https://openrouter.ai/api/v1/chat/completions "HTTP/1.1 200 OK"
  Agent_2: Application round 4 [████████████████░░░░] 80.0%
2025-10-18 16:37:09,340 - httpx - INFO - HTTP Request: POST https://openrouter.ai/api/v1/chat/completions "HTTP/1.1 200 OK"
2025-10-18 16:37:10,220 - httpx - INFO - HTTP Request: POST https://generativelanguage.googleapis.com/v1beta/openai/chat/completions "HTTP/1.1 200 OK"
2025-10-18 16:37:10,532 - httpx - INFO - HTTP Request: POST https://generativelanguage.googleapis.com/v1beta/openai/chat/completions "HTTP/1.1 200 OK"
2025-10-18 16:37:10,661 - httpx - INFO - HTTP Request: POST https://openrouter.ai/api/v1/chat/completions "HTTP/1.1 200 OK"
2025-10-18 16:37:10,932 - httpx - INFO - HTTP Request: POST https://openrouter.ai/api/v1/chat/completions "HTTP/1.1 200 OK"
  Agent_2: Final ranking [██████████████████░░] 90.0%
2025-10-18 16:37:12,822 - httpx - INFO - HTTP Request: POST https://openrouter.ai/api/v1/chat/completions "HTTP/1.1 200 OK"
  Agent_1: Application round 4 [████████████████░░░░] 80.0%
2025-10-18 16:37:12,977 - httpx - INFO - HTTP Request: POST https://api.openai.com/v1/traces/ingest "HTTP/1.1 204 No Content"
2025-10-18 16:37:13,316 - httpx - INFO - HTTP Request: POST https://api.openai.com/v1/traces/ingest "HTTP/1.1 204 No Content"
2025-10-18 16:37:13,468 - httpx - INFO - HTTP Request: POST https://openrouter.ai/api/v1/chat/completions "HTTP/1.1 200 OK"
2025-10-18 16:37:13,566 - httpx - INFO - HTTP Request: POST https://generativelanguage.googleapis.com/v1beta/openai/chat/completions "HTTP/1.1 200 OK"
2025-10-18 16:37:14,075 - httpx - INFO - HTTP Request: POST https://openrouter.ai/api/v1/chat/completions "HTTP/1.1 200 OK"
2025-10-18 16:37:15,292 - httpx - INFO - HTTP Request: POST https://generativelanguage.googleapis.com/v1beta/openai/chat/completions "HTTP/1.1 200 OK"
2025-10-18 16:37:15,659 - httpx - INFO - HTTP Request: POST https://openrouter.ai/api/v1/chat/completions "HTTP/1.1 200 OK"
2025-10-18 16:37:17,173 - httpx - INFO - HTTP Request: POST https://generativelanguage.googleapis.com/v1beta/openai/chat/completions "HTTP/1.1 200 OK"
  Agent_2: Completed [████████████████████] 100.0%
2025-10-18 16:37:17,636 - httpx - INFO - HTTP Request: POST https://openrouter.ai/api/v1/chat/completions "HTTP/1.1 200 OK"
2025-10-18 16:37:18,874 - httpx - INFO - HTTP Request: POST https://api.openai.com/v1/traces/ingest "HTTP/1.1 204 No Content"
  Agent_3: Application round 2 [████████████░░░░░░░░] 60.0%
2025-10-18 16:37:20,994 - httpx - INFO - HTTP Request: POST https://openrouter.ai/api/v1/chat/completions "HTTP/1.1 200 OK"
  Agent_1: Final ranking [██████████████████░░] 90.0%
2025-10-18 16:37:21,689 - httpx - INFO - HTTP Request: POST https://openrouter.ai/api/v1/chat/completions "HTTP/1.1 200 OK"
2025-10-18 16:37:24,318 - httpx - INFO - HTTP Request: POST https://api.openai.com/v1/traces/ingest "HTTP/1.1 204 No Content"
2025-10-18 16:37:24,493 - httpx - INFO - HTTP Request: POST https://generativelanguage.googleapis.com/v1beta/openai/chat/completions "HTTP/1.1 200 OK"
2025-10-18 16:37:25,044 - httpx - INFO - HTTP Request: POST https://openrouter.ai/api/v1/chat/completions "HTTP/1.1 200 OK"
2025-10-18 16:37:26,539 - httpx - INFO - HTTP Request: POST https://generativelanguage.googleapis.com/v1beta/openai/chat/completions "HTTP/1.1 200 OK"
  Agent_1: Completed [████████████████████] 100.0%
2025-10-18 16:37:26,968 - httpx - INFO - HTTP Request: POST https://openrouter.ai/api/v1/chat/completions "HTTP/1.1 200 OK"
2025-10-18 16:37:29,755 - httpx - INFO - HTTP Request: POST https://api.openai.com/v1/traces/ingest "HTTP/1.1 204 No Content"
  Agent_3: Application round 3 [██████████████░░░░░░] 70.0%
2025-10-18 16:37:37,682 - httpx - INFO - HTTP Request: POST https://openrouter.ai/api/v1/chat/completions "HTTP/1.1 200 OK"
2025-10-18 16:37:40,657 - httpx - INFO - HTTP Request: POST https://api.openai.com/v1/traces/ingest "HTTP/1.1 204 No Content"
2025-10-18 16:37:42,173 - httpx - INFO - HTTP Request: POST https://generativelanguage.googleapis.com/v1beta/openai/chat/completions "HTTP/1.1 200 OK"
2025-10-18 16:37:42,660 - httpx - INFO - HTTP Request: POST https://openrouter.ai/api/v1/chat/completions "HTTP/1.1 200 OK"
2025-10-18 16:37:46,064 - httpx - INFO - HTTP Request: POST https://api.openai.com/v1/traces/ingest "HTTP/1.1 204 No Content"
  Agent_3: Application round 4 [████████████████░░░░] 80.0%
2025-10-18 16:37:56,396 - httpx - INFO - HTTP Request: POST https://openrouter.ai/api/v1/chat/completions "HTTP/1.1 200 OK"
2025-10-18 16:37:56,619 - httpx - INFO - HTTP Request: POST https://api.openai.com/v1/traces/ingest "HTTP/1.1 204 No Content"
2025-10-18 16:38:02,664 - httpx - INFO - HTTP Request: POST https://generativelanguage.googleapis.com/v1beta/openai/chat/completions "HTTP/1.1 200 OK"
2025-10-18 16:38:03,094 - httpx - INFO - HTTP Request: POST https://openrouter.ai/api/v1/chat/completions "HTTP/1.1 200 OK"
2025-10-18 16:38:07,080 - httpx - INFO - HTTP Request: POST https://api.openai.com/v1/traces/ingest "HTTP/1.1 204 No Content"
  Agent_3: Final ranking [██████████████████░░] 90.0%
2025-10-18 16:38:18,358 - httpx - INFO - HTTP Request: POST https://openrouter.ai/api/v1/chat/completions "HTTP/1.1 200 OK"
2025-10-18 16:38:20,924 - httpx - INFO - HTTP Request: POST https://generativelanguage.googleapis.com/v1beta/openai/chat/completions "HTTP/1.1 200 OK"
2025-10-18 16:38:21,226 - httpx - INFO - HTTP Request: POST https://openrouter.ai/api/v1/chat/completions "HTTP/1.1 200 OK"
2025-10-18 16:38:22,724 - httpx - INFO - HTTP Request: POST https://api.openai.com/v1/traces/ingest "HTTP/1.1 204 No Content"
  Agent_3: Completed [████████████████████] 100.0%

 Phase 1 Complete - Duration: 1m 53s
  Agent_1: $10.10 earned
  Agent_2: $7.60 earned
  Agent_3: $9.60 earned

💬 PHASE 2: Group Discussion
━━━━━━━━━━━━━━━━━━━━━━━━━━━━━━━━━━━━━━━━━━━━━━━━━━
Beginning group discussion (max 10 rounds)...

🗣️  Round 1 (1/10)
   Speaking order: Agent_2 → Agent_1 → Agent_3
   💭 Agent_2 is thinking...
2025-10-18 16:38:37,613 - httpx - INFO - HTTP Request: POST https://openrouter.ai/api/v1/chat/completions "HTTP/1.1 200 OK"
2025-10-18 16:38:38,351 - httpx - INFO - HTTP Request: POST https://api.openai.com/v1/traces/ingest "HTTP/1.1 204 No Content"
2025-10-18 16:38:41,143 - httpx - INFO - HTTP Request: POST https://openrouter.ai/api/v1/chat/completions "HTTP/1.1 200 OK"
   ✅ Agent_2 responded (2405 chars) [4.8s]
2025-10-18 16:38:42,596 - httpx - INFO - HTTP Request: POST https://generativelanguage.googleapis.com/v1beta/openai/chat/completions "HTTP/1.1 200 OK"
   💭 Agent_1 is thinking...
2025-10-18 16:38:43,051 - httpx - INFO - HTTP Request: POST https://openrouter.ai/api/v1/chat/completions "HTTP/1.1 200 OK"
2025-10-18 16:38:43,799 - httpx - INFO - HTTP Request: POST https://api.openai.com/v1/traces/ingest "HTTP/1.1 204 No Content"
2025-10-18 16:38:45,635 - httpx - INFO - HTTP Request: POST https://openrouter.ai/api/v1/chat/completions "HTTP/1.1 200 OK"
   ✅ Agent_1 responded (2303 chars) [4.0s]
2025-10-18 16:38:47,297 - httpx - INFO - HTTP Request: POST https://generativelanguage.googleapis.com/v1beta/openai/chat/completions "HTTP/1.1 200 OK"
   💭 Agent_3 is thinking...
2025-10-18 16:38:47,823 - httpx - INFO - HTTP Request: POST https://openrouter.ai/api/v1/chat/completions "HTTP/1.1 200 OK"
2025-10-18 16:38:49,235 - httpx - INFO - HTTP Request: POST https://api.openai.com/v1/traces/ingest "HTTP/1.1 204 No Content"
2025-10-18 16:38:59,513 - httpx - INFO - HTTP Request: POST https://openrouter.ai/api/v1/chat/completions "HTTP/1.1 200 OK"
2025-10-18 16:38:59,820 - httpx - INFO - HTTP Request: POST https://api.openai.com/v1/traces/ingest "HTTP/1.1 204 No Content"
   ✅ Agent_3 responded (2055 chars) [16.1s]
2025-10-18 16:39:04,235 - httpx - INFO - HTTP Request: POST https://generativelanguage.googleapis.com/v1beta/openai/chat/completions "HTTP/1.1 200 OK"
2025-10-18 16:39:04,687 - httpx - INFO - HTTP Request: POST https://openrouter.ai/api/v1/chat/completions "HTTP/1.1 200 OK"
2025-10-18 16:39:05,272 - httpx - INFO - HTTP Request: POST https://api.openai.com/v1/traces/ingest "HTTP/1.1 204 No Content"
2025-10-18 16:39:08,190 - httpx - INFO - HTTP Request: POST https://openrouter.ai/api/v1/chat/completions "HTTP/1.1 200 OK"
2025-10-18 16:39:10,680 - httpx - INFO - HTTP Request: POST https://api.openai.com/v1/traces/ingest "HTTP/1.1 204 No Content"
2025-10-18 16:39:11,876 - httpx - INFO - HTTP Request: POST https://openrouter.ai/api/v1/chat/completions "HTTP/1.1 200 OK"
2025-10-18 16:39:16,055 - httpx - INFO - HTTP Request: POST https://api.openai.com/v1/traces/ingest "HTTP/1.1 204 No Content"
2025-10-18 16:39:31,646 - httpx - INFO - HTTP Request: POST https://openrouter.ai/api/v1/chat/completions "HTTP/1.1 200 OK"
2025-10-18 16:39:31,692 - httpx - INFO - HTTP Request: POST https://api.openai.com/v1/traces/ingest "HTTP/1.1 204 No Content"
2025-10-18 16:39:32,495 - httpx - INFO - HTTP Request: POST https://openrouter.ai/api/v1/chat/completions "HTTP/1.1 200 OK"
2025-10-18 16:39:33,308 - httpx - INFO - HTTP Request: POST https://openrouter.ai/api/v1/chat/completions "HTTP/1.1 200 OK"
   ✅ Round 1 complete - 57.1s

🗣️  Round 2 (2/10)
   Speaking order: Agent_2 → Agent_3 → Agent_1
   💭 Agent_2 is thinking...
2025-10-18 16:39:34,774 - httpx - INFO - HTTP Request: POST https://openrouter.ai/api/v1/chat/completions "HTTP/1.1 200 OK"
2025-10-18 16:39:36,466 - httpx - INFO - HTTP Request: POST https://openrouter.ai/api/v1/chat/completions "HTTP/1.1 200 OK"
2025-10-18 16:39:37,247 - httpx - INFO - HTTP Request: POST https://api.openai.com/v1/traces/ingest "HTTP/1.1 204 No Content"
   ✅ Agent_2 responded (2310 chars) [3.0s]
2025-10-18 16:39:38,450 - httpx - INFO - HTTP Request: POST https://generativelanguage.googleapis.com/v1beta/openai/chat/completions "HTTP/1.1 200 OK"
   💭 Agent_3 is thinking...
2025-10-18 16:39:39,177 - httpx - INFO - HTTP Request: POST https://openrouter.ai/api/v1/chat/completions "HTTP/1.1 200 OK"
2025-10-18 16:39:42,637 - httpx - INFO - HTTP Request: POST https://api.openai.com/v1/traces/ingest "HTTP/1.1 204 No Content"
2025-10-18 16:39:48,994 - httpx - INFO - HTTP Request: POST https://openrouter.ai/api/v1/chat/completions "HTTP/1.1 200 OK"
   ✅ Agent_3 responded (1311 chars) [13.3s]
2025-10-18 16:39:52,765 - httpx - INFO - HTTP Request: POST https://generativelanguage.googleapis.com/v1beta/openai/chat/completions "HTTP/1.1 200 OK"
   💭 Agent_1 is thinking...
2025-10-18 16:39:53,220 - httpx - INFO - HTTP Request: POST https://api.openai.com/v1/traces/ingest "HTTP/1.1 204 No Content"
2025-10-18 16:39:53,242 - httpx - INFO - HTTP Request: POST https://openrouter.ai/api/v1/chat/completions "HTTP/1.1 200 OK"
2025-10-18 16:39:55,474 - httpx - INFO - HTTP Request: POST https://openrouter.ai/api/v1/chat/completions "HTTP/1.1 200 OK"
   ✅ Agent_1 responded (1669 chars) [3.7s]
2025-10-18 16:39:57,512 - httpx - INFO - HTTP Request: POST https://generativelanguage.googleapis.com/v1beta/openai/chat/completions "HTTP/1.1 200 OK"
2025-10-18 16:39:57,976 - httpx - INFO - HTTP Request: POST https://openrouter.ai/api/v1/chat/completions "HTTP/1.1 200 OK"
2025-10-18 16:39:58,731 - httpx - INFO - HTTP Request: POST https://api.openai.com/v1/traces/ingest "HTTP/1.1 204 No Content"
2025-10-18 16:40:01,981 - httpx - INFO - HTTP Request: POST https://openrouter.ai/api/v1/chat/completions "HTTP/1.1 200 OK"
2025-10-18 16:40:04,139 - utils.memory_manager - INFO - Memory approaching limit for Agent_3, attempting compression...
2025-10-18 16:40:04,140 - httpx - INFO - HTTP Request: POST https://api.openai.com/v1/traces/ingest "HTTP/1.1 204 No Content"
2025-10-18 16:40:04,415 - httpx - INFO - HTTP Request: POST https://api.openai.com/v1/traces/ingest "HTTP/1.1 204 No Content"
2025-10-18 16:40:04,535 - httpx - INFO - HTTP Request: POST https://openrouter.ai/api/v1/chat/completions "HTTP/1.1 200 OK"
2025-10-18 16:40:13,177 - utils.memory_manager - INFO - Memory compressed from 22518 to 6244 characters
2025-10-18 16:40:13,658 - httpx - INFO - HTTP Request: POST https://openrouter.ai/api/v1/chat/completions "HTTP/1.1 200 OK"
2025-10-18 16:40:15,405 - httpx - INFO - HTTP Request: POST https://api.openai.com/v1/traces/ingest "HTTP/1.1 204 No Content"
2025-10-18 16:40:21,468 - httpx - INFO - HTTP Request: POST https://openrouter.ai/api/v1/chat/completions "HTTP/1.1 200 OK"
🗳️  Voting initiated (Round 2)
2025-10-18 16:40:22,993 - httpx - INFO - HTTP Request: POST https://openrouter.ai/api/v1/chat/completions "HTTP/1.1 200 OK"
2025-10-18 16:40:23,958 - httpx - INFO - HTTP Request: POST https://openrouter.ai/api/v1/chat/completions "HTTP/1.1 200 OK"
2025-10-18 16:40:24,861 - core.two_stage_voting_manager - INFO - Starting two-stage voting for Agent_1
2025-10-18 16:40:25,359 - httpx - INFO - HTTP Request: POST https://openrouter.ai/api/v1/chat/completions "HTTP/1.1 200 OK"
2025-10-18 16:40:25,612 - core.two_stage_voting_manager - INFO - Two-stage voting success - Agent_1 principle_selection: '3' -> 3 (attempt 1)
2025-10-18 16:40:26,050 - httpx - INFO - HTTP Request: POST https://api.openai.com/v1/traces/ingest "HTTP/1.1 204 No Content"
2025-10-18 16:40:26,181 - httpx - INFO - HTTP Request: POST https://openrouter.ai/api/v1/chat/completions "HTTP/1.1 200 OK"
2025-10-18 16:40:27,624 - core.two_stage_voting_manager - INFO - Two-stage voting success - Agent_1 amount_specification: '13000' -> 13000 (attempt 1)
2025-10-18 16:40:27,625 - core.two_stage_voting_manager - INFO - Completed two-stage voting for Agent_1: principle 3, amount 13000
2025-10-18 16:40:27,625 - core.two_stage_voting_manager - INFO - Starting two-stage voting for Agent_2
2025-10-18 16:40:28,077 - httpx - INFO - HTTP Request: POST https://openrouter.ai/api/v1/chat/completions "HTTP/1.1 200 OK"
2025-10-18 16:40:28,305 - core.two_stage_voting_manager - INFO - Two-stage voting success - Agent_2 principle_selection: '3' -> 3 (attempt 1)
2025-10-18 16:40:28,894 - httpx - INFO - HTTP Request: POST https://openrouter.ai/api/v1/chat/completions "HTTP/1.1 200 OK"
2025-10-18 16:40:29,078 - core.two_stage_voting_manager - INFO - Two-stage voting success - Agent_2 amount_specification: '13000' -> 13000 (attempt 1)
2025-10-18 16:40:29,078 - core.two_stage_voting_manager - INFO - Completed two-stage voting for Agent_2: principle 3, amount 13000
2025-10-18 16:40:29,078 - core.two_stage_voting_manager - INFO - Starting two-stage voting for Agent_3
2025-10-18 16:40:29,636 - httpx - INFO - HTTP Request: POST https://openrouter.ai/api/v1/chat/completions "HTTP/1.1 200 OK"
2025-10-18 16:40:30,770 - core.two_stage_voting_manager - INFO - Two-stage voting success - Agent_3 principle_selection: '3' -> 3 (attempt 1)
2025-10-18 16:40:31,222 - httpx - INFO - HTTP Request: POST https://openrouter.ai/api/v1/chat/completions "HTTP/1.1 200 OK"
2025-10-18 16:40:31,595 - httpx - INFO - HTTP Request: POST https://api.openai.com/v1/traces/ingest "HTTP/1.1 204 No Content"
2025-10-18 16:40:32,707 - core.two_stage_voting_manager - INFO - Two-stage voting success - Agent_3 amount_specification: '13000' -> 13000 (attempt 1)
2025-10-18 16:40:32,707 - core.two_stage_voting_manager - INFO - Completed two-stage voting for Agent_3: principle 3, amount 13000
2025-10-18 16:40:32,707 - core.two_stage_voting_manager - INFO - Two-stage voting completed successfully for all participants
2025-10-18 16:40:32,707 - core.two_stage_voting_manager - INFO - Consensus reached: maximizing_average_floor_constraint with constraint 13000
 Consensus Reached! Principle: maximizing_average_floor_constraint (constraint: $13000)

2025-10-18 16:40:32,713 - utils.language_manager - INFO - Language set to: English
2025-10-18 16:40:32,716 - utils.language_manager - INFO - Loaded translations for English
2025-10-18 16:40:33,281 - httpx - INFO - HTTP Request: POST https://openrouter.ai/api/v1/chat/completions "HTTP/1.1 200 OK"
2025-10-18 16:40:37,027 - utils.language_manager - INFO - Language set to: English
2025-10-18 16:40:37,029 - utils.language_manager - INFO - Loaded translations for English
2025-10-18 16:40:37,032 - httpx - INFO - HTTP Request: POST https://api.openai.com/v1/traces/ingest "HTTP/1.1 204 No Content"
2025-10-18 16:40:37,334 - httpx - INFO - HTTP Request: POST https://api.openai.com/v1/traces/ingest "HTTP/1.1 204 No Content"
2025-10-18 16:40:37,433 - httpx - INFO - HTTP Request: POST https://openrouter.ai/api/v1/chat/completions "HTTP/1.1 200 OK"
2025-10-18 16:40:39,992 - utils.language_manager - INFO - Language set to: English
2025-10-18 16:40:39,994 - utils.language_manager - INFO - Loaded translations for English
2025-10-18 16:40:40,457 - httpx - INFO - HTTP Request: POST https://openrouter.ai/api/v1/chat/completions "HTTP/1.1 200 OK"
2025-10-18 16:40:42,708 - httpx - INFO - HTTP Request: POST https://api.openai.com/v1/traces/ingest "HTTP/1.1 204 No Content"
2025-10-18 16:40:49,698 - httpx - INFO - HTTP Request: POST https://openrouter.ai/api/v1/chat/completions "HTTP/1.1 200 OK"
2025-10-18 16:40:49,719 - httpx - INFO - HTTP Request: POST https://openrouter.ai/api/v1/chat/completions "HTTP/1.1 200 OK"
2025-10-18 16:40:49,746 - httpx - INFO - HTTP Request: POST https://openrouter.ai/api/v1/chat/completions "HTTP/1.1 200 OK"
2025-10-18 16:40:51,032 - httpx - INFO - HTTP Request: POST https://generativelanguage.googleapis.com/v1beta/openai/chat/completions "HTTP/1.1 200 OK"
2025-10-18 16:40:51,401 - httpx - INFO - HTTP Request: POST https://generativelanguage.googleapis.com/v1beta/openai/chat/completions "HTTP/1.1 200 OK"
2025-10-18 16:40:52,460 - httpx - INFO - HTTP Request: POST https://generativelanguage.googleapis.com/v1beta/openai/chat/completions "HTTP/1.1 200 OK"
 Phase 2 Complete with consensus - Duration: 2m 15s
   Rounds conducted: 2
   Final earnings:
     Agent_1: $12.68
     Agent_2: $11.27
     Agent_3: $11.27

[TECH] Experiment dc7e2d3c-557e-4474-bd63-461907dde53e completed successfully in 249.14 seconds
2025-10-18 16:40:52,984 - httpx - INFO - HTTP Request: POST https://generativelanguage.googleapis.com/v1beta/openai/chat/completions "HTTP/1.1 200 OK"
[TECH] Consensus validation successful - discussion aligns with recorded consensus
[TECH] Transcript saved to: /Users/lucasmuller/Desktop/Githubg/Rawls_v3/transcript_dc7e2d3c-557e-4474-bd63-461907dde53e.json
2025-10-18 16:40:52,997 - core.experiment_manager - INFO - Results saved to: /Users/lucasmuller/Desktop/Githubg/Rawls_v3/hypothesis_testing/hypothesis_2/results/american/hypothesis_2_american_condition_21_config_results.json
2025-10-18 16:40:52,997 - core.experiment_manager - INFO - Seed used: 1831307698 (generated)
[TECH] Results saved to: /Users/lucasmuller/Desktop/Githubg/Rawls_v3/hypothesis_testing/hypothesis_2/results/american/hypothesis_2_american_condition_21_config_results.json
[DEBUG] Trace: https://platform.openai.com/logs/trace?trace_id=trace_a347b8f210c94bceb04186feda169fe0
════════════════════════════════════════════════════════════
✅ EXPERIMENT COMPLETED
════════════════════════════════════════════════════════════
Total Duration: 4m 13s
Consensus: ✅ maximizing_average_floor_constraint
Transcript saved: /Users/lucasmuller/Desktop/Githubg/Rawls_v3/transcript_dc7e2d3c-557e-4474-bd63-461907dde53e.json
Errors: None
Results saved: /Users/lucasmuller/Desktop/Githubg/Rawls_v3/hypothesis_testing/hypothesis_2/results/american/hypothesis_2_american_condition_21_config_results.json
🔗 Trace: https://platform.openai.com/logs/trace?trace_id=trace_a347b8f210c94bceb04186feda169fe0


Frohlich Experiment Results (ID: dc7e2d3c-557e-4474-bd63-461907dde53e)
Completed in 249.14 seconds

PHASE 1 RESULTS:
  Agent_1: $10.10 (Initial pref: maximizing_average_floor_constraint, Final pref: maximizing_average_floor_constraint)
  Agent_2: $7.60 (Initial pref: maximizing_floor, Final pref: maximizing_floor)
  Agent_3: $9.60 (Initial pref: maximizing_average_floor_constraint, Final pref: maximizing_average_floor_constraint)
  Average Phase 1 earnings: $9.10

PHASE 2 RESULTS:
  Consensus reached on: maximizing_average_floor_constraint
  Constraint amount: $13000
  Rounds to consensus: 2
  Phase 2 earnings:
    Agent_1: $12.68
    Agent_2: $11.27
    Agent_3: $11.27
  Average Phase 2 earnings: $11.74

TOTAL EARNINGS:
  Agent_1: $22.78
  Agent_3: $20.87
  Agent_2: $18.87

HIGHEST EARNER: Agent_1 with $22.78
2025-10-18 16:40:53,236 - httpx - INFO - HTTP Request: POST https://api.openai.com/v1/traces/ingest "HTTP/1.1 204 No Content"

RETURN CODE: 0  DURATION: 254.3s
