CMD: /Users/lucasmuller/Desktop/Githubg/Rawls_v3/.venv/bin/python /Users/lucasmuller/Desktop/Githubg/Rawls_v3/main.py /Users/lucasmuller/Desktop/Githubg/Rawls_v3/hypothesis_testing/hypothesis_2/configs/american/hypothesis_2_american_condition_8_config.yaml /Users/lucasmuller/Desktop/Githubg/Rawls_v3/hypothesis_testing/hypothesis_2/results/american/hypothesis_2_american_condition_8_config_results.json
[TECH] Loading configuration from: /Users/lucasmuller/Desktop/Githubg/Rawls_v3/hypothesis_testing/hypothesis_2/configs/american/hypothesis_2_american_condition_8_config.yaml
2025-10-18 16:18:08,207 - utils.seed_manager - INFO - Generated seed 114114998 from configuration hash
2025-10-18 16:18:08,208 - utils.language_manager - INFO - Language set to: English
[TECH] Language set to: English
════════════════════════════════════════════════════════════
🧪 FROHLICH EXPERIMENT STARTING
════════════════════════════════════════════════════════════
Experiment ID: 5ef4620d
Participants: 3
Language: English
Max Phase 2 rounds: 10
Configuration file: hypothesis_2_american_condition_8_config.yaml
Started at: 16:18:08

[DEBUG] ✅ FORMAL VOTING: Using structured consensus building with confirmation and secret ballot
[DEBUG]    • Voting initiated via end-of-round prompts only
[DEBUG]    • Voting requires confirmation from all participants
[DEBUG]    • Consensus reached via unanimous secret ballot
[TECH] Tracing policy: participant-only spans; utility agents untraced
🤖 Initializing Agents...
2025-10-18 16:18:08,208 - experiment_agents.participant_agent - INFO - Creating 3 participant agents with dynamic temperature detection...
2025-10-18 16:18:08,209 - experiment_agents.participant_agent - INFO - Creating agent: Agent_1 (model: openai/gpt-oss-120b, temp: 0.0)
2025-10-18 16:18:08,209 - experiment_agents.participant_agent - INFO - Creating agent Agent_1 with dynamic temperature detection
2025-10-18 16:18:08,245 - utils.language_manager - INFO - Loaded translations for English
2025-10-18 16:18:09,156 - httpx - INFO - HTTP Request: POST https://openrouter.ai/api/v1/chat/completions "HTTP/1.1 200 OK"
2025-10-18 16:18:09,459 - utils.dynamic_model_capabilities - INFO - ✅ openai/gpt-oss-120b supports temperature (discovered during creation)
2025-10-18 16:18:09,459 - experiment_agents.participant_agent - INFO - ✅ Agent_1: Temperature 0.0 active (method: successful_creation)
2025-10-18 16:18:09,459 - experiment_agents.participant_agent - INFO - ✅ Successfully initialized agent Agent_1
2025-10-18 16:18:09,459 - experiment_agents.participant_agent - INFO - Creating agent: Agent_2 (model: x-ai/grok-4-fast, temp: 0.0)
2025-10-18 16:18:09,459 - experiment_agents.participant_agent - INFO - Creating agent Agent_2 with dynamic temperature detection
2025-10-18 16:18:10,042 - httpx - INFO - HTTP Request: POST https://openrouter.ai/api/v1/chat/completions "HTTP/1.1 200 OK"
2025-10-18 16:18:10,802 - utils.dynamic_model_capabilities - INFO - ✅ x-ai/grok-4-fast supports temperature (discovered during creation)
2025-10-18 16:18:10,802 - experiment_agents.participant_agent - INFO - ✅ Agent_2: Temperature 0.0 active (method: successful_creation)
2025-10-18 16:18:10,802 - experiment_agents.participant_agent - INFO - ✅ Successfully initialized agent Agent_2
2025-10-18 16:18:10,802 - experiment_agents.participant_agent - INFO - Creating agent: Agent_3 (model: x-ai/grok-4-fast, temp: 0.0)
2025-10-18 16:18:10,802 - experiment_agents.participant_agent - INFO - Creating agent Agent_3 with dynamic temperature detection
2025-10-18 16:18:11,060 - httpx - INFO - HTTP Request: POST https://openrouter.ai/api/v1/chat/completions "HTTP/1.1 200 OK"
2025-10-18 16:18:11,839 - experiment_agents.participant_agent - INFO - ✅ Agent_3: Temperature 0.0 active (method: successful_creation)
2025-10-18 16:18:11,839 - experiment_agents.participant_agent - INFO - ✅ Successfully initialized agent Agent_3
2025-10-18 16:18:11,839 - experiment_agents.participant_agent - INFO - ✅ Successfully created 3 participant agents
2025-10-18 16:18:11,839 - experiment_agents.utility_agent - INFO - Creating utility agents with model: gemini-2.0-flash-lite (tracing disabled)
2025-10-18 16:18:11,875 - utils.gemini_client - INFO - Successfully initialized Gemini client with OpenAI-compatible endpoint
2025-10-18 16:18:12,514 - httpx - INFO - HTTP Request: POST https://generativelanguage.googleapis.com/v1beta/openai/chat/completions "HTTP/1.1 200 OK"
2025-10-18 16:18:12,522 - utils.dynamic_model_capabilities - INFO - ✅ gemini-2.0-flash-lite supports temperature (discovered during creation)
2025-10-18 16:18:13,028 - httpx - INFO - HTTP Request: POST https://generativelanguage.googleapis.com/v1beta/openai/chat/completions "HTTP/1.1 200 OK"
2025-10-18 16:18:13,040 - experiment_agents.utility_agent - INFO - ✅ Utility agents initialized successfully
2025-10-18 16:18:13,041 - core.experiment_manager - INFO - ✅ Experiment manager initialized with 3 participants
  ✅ Agent_1 (gpt-oss-120b) [0.0s]
  ✅ Agent_2 (grok-4-fast) [0.0s]
  ✅ Agent_3 (grok-4-fast) [0.0s]

✨ All agents ready in 4.8s

2025-10-18 16:18:13,041 - utils.seed_manager - INFO - Generated seed 114114998 from configuration hash
2025-10-18 16:18:13,041 - utils.seed_manager - INFO - Experiment random seed set to: 114114998
[TECH] Experiment seed: 114114998 (generated)
[TECH] Tracing experiment: Frohlich Experiment - 5ef4620d-ffa8-4a9b-b65d-01051c5919f0
[TECH] Trace ID: trace_365f2ff8f12344e7847270bf8141ea0f
📖 PHASE 1: Individual Familiarization
━━━━━━━━━━━━━━━━━━━━━━━━━━━━━━━━━━━━━━━━━━━━━━━━━━
Running parallel familiarization for 3 participants...

[TECH] Phase 1 executing with language: English
  Agent_1: Initial ranking [██░░░░░░░░░░░░░░░░░░] 10.0%
  Agent_2: Initial ranking [██░░░░░░░░░░░░░░░░░░] 10.0%
  Agent_3: Initial ranking [██░░░░░░░░░░░░░░░░░░] 10.0%
2025-10-18 16:18:13,580 - httpx - INFO - HTTP Request: POST https://openrouter.ai/api/v1/chat/completions "HTTP/1.1 200 OK"
2025-10-18 16:18:13,718 - httpx - INFO - HTTP Request: POST https://openrouter.ai/api/v1/chat/completions "HTTP/1.1 200 OK"
2025-10-18 16:18:13,799 - httpx - INFO - HTTP Request: POST https://openrouter.ai/api/v1/chat/completions "HTTP/1.1 200 OK"
2025-10-18 16:18:16,322 - httpx - INFO - HTTP Request: POST https://generativelanguage.googleapis.com/v1beta/openai/chat/completions "HTTP/1.1 200 OK"
2025-10-18 16:18:16,830 - httpx - INFO - HTTP Request: POST https://openrouter.ai/api/v1/chat/completions "HTTP/1.1 200 OK"
2025-10-18 16:18:17,037 - httpx - INFO - HTTP Request: POST https://generativelanguage.googleapis.com/v1beta/openai/chat/completions "HTTP/1.1 200 OK"
2025-10-18 16:18:17,652 - httpx - INFO - HTTP Request: POST https://openrouter.ai/api/v1/chat/completions "HTTP/1.1 200 OK"
2025-10-18 16:18:17,976 - httpx - INFO - HTTP Request: POST https://generativelanguage.googleapis.com/v1beta/openai/chat/completions "HTTP/1.1 200 OK"
2025-10-18 16:18:18,434 - httpx - INFO - HTTP Request: POST https://openrouter.ai/api/v1/chat/completions "HTTP/1.1 200 OK"
  Agent_2: Learning principles [█████░░░░░░░░░░░░░░░] 25.0%
2025-10-18 16:18:19,153 - httpx - INFO - HTTP Request: POST https://openrouter.ai/api/v1/chat/completions "HTTP/1.1 200 OK"
  Agent_1: Learning principles [█████░░░░░░░░░░░░░░░] 25.0%
2025-10-18 16:18:19,917 - httpx - INFO - HTTP Request: POST https://api.openai.com/v1/traces/ingest "HTTP/1.1 204 No Content"
2025-10-18 16:18:20,057 - httpx - INFO - HTTP Request: POST https://openrouter.ai/api/v1/chat/completions "HTTP/1.1 200 OK"
  Agent_3: Learning principles [█████░░░░░░░░░░░░░░░] 25.0%
2025-10-18 16:18:20,787 - httpx - INFO - HTTP Request: POST https://api.openai.com/v1/traces/ingest "HTTP/1.1 204 No Content"
2025-10-18 16:18:20,936 - httpx - INFO - HTTP Request: POST https://openrouter.ai/api/v1/chat/completions "HTTP/1.1 200 OK"
2025-10-18 16:18:21,109 - httpx - INFO - HTTP Request: POST https://openrouter.ai/api/v1/chat/completions "HTTP/1.1 200 OK"
2025-10-18 16:18:21,909 - httpx - INFO - HTTP Request: POST https://api.openai.com/v1/traces/ingest "HTTP/1.1 204 No Content"
  Agent_1: Post-explanation ranking [████████░░░░░░░░░░░░] 40.0%
2025-10-18 16:18:22,536 - httpx - INFO - HTTP Request: POST https://openrouter.ai/api/v1/chat/completions "HTTP/1.1 200 OK"
2025-10-18 16:18:23,870 - httpx - INFO - HTTP Request: POST https://generativelanguage.googleapis.com/v1beta/openai/chat/completions "HTTP/1.1 200 OK"
2025-10-18 16:18:24,220 - httpx - INFO - HTTP Request: POST https://openrouter.ai/api/v1/chat/completions "HTTP/1.1 200 OK"
2025-10-18 16:18:26,103 - httpx - INFO - HTTP Request: POST https://openrouter.ai/api/v1/chat/completions "HTTP/1.1 200 OK"
  Agent_1: Application round 1 [██████████░░░░░░░░░░] 50.0%
2025-10-18 16:18:27,049 - httpx - INFO - HTTP Request: POST https://openrouter.ai/api/v1/chat/completions "HTTP/1.1 200 OK"
2025-10-18 16:18:27,475 - httpx - INFO - HTTP Request: POST https://api.openai.com/v1/traces/ingest "HTTP/1.1 204 No Content"
2025-10-18 16:18:27,726 - httpx - INFO - HTTP Request: POST https://openrouter.ai/api/v1/chat/completions "HTTP/1.1 200 OK"
2025-10-18 16:18:27,825 - httpx - INFO - HTTP Request: POST https://api.openai.com/v1/traces/ingest "HTTP/1.1 204 No Content"
2025-10-18 16:18:27,875 - httpx - INFO - HTTP Request: POST https://generativelanguage.googleapis.com/v1beta/openai/chat/completions "HTTP/1.1 200 OK"
2025-10-18 16:18:28,326 - httpx - INFO - HTTP Request: POST https://openrouter.ai/api/v1/chat/completions "HTTP/1.1 200 OK"
  Agent_1: Application round 2 [████████████░░░░░░░░] 60.0%
2025-10-18 16:18:30,194 - httpx - INFO - HTTP Request: POST https://openrouter.ai/api/v1/chat/completions "HTTP/1.1 200 OK"
  Agent_2: Post-explanation ranking [████████░░░░░░░░░░░░] 40.0%
  Agent_3: Post-explanation ranking [████████░░░░░░░░░░░░] 40.0%
2025-10-18 16:18:31,323 - httpx - INFO - HTTP Request: POST https://generativelanguage.googleapis.com/v1beta/openai/chat/completions "HTTP/1.1 200 OK"
2025-10-18 16:18:31,433 - httpx - INFO - HTTP Request: POST https://openrouter.ai/api/v1/chat/completions "HTTP/1.1 200 OK"
2025-10-18 16:18:31,547 - httpx - INFO - HTTP Request: POST https://openrouter.ai/api/v1/chat/completions "HTTP/1.1 200 OK"
2025-10-18 16:18:31,685 - httpx - INFO - HTTP Request: POST https://openrouter.ai/api/v1/chat/completions "HTTP/1.1 200 OK"
  Agent_1: Application round 3 [██████████████░░░░░░] 70.0%
2025-10-18 16:18:32,869 - httpx - INFO - HTTP Request: POST https://openrouter.ai/api/v1/chat/completions "HTTP/1.1 200 OK"
2025-10-18 16:18:33,793 - httpx - INFO - HTTP Request: POST https://generativelanguage.googleapis.com/v1beta/openai/chat/completions "HTTP/1.1 200 OK"
2025-10-18 16:18:33,997 - httpx - INFO - HTTP Request: POST https://generativelanguage.googleapis.com/v1beta/openai/chat/completions "HTTP/1.1 200 OK"
2025-10-18 16:18:34,230 - httpx - INFO - HTTP Request: POST https://openrouter.ai/api/v1/chat/completions "HTTP/1.1 200 OK"
2025-10-18 16:18:34,966 - httpx - INFO - HTTP Request: POST https://openrouter.ai/api/v1/chat/completions "HTTP/1.1 200 OK"
2025-10-18 16:18:35,065 - httpx - INFO - HTTP Request: POST https://generativelanguage.googleapis.com/v1beta/openai/chat/completions "HTTP/1.1 200 OK"
2025-10-18 16:18:35,457 - httpx - INFO - HTTP Request: POST https://openrouter.ai/api/v1/chat/completions "HTTP/1.1 200 OK"
2025-10-18 16:18:35,715 - httpx - INFO - HTTP Request: POST https://api.openai.com/v1/traces/ingest "HTTP/1.1 204 No Content"
2025-10-18 16:18:36,058 - httpx - INFO - HTTP Request: POST https://api.openai.com/v1/traces/ingest "HTTP/1.1 204 No Content"
  Agent_1: Application round 4 [████████████████░░░░] 80.0%
2025-10-18 16:18:37,661 - httpx - INFO - HTTP Request: POST https://openrouter.ai/api/v1/chat/completions "HTTP/1.1 200 OK"
  Agent_3: Application round 1 [██████████░░░░░░░░░░] 50.0%
  Agent_2: Application round 1 [██████████░░░░░░░░░░] 50.0%
2025-10-18 16:18:39,456 - httpx - INFO - HTTP Request: POST https://openrouter.ai/api/v1/chat/completions "HTTP/1.1 200 OK"
2025-10-18 16:18:39,717 - httpx - INFO - HTTP Request: POST https://openrouter.ai/api/v1/chat/completions "HTTP/1.1 200 OK"
2025-10-18 16:18:41,653 - httpx - INFO - HTTP Request: POST https://api.openai.com/v1/traces/ingest "HTTP/1.1 204 No Content"
2025-10-18 16:18:42,026 - httpx - INFO - HTTP Request: POST https://api.openai.com/v1/traces/ingest "HTTP/1.1 204 No Content"
2025-10-18 16:18:42,237 - httpx - INFO - HTTP Request: POST https://generativelanguage.googleapis.com/v1beta/openai/chat/completions "HTTP/1.1 200 OK"
2025-10-18 16:18:42,685 - httpx - INFO - HTTP Request: POST https://openrouter.ai/api/v1/chat/completions "HTTP/1.1 200 OK"
2025-10-18 16:18:42,890 - httpx - INFO - HTTP Request: POST https://generativelanguage.googleapis.com/v1beta/openai/chat/completions "HTTP/1.1 200 OK"
2025-10-18 16:18:43,491 - httpx - INFO - HTTP Request: POST https://openrouter.ai/api/v1/chat/completions "HTTP/1.1 200 OK"
2025-10-18 16:18:45,886 - httpx - INFO - HTTP Request: POST https://generativelanguage.googleapis.com/v1beta/openai/chat/completions "HTTP/1.1 200 OK"
2025-10-18 16:18:46,283 - httpx - INFO - HTTP Request: POST https://openrouter.ai/api/v1/chat/completions "HTTP/1.1 200 OK"
2025-10-18 16:18:47,578 - httpx - INFO - HTTP Request: POST https://api.openai.com/v1/traces/ingest "HTTP/1.1 204 No Content"
  Agent_3: Application round 2 [████████████░░░░░░░░] 60.0%
2025-10-18 16:18:49,602 - httpx - INFO - HTTP Request: POST https://openrouter.ai/api/v1/chat/completions "HTTP/1.1 200 OK"
  Agent_2: Application round 2 [████████████░░░░░░░░] 60.0%
2025-10-18 16:18:50,421 - httpx - INFO - HTTP Request: POST https://openrouter.ai/api/v1/chat/completions "HTTP/1.1 200 OK"
2025-10-18 16:18:52,839 - httpx - INFO - HTTP Request: POST https://generativelanguage.googleapis.com/v1beta/openai/chat/completions "HTTP/1.1 200 OK"
2025-10-18 16:18:53,100 - httpx - INFO - HTTP Request: POST https://api.openai.com/v1/traces/ingest "HTTP/1.1 204 No Content"
2025-10-18 16:18:53,257 - httpx - INFO - HTTP Request: POST https://generativelanguage.googleapis.com/v1beta/openai/chat/completions "HTTP/1.1 200 OK"
2025-10-18 16:18:53,399 - httpx - INFO - HTTP Request: POST https://openrouter.ai/api/v1/chat/completions "HTTP/1.1 200 OK"
2025-10-18 16:18:53,704 - httpx - INFO - HTTP Request: POST https://openrouter.ai/api/v1/chat/completions "HTTP/1.1 200 OK"
  Agent_1: Final ranking [██████████████████░░] 90.0%
2025-10-18 16:18:56,384 - httpx - INFO - HTTP Request: POST https://openrouter.ai/api/v1/chat/completions "HTTP/1.1 200 OK"
2025-10-18 16:18:58,864 - httpx - INFO - HTTP Request: POST https://api.openai.com/v1/traces/ingest "HTTP/1.1 204 No Content"
2025-10-18 16:18:59,178 - httpx - INFO - HTTP Request: POST https://api.openai.com/v1/traces/ingest "HTTP/1.1 204 No Content"
2025-10-18 16:18:59,427 - httpx - INFO - HTTP Request: POST https://generativelanguage.googleapis.com/v1beta/openai/chat/completions "HTTP/1.1 200 OK"
2025-10-18 16:18:59,826 - httpx - INFO - HTTP Request: POST https://openrouter.ai/api/v1/chat/completions "HTTP/1.1 200 OK"
  Agent_3: Application round 3 [██████████████░░░░░░] 70.0%
2025-10-18 16:19:00,340 - httpx - INFO - HTTP Request: POST https://openrouter.ai/api/v1/chat/completions "HTTP/1.1 200 OK"
  Agent_2: Application round 3 [██████████████░░░░░░] 70.0%
  Agent_1: Completed [████████████████████] 100.0%
2025-10-18 16:19:01,114 - httpx - INFO - HTTP Request: POST https://openrouter.ai/api/v1/chat/completions "HTTP/1.1 200 OK"
2025-10-18 16:19:02,695 - httpx - INFO - HTTP Request: POST https://generativelanguage.googleapis.com/v1beta/openai/chat/completions "HTTP/1.1 200 OK"
2025-10-18 16:19:03,169 - httpx - INFO - HTTP Request: POST https://openrouter.ai/api/v1/chat/completions "HTTP/1.1 200 OK"
2025-10-18 16:19:04,274 - httpx - INFO - HTTP Request: POST https://generativelanguage.googleapis.com/v1beta/openai/chat/completions "HTTP/1.1 200 OK"
2025-10-18 16:19:04,778 - httpx - INFO - HTTP Request: POST https://api.openai.com/v1/traces/ingest "HTTP/1.1 204 No Content"
2025-10-18 16:19:05,022 - httpx - INFO - HTTP Request: POST https://openrouter.ai/api/v1/chat/completions "HTTP/1.1 200 OK"
  Agent_3: Application round 4 [████████████████░░░░] 80.0%
2025-10-18 16:19:10,637 - httpx - INFO - HTTP Request: POST https://openrouter.ai/api/v1/chat/completions "HTTP/1.1 200 OK"
2025-10-18 16:19:13,245 - httpx - INFO - HTTP Request: POST https://generativelanguage.googleapis.com/v1beta/openai/chat/completions "HTTP/1.1 200 OK"
2025-10-18 16:19:13,720 - httpx - INFO - HTTP Request: POST https://openrouter.ai/api/v1/chat/completions "HTTP/1.1 200 OK"
  Agent_2: Application round 4 [████████████████░░░░] 80.0%
2025-10-18 16:19:15,380 - httpx - INFO - HTTP Request: POST https://api.openai.com/v1/traces/ingest "HTTP/1.1 204 No Content"
2025-10-18 16:19:15,772 - httpx - INFO - HTTP Request: POST https://openrouter.ai/api/v1/chat/completions "HTTP/1.1 200 OK"
2025-10-18 16:19:15,804 - httpx - INFO - HTTP Request: POST https://api.openai.com/v1/traces/ingest "HTTP/1.1 204 No Content"
2025-10-18 16:19:17,893 - httpx - INFO - HTTP Request: POST https://generativelanguage.googleapis.com/v1beta/openai/chat/completions "HTTP/1.1 200 OK"
2025-10-18 16:19:18,376 - httpx - INFO - HTTP Request: POST https://openrouter.ai/api/v1/chat/completions "HTTP/1.1 200 OK"
2025-10-18 16:19:21,274 - httpx - INFO - HTTP Request: POST https://api.openai.com/v1/traces/ingest "HTTP/1.1 204 No Content"
  Agent_3: Final ranking [██████████████████░░] 90.0%
2025-10-18 16:19:22,338 - httpx - INFO - HTTP Request: POST https://openrouter.ai/api/v1/chat/completions "HTTP/1.1 200 OK"
2025-10-18 16:19:24,697 - httpx - INFO - HTTP Request: POST https://generativelanguage.googleapis.com/v1beta/openai/chat/completions "HTTP/1.1 200 OK"
2025-10-18 16:19:25,167 - httpx - INFO - HTTP Request: POST https://openrouter.ai/api/v1/chat/completions "HTTP/1.1 200 OK"
2025-10-18 16:19:26,728 - httpx - INFO - HTTP Request: POST https://api.openai.com/v1/traces/ingest "HTTP/1.1 204 No Content"
  Agent_2: Final ranking [██████████████████░░] 90.0%
2025-10-18 16:19:32,606 - httpx - INFO - HTTP Request: POST https://openrouter.ai/api/v1/chat/completions "HTTP/1.1 200 OK"
2025-10-18 16:19:34,963 - httpx - INFO - HTTP Request: POST https://generativelanguage.googleapis.com/v1beta/openai/chat/completions "HTTP/1.1 200 OK"
2025-10-18 16:19:35,272 - httpx - INFO - HTTP Request: POST https://openrouter.ai/api/v1/chat/completions "HTTP/1.1 200 OK"
  Agent_3: Completed [████████████████████] 100.0%
2025-10-18 16:19:37,398 - httpx - INFO - HTTP Request: POST https://api.openai.com/v1/traces/ingest "HTTP/1.1 204 No Content"
  Agent_2: Completed [████████████████████] 100.0%

 Phase 1 Complete - Duration: 1m 36s
  Agent_1: $7.90 earned
  Agent_2: $7.00 earned
  Agent_3: $7.30 earned

💬 PHASE 2: Group Discussion
━━━━━━━━━━━━━━━━━━━━━━━━━━━━━━━━━━━━━━━━━━━━━━━━━━
Beginning group discussion (max 10 rounds)...

🗣️  Round 1 (1/10)
   Speaking order: Agent_2 → Agent_1 → Agent_3
   💭 Agent_2 is thinking...
2025-10-18 16:19:49,738 - httpx - INFO - HTTP Request: POST https://openrouter.ai/api/v1/chat/completions "HTTP/1.1 200 OK"
2025-10-18 16:19:53,241 - httpx - INFO - HTTP Request: POST https://api.openai.com/v1/traces/ingest "HTTP/1.1 204 No Content"
2025-10-18 16:19:57,715 - httpx - INFO - HTTP Request: POST https://openrouter.ai/api/v1/chat/completions "HTTP/1.1 200 OK"
2025-10-18 16:19:58,702 - httpx - INFO - HTTP Request: POST https://api.openai.com/v1/traces/ingest "HTTP/1.1 204 No Content"
   ✅ Agent_2 responded (1105 chars) [11.1s]
2025-10-18 16:20:00,955 - httpx - INFO - HTTP Request: POST https://generativelanguage.googleapis.com/v1beta/openai/chat/completions "HTTP/1.1 200 OK"
   💭 Agent_1 is thinking...
2025-10-18 16:20:01,386 - httpx - INFO - HTTP Request: POST https://openrouter.ai/api/v1/chat/completions "HTTP/1.1 200 OK"
2025-10-18 16:20:04,131 - httpx - INFO - HTTP Request: POST https://api.openai.com/v1/traces/ingest "HTTP/1.1 204 No Content"
2025-10-18 16:20:04,667 - httpx - INFO - HTTP Request: POST https://openrouter.ai/api/v1/chat/completions "HTTP/1.1 200 OK"
   ✅ Agent_1 responded (2123 chars) [4.3s]
2025-10-18 16:20:05,991 - httpx - INFO - HTTP Request: POST https://generativelanguage.googleapis.com/v1beta/openai/chat/completions "HTTP/1.1 200 OK"
   💭 Agent_3 is thinking...
2025-10-18 16:20:06,461 - httpx - INFO - HTTP Request: POST https://openrouter.ai/api/v1/chat/completions "HTTP/1.1 200 OK"
2025-10-18 16:20:09,570 - httpx - INFO - HTTP Request: POST https://api.openai.com/v1/traces/ingest "HTTP/1.1 204 No Content"
2025-10-18 16:20:15,745 - httpx - INFO - HTTP Request: POST https://openrouter.ai/api/v1/chat/completions "HTTP/1.1 200 OK"
   ✅ Agent_3 responded (1702 chars) [13.1s]
2025-10-18 16:20:19,874 - httpx - INFO - HTTP Request: POST https://generativelanguage.googleapis.com/v1beta/openai/chat/completions "HTTP/1.1 200 OK"
2025-10-18 16:20:20,145 - httpx - INFO - HTTP Request: POST https://api.openai.com/v1/traces/ingest "HTTP/1.1 204 No Content"
2025-10-18 16:20:20,418 - httpx - INFO - HTTP Request: POST https://openrouter.ai/api/v1/chat/completions "HTTP/1.1 200 OK"
2025-10-18 16:20:23,194 - httpx - INFO - HTTP Request: POST https://openrouter.ai/api/v1/chat/completions "HTTP/1.1 200 OK"
2025-10-18 16:20:25,622 - httpx - INFO - HTTP Request: POST https://api.openai.com/v1/traces/ingest "HTTP/1.1 204 No Content"
2025-10-18 16:20:38,246 - httpx - INFO - HTTP Request: POST https://openrouter.ai/api/v1/chat/completions "HTTP/1.1 200 OK"
2025-10-18 16:20:41,263 - httpx - INFO - HTTP Request: POST https://api.openai.com/v1/traces/ingest "HTTP/1.1 204 No Content"
2025-10-18 16:20:50,650 - httpx - INFO - HTTP Request: POST https://openrouter.ai/api/v1/chat/completions "HTTP/1.1 200 OK"
2025-10-18 16:20:51,693 - httpx - INFO - HTTP Request: POST https://openrouter.ai/api/v1/chat/completions "HTTP/1.1 200 OK"
2025-10-18 16:20:51,921 - httpx - INFO - HTTP Request: POST https://api.openai.com/v1/traces/ingest "HTTP/1.1 204 No Content"
2025-10-18 16:20:53,623 - httpx - INFO - HTTP Request: POST https://openrouter.ai/api/v1/chat/completions "HTTP/1.1 200 OK"
🗳️  Voting initiated (Round 1)
2025-10-18 16:20:55,379 - httpx - INFO - HTTP Request: POST https://openrouter.ai/api/v1/chat/completions "HTTP/1.1 200 OK"
2025-10-18 16:20:57,412 - httpx - INFO - HTTP Request: POST https://api.openai.com/v1/traces/ingest "HTTP/1.1 204 No Content"
2025-10-18 16:20:57,871 - httpx - INFO - HTTP Request: POST https://openrouter.ai/api/v1/chat/completions "HTTP/1.1 200 OK"
2025-10-18 16:20:57,872 - httpx - INFO - HTTP Request: POST https://api.openai.com/v1/traces/ingest "HTTP/1.1 204 No Content"
2025-10-18 16:20:59,347 - core.two_stage_voting_manager - INFO - Starting two-stage voting for Agent_1
2025-10-18 16:20:59,736 - httpx - INFO - HTTP Request: POST https://openrouter.ai/api/v1/chat/completions "HTTP/1.1 200 OK"
2025-10-18 16:21:00,787 - core.two_stage_voting_manager - INFO - Two-stage voting success - Agent_1 principle_selection: '1' -> 1 (attempt 1)
2025-10-18 16:21:00,788 - core.two_stage_voting_manager - INFO - Completed two-stage voting for Agent_1: principle 1, amount None
2025-10-18 16:21:00,788 - core.two_stage_voting_manager - INFO - Starting two-stage voting for Agent_2
2025-10-18 16:21:01,330 - httpx - INFO - HTTP Request: POST https://openrouter.ai/api/v1/chat/completions "HTTP/1.1 200 OK"
2025-10-18 16:21:02,609 - core.two_stage_voting_manager - INFO - Two-stage voting success - Agent_2 principle_selection: '1' -> 1 (attempt 1)
2025-10-18 16:21:02,610 - core.two_stage_voting_manager - INFO - Completed two-stage voting for Agent_2: principle 1, amount None
2025-10-18 16:21:02,610 - core.two_stage_voting_manager - INFO - Starting two-stage voting for Agent_3
2025-10-18 16:21:03,112 - httpx - INFO - HTTP Request: POST https://openrouter.ai/api/v1/chat/completions "HTTP/1.1 200 OK"
2025-10-18 16:21:03,386 - httpx - INFO - HTTP Request: POST https://api.openai.com/v1/traces/ingest "HTTP/1.1 204 No Content"
2025-10-18 16:21:04,367 - core.two_stage_voting_manager - INFO - Two-stage voting success - Agent_3 principle_selection: '1' -> 1 (attempt 1)
2025-10-18 16:21:04,367 - core.two_stage_voting_manager - INFO - Completed two-stage voting for Agent_3: principle 1, amount None
2025-10-18 16:21:04,368 - core.two_stage_voting_manager - INFO - Two-stage voting completed successfully for all participants
2025-10-18 16:21:04,368 - core.two_stage_voting_manager - INFO - Consensus reached: maximizing_floor with constraint None
 Consensus Reached! Principle: maximizing_floor

2025-10-18 16:21:04,372 - utils.language_manager - INFO - Language set to: English
2025-10-18 16:21:04,375 - utils.language_manager - INFO - Loaded translations for English
2025-10-18 16:21:04,762 - httpx - INFO - HTTP Request: POST https://openrouter.ai/api/v1/chat/completions "HTTP/1.1 200 OK"
2025-10-18 16:21:07,674 - utils.language_manager - INFO - Language set to: English
2025-10-18 16:21:07,675 - utils.language_manager - INFO - Loaded translations for English
2025-10-18 16:21:08,187 - httpx - INFO - HTTP Request: POST https://openrouter.ai/api/v1/chat/completions "HTTP/1.1 200 OK"
2025-10-18 16:21:08,855 - httpx - INFO - HTTP Request: POST https://api.openai.com/v1/traces/ingest "HTTP/1.1 204 No Content"
2025-10-18 16:21:25,965 - utils.language_manager - INFO - Language set to: English
2025-10-18 16:21:25,967 - utils.language_manager - INFO - Loaded translations for English
2025-10-18 16:21:26,827 - httpx - INFO - HTTP Request: POST https://openrouter.ai/api/v1/chat/completions "HTTP/1.1 200 OK"
2025-10-18 16:21:29,605 - httpx - INFO - HTTP Request: POST https://api.openai.com/v1/traces/ingest "HTTP/1.1 204 No Content"
2025-10-18 16:21:42,306 - httpx - INFO - HTTP Request: POST https://openrouter.ai/api/v1/chat/completions "HTTP/1.1 200 OK"
2025-10-18 16:21:42,312 - httpx - INFO - HTTP Request: POST https://openrouter.ai/api/v1/chat/completions "HTTP/1.1 200 OK"
2025-10-18 16:21:42,367 - httpx - INFO - HTTP Request: POST https://openrouter.ai/api/v1/chat/completions "HTTP/1.1 200 OK"
2025-10-18 16:21:43,724 - httpx - INFO - HTTP Request: POST https://generativelanguage.googleapis.com/v1beta/openai/chat/completions "HTTP/1.1 200 OK"
2025-10-18 16:21:45,314 - httpx - INFO - HTTP Request: POST https://api.openai.com/v1/traces/ingest "HTTP/1.1 204 No Content"
2025-10-18 16:21:45,341 - httpx - INFO - HTTP Request: POST https://generativelanguage.googleapis.com/v1beta/openai/chat/completions "HTTP/1.1 200 OK"
2025-10-18 16:21:45,453 - httpx - INFO - HTTP Request: POST https://generativelanguage.googleapis.com/v1beta/openai/chat/completions "HTTP/1.1 200 OK"
 Phase 2 Complete with consensus - Duration: 1m 56s
   Rounds conducted: 1
   Final earnings:
     Agent_1: $5.31
     Agent_2: $4.97
     Agent_3: $6.30

[TECH] Experiment 5ef4620d-ffa8-4a9b-b65d-01051c5919f0 completed successfully in 212.41 seconds
2025-10-18 16:21:45,979 - httpx - INFO - HTTP Request: POST https://generativelanguage.googleapis.com/v1beta/openai/chat/completions "HTTP/1.1 200 OK"
[TECH] Consensus validation successful - discussion aligns with recorded consensus
[TECH] Transcript saved to: /Users/lucasmuller/Desktop/Githubg/Rawls_v3/transcript_5ef4620d-ffa8-4a9b-b65d-01051c5919f0.json
2025-10-18 16:21:45,993 - core.experiment_manager - INFO - Results saved to: /Users/lucasmuller/Desktop/Githubg/Rawls_v3/hypothesis_testing/hypothesis_2/results/american/hypothesis_2_american_condition_8_config_results.json
2025-10-18 16:21:45,993 - core.experiment_manager - INFO - Seed used: 114114998 (generated)
[TECH] Results saved to: /Users/lucasmuller/Desktop/Githubg/Rawls_v3/hypothesis_testing/hypothesis_2/results/american/hypothesis_2_american_condition_8_config_results.json
[DEBUG] Trace: https://platform.openai.com/logs/trace?trace_id=trace_365f2ff8f12344e7847270bf8141ea0f
════════════════════════════════════════════════════════════
✅ EXPERIMENT COMPLETED
════════════════════════════════════════════════════════════
Total Duration: 3m 37s
Consensus: ✅ maximizing_floor
Transcript saved: /Users/lucasmuller/Desktop/Githubg/Rawls_v3/transcript_5ef4620d-ffa8-4a9b-b65d-01051c5919f0.json
Errors: None
Results saved: /Users/lucasmuller/Desktop/Githubg/Rawls_v3/hypothesis_testing/hypothesis_2/results/american/hypothesis_2_american_condition_8_config_results.json
🔗 Trace: https://platform.openai.com/logs/trace?trace_id=trace_365f2ff8f12344e7847270bf8141ea0f


Frohlich Experiment Results (ID: 5ef4620d-ffa8-4a9b-b65d-01051c5919f0)
Completed in 212.41 seconds

PHASE 1 RESULTS:
  Agent_1: $7.90 (Initial pref: maximizing_floor, Final pref: maximizing_floor)
  Agent_2: $7.00 (Initial pref: maximizing_floor, Final pref: maximizing_floor)
  Agent_3: $7.30 (Initial pref: maximizing_floor, Final pref: maximizing_floor)
  Average Phase 1 earnings: $7.40

PHASE 2 RESULTS:
  Consensus reached on: maximizing_floor
  Rounds to consensus: 1
  Phase 2 earnings:
    Agent_1: $5.31
    Agent_2: $4.97
    Agent_3: $6.30
  Average Phase 2 earnings: $5.53

TOTAL EARNINGS:
  Agent_3: $13.60
  Agent_1: $13.21
  Agent_2: $11.97

HIGHEST EARNER: Agent_3 with $13.60

RETURN CODE: 0  DURATION: 219.5s
