CMD: /Users/lucasmuller/Desktop/Githubg/Rawls_v3/.venv/bin/python /Users/lucasmuller/Desktop/Githubg/Rawls_v3/main.py /Users/lucasmuller/Desktop/Githubg/Rawls_v3/hypothesis_testing/hypothesis_2/configs/american/hypothesis_2_american_condition_2_config.yaml /Users/lucasmuller/Desktop/Githubg/Rawls_v3/hypothesis_testing/hypothesis_2/results/american/hypothesis_2_american_condition_2_config_results.json
[TECH] Loading configuration from: /Users/lucasmuller/Desktop/Githubg/Rawls_v3/hypothesis_testing/hypothesis_2/configs/american/hypothesis_2_american_condition_2_config.yaml
2025-10-18 16:18:08,206 - utils.seed_manager - INFO - Generated seed 163131405 from configuration hash
2025-10-18 16:18:08,206 - utils.language_manager - INFO - Language set to: English
[TECH] Language set to: English
════════════════════════════════════════════════════════════
🧪 FROHLICH EXPERIMENT STARTING
════════════════════════════════════════════════════════════
Experiment ID: 2707c109
Participants: 3
Language: English
Max Phase 2 rounds: 10
Configuration file: hypothesis_2_american_condition_2_config.yaml
Started at: 16:18:08

[DEBUG] ✅ FORMAL VOTING: Using structured consensus building with confirmation and secret ballot
[DEBUG]    • Voting initiated via end-of-round prompts only
[DEBUG]    • Voting requires confirmation from all participants
[DEBUG]    • Consensus reached via unanimous secret ballot
[TECH] Tracing policy: participant-only spans; utility agents untraced
🤖 Initializing Agents...
2025-10-18 16:18:08,207 - experiment_agents.participant_agent - INFO - Creating 3 participant agents with dynamic temperature detection...
2025-10-18 16:18:08,207 - experiment_agents.participant_agent - INFO - Creating agent: Agent_1 (model: x-ai/grok-code-fast-1, temp: 0.0)
2025-10-18 16:18:08,207 - experiment_agents.participant_agent - INFO - Creating agent Agent_1 with dynamic temperature detection
2025-10-18 16:18:08,271 - utils.language_manager - INFO - Loaded translations for English
2025-10-18 16:18:09,184 - httpx - INFO - HTTP Request: POST https://openrouter.ai/api/v1/chat/completions "HTTP/1.1 200 OK"
2025-10-18 16:18:10,944 - utils.dynamic_model_capabilities - INFO - ✅ x-ai/grok-code-fast-1 supports temperature (discovered during creation)
2025-10-18 16:18:10,944 - experiment_agents.participant_agent - INFO - ✅ Agent_1: Temperature 0.0 active (method: successful_creation)
2025-10-18 16:18:10,944 - experiment_agents.participant_agent - INFO - ✅ Successfully initialized agent Agent_1
2025-10-18 16:18:10,944 - experiment_agents.participant_agent - INFO - Creating agent: Agent_2 (model: x-ai/grok-4-fast, temp: 0.0)
2025-10-18 16:18:10,944 - experiment_agents.participant_agent - INFO - Creating agent Agent_2 with dynamic temperature detection
2025-10-18 16:18:11,178 - httpx - INFO - HTTP Request: POST https://openrouter.ai/api/v1/chat/completions "HTTP/1.1 200 OK"
2025-10-18 16:18:11,853 - utils.dynamic_model_capabilities - INFO - ✅ x-ai/grok-4-fast supports temperature (discovered during creation)
2025-10-18 16:18:11,854 - experiment_agents.participant_agent - INFO - ✅ Agent_2: Temperature 0.0 active (method: successful_creation)
2025-10-18 16:18:11,854 - experiment_agents.participant_agent - INFO - ✅ Successfully initialized agent Agent_2
2025-10-18 16:18:11,854 - experiment_agents.participant_agent - INFO - Creating agent: Agent_3 (model: x-ai/grok-code-fast-1, temp: 0.0)
2025-10-18 16:18:11,854 - experiment_agents.participant_agent - INFO - Creating agent Agent_3 with dynamic temperature detection
2025-10-18 16:18:12,119 - httpx - INFO - HTTP Request: POST https://openrouter.ai/api/v1/chat/completions "HTTP/1.1 200 OK"
2025-10-18 16:18:14,315 - experiment_agents.participant_agent - INFO - ✅ Agent_3: Temperature 0.0 active (method: successful_creation)
2025-10-18 16:18:14,315 - experiment_agents.participant_agent - INFO - ✅ Successfully initialized agent Agent_3
2025-10-18 16:18:14,315 - experiment_agents.participant_agent - INFO - ✅ Successfully created 3 participant agents
2025-10-18 16:18:14,315 - experiment_agents.utility_agent - INFO - Creating utility agents with model: gemini-2.0-flash-lite (tracing disabled)
2025-10-18 16:18:14,341 - utils.gemini_client - INFO - Successfully initialized Gemini client with OpenAI-compatible endpoint
2025-10-18 16:18:14,934 - httpx - INFO - HTTP Request: POST https://generativelanguage.googleapis.com/v1beta/openai/chat/completions "HTTP/1.1 200 OK"
2025-10-18 16:18:14,937 - utils.dynamic_model_capabilities - INFO - ✅ gemini-2.0-flash-lite supports temperature (discovered during creation)
2025-10-18 16:18:15,455 - httpx - INFO - HTTP Request: POST https://generativelanguage.googleapis.com/v1beta/openai/chat/completions "HTTP/1.1 200 OK"
2025-10-18 16:18:15,457 - experiment_agents.utility_agent - INFO - ✅ Utility agents initialized successfully
2025-10-18 16:18:15,458 - core.experiment_manager - INFO - ✅ Experiment manager initialized with 3 participants
  ✅ Agent_1 (grok-code-fast-1) [0.0s]
  ✅ Agent_2 (grok-4-fast) [0.0s]
  ✅ Agent_3 (grok-code-fast-1) [0.0s]

✨ All agents ready in 7.3s

2025-10-18 16:18:15,458 - utils.seed_manager - INFO - Generated seed 163131405 from configuration hash
2025-10-18 16:18:15,458 - utils.seed_manager - INFO - Experiment random seed set to: 163131405
[TECH] Experiment seed: 163131405 (generated)
[TECH] Tracing experiment: Frohlich Experiment - 2707c109-e05b-449f-a2ed-c51cae7a6995
[TECH] Trace ID: trace_71d2bbc5870649059bda67593f113553
📖 PHASE 1: Individual Familiarization
━━━━━━━━━━━━━━━━━━━━━━━━━━━━━━━━━━━━━━━━━━━━━━━━━━
Running parallel familiarization for 3 participants...

[TECH] Phase 1 executing with language: English
  Agent_1: Initial ranking [██░░░░░░░░░░░░░░░░░░] 10.0%
  Agent_2: Initial ranking [██░░░░░░░░░░░░░░░░░░] 10.0%
  Agent_3: Initial ranking [██░░░░░░░░░░░░░░░░░░] 10.0%
2025-10-18 16:18:15,734 - httpx - INFO - HTTP Request: POST https://openrouter.ai/api/v1/chat/completions "HTTP/1.1 200 OK"
2025-10-18 16:18:15,770 - httpx - INFO - HTTP Request: POST https://openrouter.ai/api/v1/chat/completions "HTTP/1.1 200 OK"
2025-10-18 16:18:15,814 - httpx - INFO - HTTP Request: POST https://openrouter.ai/api/v1/chat/completions "HTTP/1.1 200 OK"
2025-10-18 16:18:18,400 - httpx - INFO - HTTP Request: POST https://generativelanguage.googleapis.com/v1beta/openai/chat/completions "HTTP/1.1 200 OK"
2025-10-18 16:18:18,659 - httpx - INFO - HTTP Request: POST https://openrouter.ai/api/v1/chat/completions "HTTP/1.1 200 OK"
2025-10-18 16:18:19,476 - httpx - INFO - HTTP Request: POST https://generativelanguage.googleapis.com/v1beta/openai/chat/completions "HTTP/1.1 200 OK"
2025-10-18 16:18:19,748 - httpx - INFO - HTTP Request: POST https://openrouter.ai/api/v1/chat/completions "HTTP/1.1 200 OK"
2025-10-18 16:18:20,485 - httpx - INFO - HTTP Request: POST https://generativelanguage.googleapis.com/v1beta/openai/chat/completions "HTTP/1.1 200 OK"
2025-10-18 16:18:20,736 - httpx - INFO - HTTP Request: POST https://openrouter.ai/api/v1/chat/completions "HTTP/1.1 200 OK"
2025-10-18 16:18:21,909 - httpx - INFO - HTTP Request: POST https://api.openai.com/v1/traces/ingest "HTTP/1.1 204 No Content"
  Agent_2: Learning principles [█████░░░░░░░░░░░░░░░] 25.0%
2025-10-18 16:18:22,653 - httpx - INFO - HTTP Request: POST https://openrouter.ai/api/v1/chat/completions "HTTP/1.1 200 OK"
  Agent_1: Learning principles [█████░░░░░░░░░░░░░░░] 25.0%
2025-10-18 16:18:24,473 - httpx - INFO - HTTP Request: POST https://openrouter.ai/api/v1/chat/completions "HTTP/1.1 200 OK"
2025-10-18 16:18:26,326 - httpx - INFO - HTTP Request: POST https://openrouter.ai/api/v1/chat/completions "HTTP/1.1 200 OK"
  Agent_3: Learning principles [█████░░░░░░░░░░░░░░░] 25.0%
2025-10-18 16:18:27,486 - httpx - INFO - HTTP Request: POST https://api.openai.com/v1/traces/ingest "HTTP/1.1 204 No Content"
2025-10-18 16:18:27,548 - httpx - INFO - HTTP Request: POST https://openrouter.ai/api/v1/chat/completions "HTTP/1.1 200 OK"
  Agent_2: Post-explanation ranking [████████░░░░░░░░░░░░] 40.0%
2025-10-18 16:18:30,928 - httpx - INFO - HTTP Request: POST https://openrouter.ai/api/v1/chat/completions "HTTP/1.1 200 OK"
2025-10-18 16:18:31,105 - httpx - INFO - HTTP Request: POST https://openrouter.ai/api/v1/chat/completions "HTTP/1.1 200 OK"
2025-10-18 16:18:32,973 - httpx - INFO - HTTP Request: POST https://api.openai.com/v1/traces/ingest "HTTP/1.1 204 No Content"
2025-10-18 16:18:33,312 - httpx - INFO - HTTP Request: POST https://generativelanguage.googleapis.com/v1beta/openai/chat/completions "HTTP/1.1 200 OK"
2025-10-18 16:18:33,589 - httpx - INFO - HTTP Request: POST https://openrouter.ai/api/v1/chat/completions "HTTP/1.1 200 OK"
  Agent_1: Post-explanation ranking [████████░░░░░░░░░░░░] 40.0%
2025-10-18 16:18:36,826 - httpx - INFO - HTTP Request: POST https://openrouter.ai/api/v1/chat/completions "HTTP/1.1 200 OK"
  Agent_2: Application round 1 [██████████░░░░░░░░░░] 50.0%
2025-10-18 16:18:38,429 - httpx - INFO - HTTP Request: POST https://api.openai.com/v1/traces/ingest "HTTP/1.1 204 No Content"
2025-10-18 16:18:38,613 - httpx - INFO - HTTP Request: POST https://openrouter.ai/api/v1/chat/completions "HTTP/1.1 200 OK"
2025-10-18 16:18:38,739 - httpx - INFO - HTTP Request: POST https://api.openai.com/v1/traces/ingest "HTTP/1.1 204 No Content"
2025-10-18 16:18:40,810 - httpx - INFO - HTTP Request: POST https://generativelanguage.googleapis.com/v1beta/openai/chat/completions "HTTP/1.1 200 OK"
2025-10-18 16:18:41,774 - httpx - INFO - HTTP Request: POST https://openrouter.ai/api/v1/chat/completions "HTTP/1.1 200 OK"
2025-10-18 16:18:43,940 - httpx - INFO - HTTP Request: POST https://generativelanguage.googleapis.com/v1beta/openai/chat/completions "HTTP/1.1 200 OK"
2025-10-18 16:18:44,199 - httpx - INFO - HTTP Request: POST https://api.openai.com/v1/traces/ingest "HTTP/1.1 204 No Content"
2025-10-18 16:18:44,414 - httpx - INFO - HTTP Request: POST https://openrouter.ai/api/v1/chat/completions "HTTP/1.1 200 OK"
2025-10-18 16:18:49,195 - httpx - INFO - HTTP Request: POST https://openrouter.ai/api/v1/chat/completions "HTTP/1.1 200 OK"
  Agent_1: Application round 1 [██████████░░░░░░░░░░] 50.0%
2025-10-18 16:18:49,723 - httpx - INFO - HTTP Request: POST https://api.openai.com/v1/traces/ingest "HTTP/1.1 204 No Content"
2025-10-18 16:18:50,015 - httpx - INFO - HTTP Request: POST https://openrouter.ai/api/v1/chat/completions "HTTP/1.1 200 OK"
2025-10-18 16:18:50,059 - httpx - INFO - HTTP Request: POST https://api.openai.com/v1/traces/ingest "HTTP/1.1 204 No Content"
  Agent_3: Post-explanation ranking [████████░░░░░░░░░░░░] 40.0%
2025-10-18 16:18:53,776 - httpx - INFO - HTTP Request: POST https://openrouter.ai/api/v1/chat/completions "HTTP/1.1 200 OK"
  Agent_2: Application round 2 [████████████░░░░░░░░] 60.0%
2025-10-18 16:18:54,594 - httpx - INFO - HTTP Request: POST https://openrouter.ai/api/v1/chat/completions "HTTP/1.1 200 OK"
2025-10-18 16:18:55,563 - httpx - INFO - HTTP Request: POST https://api.openai.com/v1/traces/ingest "HTTP/1.1 204 No Content"
2025-10-18 16:18:55,922 - httpx - INFO - HTTP Request: POST https://generativelanguage.googleapis.com/v1beta/openai/chat/completions "HTTP/1.1 200 OK"
2025-10-18 16:18:56,396 - httpx - INFO - HTTP Request: POST https://openrouter.ai/api/v1/chat/completions "HTTP/1.1 200 OK"
2025-10-18 16:18:58,644 - httpx - INFO - HTTP Request: POST https://generativelanguage.googleapis.com/v1beta/openai/chat/completions "HTTP/1.1 200 OK"
2025-10-18 16:18:58,879 - httpx - INFO - HTTP Request: POST https://openrouter.ai/api/v1/chat/completions "HTTP/1.1 200 OK"
2025-10-18 16:18:59,580 - httpx - INFO - HTTP Request: POST https://generativelanguage.googleapis.com/v1beta/openai/chat/completions "HTTP/1.1 200 OK"
2025-10-18 16:19:00,048 - httpx - INFO - HTTP Request: POST https://openrouter.ai/api/v1/chat/completions "HTTP/1.1 200 OK"
2025-10-18 16:19:01,121 - httpx - INFO - HTTP Request: POST https://api.openai.com/v1/traces/ingest "HTTP/1.1 204 No Content"
  Agent_1: Application round 2 [████████████░░░░░░░░] 60.0%
2025-10-18 16:19:02,138 - httpx - INFO - HTTP Request: POST https://openrouter.ai/api/v1/chat/completions "HTTP/1.1 200 OK"
  Agent_3: Application round 1 [██████████░░░░░░░░░░] 50.0%
2025-10-18 16:19:04,784 - httpx - INFO - HTTP Request: POST https://openrouter.ai/api/v1/chat/completions "HTTP/1.1 200 OK"
2025-10-18 16:19:06,578 - httpx - INFO - HTTP Request: POST https://api.openai.com/v1/traces/ingest "HTTP/1.1 204 No Content"
2025-10-18 16:19:06,971 - httpx - INFO - HTTP Request: POST https://api.openai.com/v1/traces/ingest "HTTP/1.1 204 No Content"
2025-10-18 16:19:07,258 - httpx - INFO - HTTP Request: POST https://generativelanguage.googleapis.com/v1beta/openai/chat/completions "HTTP/1.1 200 OK"
2025-10-18 16:19:07,681 - httpx - INFO - HTTP Request: POST https://openrouter.ai/api/v1/chat/completions "HTTP/1.1 200 OK"
  Agent_2: Application round 3 [██████████████░░░░░░] 70.0%
2025-10-18 16:19:09,045 - httpx - INFO - HTTP Request: POST https://openrouter.ai/api/v1/chat/completions "HTTP/1.1 200 OK"
2025-10-18 16:19:10,942 - httpx - INFO - HTTP Request: POST https://generativelanguage.googleapis.com/v1beta/openai/chat/completions "HTTP/1.1 200 OK"
2025-10-18 16:19:11,416 - httpx - INFO - HTTP Request: POST https://openrouter.ai/api/v1/chat/completions "HTTP/1.1 200 OK"
2025-10-18 16:19:12,498 - httpx - INFO - HTTP Request: POST https://api.openai.com/v1/traces/ingest "HTTP/1.1 204 No Content"
2025-10-18 16:19:12,771 - httpx - INFO - HTTP Request: POST https://generativelanguage.googleapis.com/v1beta/openai/chat/completions "HTTP/1.1 200 OK"
  Agent_1: Application round 3 [██████████████░░░░░░] 70.0%
2025-10-18 16:19:13,223 - httpx - INFO - HTTP Request: POST https://openrouter.ai/api/v1/chat/completions "HTTP/1.1 200 OK"
2025-10-18 16:19:13,355 - httpx - INFO - HTTP Request: POST https://openrouter.ai/api/v1/chat/completions "HTTP/1.1 200 OK"
2025-10-18 16:19:17,422 - httpx - INFO - HTTP Request: POST https://generativelanguage.googleapis.com/v1beta/openai/chat/completions "HTTP/1.1 200 OK"
2025-10-18 16:19:18,014 - httpx - INFO - HTTP Request: POST https://openrouter.ai/api/v1/chat/completions "HTTP/1.1 200 OK"
2025-10-18 16:19:18,062 - httpx - INFO - HTTP Request: POST https://api.openai.com/v1/traces/ingest "HTTP/1.1 204 No Content"
  Agent_1: Application round 4 [████████████████░░░░] 80.0%
2025-10-18 16:19:24,245 - httpx - INFO - HTTP Request: POST https://openrouter.ai/api/v1/chat/completions "HTTP/1.1 200 OK"
  Agent_2: Application round 4 [████████████████░░░░] 80.0%
2025-10-18 16:19:26,301 - httpx - INFO - HTTP Request: POST https://openrouter.ai/api/v1/chat/completions "HTTP/1.1 200 OK"
  Agent_3: Application round 2 [████████████░░░░░░░░] 60.0%
2025-10-18 16:19:27,181 - httpx - INFO - HTTP Request: POST https://openrouter.ai/api/v1/chat/completions "HTTP/1.1 200 OK"
2025-10-18 16:19:28,171 - httpx - INFO - HTTP Request: POST https://generativelanguage.googleapis.com/v1beta/openai/chat/completions "HTTP/1.1 200 OK"
2025-10-18 16:19:28,721 - httpx - INFO - HTTP Request: POST https://api.openai.com/v1/traces/ingest "HTTP/1.1 204 No Content"
2025-10-18 16:19:28,767 - httpx - INFO - HTTP Request: POST https://openrouter.ai/api/v1/chat/completions "HTTP/1.1 200 OK"
2025-10-18 16:19:29,587 - httpx - INFO - HTTP Request: POST https://generativelanguage.googleapis.com/v1beta/openai/chat/completions "HTTP/1.1 200 OK"
2025-10-18 16:19:30,017 - httpx - INFO - HTTP Request: POST https://openrouter.ai/api/v1/chat/completions "HTTP/1.1 200 OK"
2025-10-18 16:19:32,198 - httpx - INFO - HTTP Request: POST https://generativelanguage.googleapis.com/v1beta/openai/chat/completions "HTTP/1.1 200 OK"
2025-10-18 16:19:32,607 - httpx - INFO - HTTP Request: POST https://openrouter.ai/api/v1/chat/completions "HTTP/1.1 200 OK"
2025-10-18 16:19:34,338 - httpx - INFO - HTTP Request: POST https://api.openai.com/v1/traces/ingest "HTTP/1.1 204 No Content"
  Agent_1: Final ranking [██████████████████░░] 90.0%
2025-10-18 16:19:36,313 - httpx - INFO - HTTP Request: POST https://openrouter.ai/api/v1/chat/completions "HTTP/1.1 200 OK"
  Agent_3: Application round 3 [██████████████░░░░░░] 70.0%
2025-10-18 16:19:38,999 - httpx - INFO - HTTP Request: POST https://generativelanguage.googleapis.com/v1beta/openai/chat/completions "HTTP/1.1 200 OK"
2025-10-18 16:19:39,244 - httpx - INFO - HTTP Request: POST https://openrouter.ai/api/v1/chat/completions "HTTP/1.1 200 OK"
2025-10-18 16:19:39,302 - httpx - INFO - HTTP Request: POST https://openrouter.ai/api/v1/chat/completions "HTTP/1.1 200 OK"
2025-10-18 16:19:39,827 - httpx - INFO - HTTP Request: POST https://api.openai.com/v1/traces/ingest "HTTP/1.1 204 No Content"
2025-10-18 16:19:43,439 - httpx - INFO - HTTP Request: POST https://generativelanguage.googleapis.com/v1beta/openai/chat/completions "HTTP/1.1 200 OK"
2025-10-18 16:19:43,918 - httpx - INFO - HTTP Request: POST https://openrouter.ai/api/v1/chat/completions "HTTP/1.1 200 OK"
2025-10-18 16:19:45,219 - httpx - INFO - HTTP Request: POST https://api.openai.com/v1/traces/ingest "HTTP/1.1 204 No Content"
  Agent_2: Final ranking [██████████████████░░] 90.0%
  Agent_1: Completed [████████████████████] 100.0%
2025-10-18 16:19:47,306 - httpx - INFO - HTTP Request: POST https://openrouter.ai/api/v1/chat/completions "HTTP/1.1 200 OK"
2025-10-18 16:19:49,722 - httpx - INFO - HTTP Request: POST https://generativelanguage.googleapis.com/v1beta/openai/chat/completions "HTTP/1.1 200 OK"
2025-10-18 16:19:50,005 - httpx - INFO - HTTP Request: POST https://openrouter.ai/api/v1/chat/completions "HTTP/1.1 200 OK"
2025-10-18 16:19:50,828 - httpx - INFO - HTTP Request: POST https://api.openai.com/v1/traces/ingest "HTTP/1.1 204 No Content"
  Agent_3: Application round 4 [████████████████░░░░] 80.0%
2025-10-18 16:19:51,390 - httpx - INFO - HTTP Request: POST https://openrouter.ai/api/v1/chat/completions "HTTP/1.1 200 OK"
2025-10-18 16:19:55,749 - httpx - INFO - HTTP Request: POST https://generativelanguage.googleapis.com/v1beta/openai/chat/completions "HTTP/1.1 200 OK"
2025-10-18 16:19:56,220 - httpx - INFO - HTTP Request: POST https://openrouter.ai/api/v1/chat/completions "HTTP/1.1 200 OK"
2025-10-18 16:19:56,257 - httpx - INFO - HTTP Request: POST https://api.openai.com/v1/traces/ingest "HTTP/1.1 204 No Content"
  Agent_3: Final ranking [██████████████████░░] 90.0%
2025-10-18 16:20:03,607 - httpx - INFO - HTTP Request: POST https://openrouter.ai/api/v1/chat/completions "HTTP/1.1 200 OK"
  Agent_2: Completed [████████████████████] 100.0%
2025-10-18 16:20:06,839 - httpx - INFO - HTTP Request: POST https://api.openai.com/v1/traces/ingest "HTTP/1.1 204 No Content"
2025-10-18 16:20:08,862 - httpx - INFO - HTTP Request: POST https://generativelanguage.googleapis.com/v1beta/openai/chat/completions "HTTP/1.1 200 OK"
2025-10-18 16:20:09,090 - httpx - INFO - HTTP Request: POST https://openrouter.ai/api/v1/chat/completions "HTTP/1.1 200 OK"
2025-10-18 16:20:12,250 - httpx - INFO - HTTP Request: POST https://api.openai.com/v1/traces/ingest "HTTP/1.1 204 No Content"
  Agent_3: Completed [████████████████████] 100.0%

🎯 Phase 1 Complete - Duration: 2m 5s
  Agent_1: $7.50 earned
  Agent_2: $9.30 earned
  Agent_3: $7.10 earned

💬 PHASE 2: Group Discussion
━━━━━━━━━━━━━━━━━━━━━━━━━━━━━━━━━━━━━━━━━━━━━━━━━━
Beginning group discussion (max 10 rounds)...

🗣️  Round 1 (1/10)
   Speaking order: Agent_3 → Agent_1 → Agent_2
   💭 Agent_3 is thinking...
2025-10-18 16:20:21,084 - httpx - INFO - HTTP Request: POST https://openrouter.ai/api/v1/chat/completions "HTTP/1.1 200 OK"
2025-10-18 16:20:22,789 - httpx - INFO - HTTP Request: POST https://api.openai.com/v1/traces/ingest "HTTP/1.1 204 No Content"
2025-10-18 16:20:32,728 - httpx - INFO - HTTP Request: POST https://openrouter.ai/api/v1/chat/completions "HTTP/1.1 200 OK"
2025-10-18 16:20:33,298 - httpx - INFO - HTTP Request: POST https://api.openai.com/v1/traces/ingest "HTTP/1.1 204 No Content"
   ✅ Agent_3 responded (1080 chars) [15.7s]
2025-10-18 16:20:36,952 - httpx - INFO - HTTP Request: POST https://generativelanguage.googleapis.com/v1beta/openai/chat/completions "HTTP/1.1 200 OK"
   💭 Agent_1 is thinking...
2025-10-18 16:20:37,367 - httpx - INFO - HTTP Request: POST https://openrouter.ai/api/v1/chat/completions "HTTP/1.1 200 OK"
2025-10-18 16:20:38,717 - httpx - INFO - HTTP Request: POST https://api.openai.com/v1/traces/ingest "HTTP/1.1 204 No Content"
2025-10-18 16:20:47,660 - httpx - INFO - HTTP Request: POST https://openrouter.ai/api/v1/chat/completions "HTTP/1.1 200 OK"
2025-10-18 16:20:49,226 - httpx - INFO - HTTP Request: POST https://api.openai.com/v1/traces/ingest "HTTP/1.1 204 No Content"
   ✅ Agent_1 responded (1556 chars) [14.9s]
2025-10-18 16:20:52,607 - httpx - INFO - HTTP Request: POST https://generativelanguage.googleapis.com/v1beta/openai/chat/completions "HTTP/1.1 200 OK"
   💭 Agent_2 is thinking...
2025-10-18 16:20:53,064 - httpx - INFO - HTTP Request: POST https://openrouter.ai/api/v1/chat/completions "HTTP/1.1 200 OK"
2025-10-18 16:20:54,653 - httpx - INFO - HTTP Request: POST https://api.openai.com/v1/traces/ingest "HTTP/1.1 204 No Content"
2025-10-18 16:21:03,657 - httpx - INFO - HTTP Request: POST https://openrouter.ai/api/v1/chat/completions "HTTP/1.1 200 OK"
2025-10-18 16:21:05,238 - httpx - INFO - HTTP Request: POST https://api.openai.com/v1/traces/ingest "HTTP/1.1 204 No Content"
   ✅ Agent_2 responded (2194 chars) [14.4s]
2025-10-18 16:21:07,798 - httpx - INFO - HTTP Request: POST https://generativelanguage.googleapis.com/v1beta/openai/chat/completions "HTTP/1.1 200 OK"
2025-10-18 16:21:08,218 - httpx - INFO - HTTP Request: POST https://openrouter.ai/api/v1/chat/completions "HTTP/1.1 200 OK"
2025-10-18 16:21:10,673 - httpx - INFO - HTTP Request: POST https://api.openai.com/v1/traces/ingest "HTTP/1.1 204 No Content"
2025-10-18 16:21:23,312 - httpx - INFO - HTTP Request: POST https://openrouter.ai/api/v1/chat/completions "HTTP/1.1 200 OK"
2025-10-18 16:21:26,549 - httpx - INFO - HTTP Request: POST https://api.openai.com/v1/traces/ingest "HTTP/1.1 204 No Content"
2025-10-18 16:21:41,939 - httpx - INFO - HTTP Request: POST https://openrouter.ai/api/v1/chat/completions "HTTP/1.1 200 OK"
2025-10-18 16:21:42,236 - httpx - INFO - HTTP Request: POST https://api.openai.com/v1/traces/ingest "HTTP/1.1 204 No Content"
2025-10-18 16:21:54,307 - httpx - INFO - HTTP Request: POST https://openrouter.ai/api/v1/chat/completions "HTTP/1.1 200 OK"
2025-10-18 16:21:56,421 - httpx - INFO - HTTP Request: POST https://openrouter.ai/api/v1/chat/completions "HTTP/1.1 200 OK"
2025-10-18 16:21:57,897 - httpx - INFO - HTTP Request: POST https://api.openai.com/v1/traces/ingest "HTTP/1.1 204 No Content"
2025-10-18 16:21:58,116 - httpx - INFO - HTTP Request: POST https://openrouter.ai/api/v1/chat/completions "HTTP/1.1 200 OK"
2025-10-18 16:21:58,216 - httpx - INFO - HTTP Request: POST https://api.openai.com/v1/traces/ingest "HTTP/1.1 204 No Content"
   ✅ Round 1 complete - 1m 38s

🗣️  Round 2 (2/10)
   Speaking order: Agent_1 → Agent_2 → Agent_3
   💭 Agent_1 is thinking...
2025-10-18 16:21:59,758 - httpx - INFO - HTTP Request: POST https://openrouter.ai/api/v1/chat/completions "HTTP/1.1 200 OK"
2025-10-18 16:22:03,607 - httpx - INFO - HTTP Request: POST https://api.openai.com/v1/traces/ingest "HTTP/1.1 204 No Content"
2025-10-18 16:22:15,109 - httpx - INFO - HTTP Request: POST https://openrouter.ai/api/v1/chat/completions "HTTP/1.1 200 OK"
2025-10-18 16:22:19,289 - httpx - INFO - HTTP Request: POST https://api.openai.com/v1/traces/ingest "HTTP/1.1 204 No Content"
   ✅ Agent_1 responded (1975 chars) [20.7s]
2025-10-18 16:22:20,858 - httpx - INFO - HTTP Request: POST https://generativelanguage.googleapis.com/v1beta/openai/chat/completions "HTTP/1.1 200 OK"
   💭 Agent_2 is thinking...
2025-10-18 16:22:21,641 - httpx - INFO - HTTP Request: POST https://openrouter.ai/api/v1/chat/completions "HTTP/1.1 200 OK"
2025-10-18 16:22:24,739 - httpx - INFO - HTTP Request: POST https://api.openai.com/v1/traces/ingest "HTTP/1.1 204 No Content"
2025-10-18 16:22:33,166 - httpx - INFO - HTTP Request: POST https://openrouter.ai/api/v1/chat/completions "HTTP/1.1 200 OK"
2025-10-18 16:22:35,443 - httpx - INFO - HTTP Request: POST https://api.openai.com/v1/traces/ingest "HTTP/1.1 204 No Content"
   ✅ Agent_2 responded (2609 chars) [19.4s]
2025-10-18 16:22:40,886 - httpx - INFO - HTTP Request: POST https://api.openai.com/v1/traces/ingest "HTTP/1.1 204 No Content"
2025-10-18 16:22:40,979 - httpx - INFO - HTTP Request: POST https://generativelanguage.googleapis.com/v1beta/openai/chat/completions "HTTP/1.1 200 OK"
   💭 Agent_3 is thinking...
2025-10-18 16:22:41,430 - httpx - INFO - HTTP Request: POST https://openrouter.ai/api/v1/chat/completions "HTTP/1.1 200 OK"
2025-10-18 16:22:52,987 - httpx - INFO - HTTP Request: POST https://openrouter.ai/api/v1/chat/completions "HTTP/1.1 200 OK"
2025-10-18 16:22:56,545 - httpx - INFO - HTTP Request: POST https://api.openai.com/v1/traces/ingest "HTTP/1.1 204 No Content"
   ✅ Agent_3 responded (2199 chars) [23.0s]
2025-10-18 16:23:04,651 - httpx - INFO - HTTP Request: POST https://generativelanguage.googleapis.com/v1beta/openai/chat/completions "HTTP/1.1 200 OK"
2025-10-18 16:23:05,145 - httpx - INFO - HTTP Request: POST https://openrouter.ai/api/v1/chat/completions "HTTP/1.1 200 OK"
2025-10-18 16:23:07,095 - httpx - INFO - HTTP Request: POST https://api.openai.com/v1/traces/ingest "HTTP/1.1 204 No Content"
2025-10-18 16:23:25,978 - utils.memory_manager - INFO - Memory approaching limit for Agent_2, attempting compression...
2025-10-18 16:23:26,388 - httpx - INFO - HTTP Request: POST https://openrouter.ai/api/v1/chat/completions "HTTP/1.1 200 OK"
2025-10-18 16:23:27,855 - httpx - INFO - HTTP Request: POST https://api.openai.com/v1/traces/ingest "HTTP/1.1 204 No Content"
2025-10-18 16:23:37,226 - utils.memory_manager - INFO - Memory compressed from 22335 to 8074 characters
2025-10-18 16:23:37,730 - httpx - INFO - HTTP Request: POST https://openrouter.ai/api/v1/chat/completions "HTTP/1.1 200 OK"
2025-10-18 16:23:38,375 - httpx - INFO - HTTP Request: POST https://api.openai.com/v1/traces/ingest "HTTP/1.1 204 No Content"
2025-10-18 16:23:49,378 - httpx - INFO - HTTP Request: POST https://openrouter.ai/api/v1/chat/completions "HTTP/1.1 200 OK"
2025-10-18 16:23:53,992 - httpx - INFO - HTTP Request: POST https://api.openai.com/v1/traces/ingest "HTTP/1.1 204 No Content"
2025-10-18 16:23:59,921 - httpx - INFO - HTTP Request: POST https://openrouter.ai/api/v1/chat/completions "HTTP/1.1 200 OK"
2025-10-18 16:24:01,737 - httpx - INFO - HTTP Request: POST https://openrouter.ai/api/v1/chat/completions "HTTP/1.1 200 OK"
2025-10-18 16:24:03,290 - httpx - INFO - HTTP Request: POST https://openrouter.ai/api/v1/chat/completions "HTTP/1.1 200 OK"
2025-10-18 16:24:04,622 - httpx - INFO - HTTP Request: POST https://api.openai.com/v1/traces/ingest "HTTP/1.1 204 No Content"
   ✅ Round 2 complete - 2m 5s

🗣️  Round 3 (3/10)
   Speaking order: Agent_1 → Agent_3 → Agent_2
   💭 Agent_1 is thinking...
2025-10-18 16:24:05,515 - httpx - INFO - HTTP Request: POST https://openrouter.ai/api/v1/chat/completions "HTTP/1.1 200 OK"
2025-10-18 16:24:10,016 - httpx - INFO - HTTP Request: POST https://api.openai.com/v1/traces/ingest "HTTP/1.1 204 No Content"
2025-10-18 16:24:15,965 - httpx - INFO - HTTP Request: POST https://openrouter.ai/api/v1/chat/completions "HTTP/1.1 200 OK"
2025-10-18 16:24:20,557 - httpx - INFO - HTTP Request: POST https://api.openai.com/v1/traces/ingest "HTTP/1.1 204 No Content"
   ✅ Agent_1 responded (2195 chars) [16.8s]
2025-10-18 16:24:23,618 - httpx - INFO - HTTP Request: POST https://generativelanguage.googleapis.com/v1beta/openai/chat/completions "HTTP/1.1 200 OK"
   💭 Agent_3 is thinking...
2025-10-18 16:24:24,136 - httpx - INFO - HTTP Request: POST https://openrouter.ai/api/v1/chat/completions "HTTP/1.1 200 OK"
2025-10-18 16:24:26,027 - httpx - INFO - HTTP Request: POST https://api.openai.com/v1/traces/ingest "HTTP/1.1 204 No Content"
2025-10-18 16:24:45,753 - httpx - INFO - HTTP Request: POST https://openrouter.ai/api/v1/chat/completions "HTTP/1.1 200 OK"
2025-10-18 16:24:46,795 - httpx - INFO - HTTP Request: POST https://api.openai.com/v1/traces/ingest "HTTP/1.1 204 No Content"
   ✅ Agent_3 responded (2092 chars) [26.7s]
2025-10-18 16:24:51,146 - httpx - INFO - HTTP Request: POST https://generativelanguage.googleapis.com/v1beta/openai/chat/completions "HTTP/1.1 200 OK"
   💭 Agent_2 is thinking...
2025-10-18 16:24:52,265 - httpx - INFO - HTTP Request: POST https://api.openai.com/v1/traces/ingest "HTTP/1.1 204 No Content"
2025-10-18 16:24:53,395 - httpx - INFO - HTTP Request: POST https://openrouter.ai/api/v1/chat/completions "HTTP/1.1 403 Forbidden"
2025-10-18 16:24:53,973 - httpx - INFO - HTTP Request: POST https://openrouter.ai/api/v1/chat/completions "HTTP/1.1 200 OK"
2025-10-18 16:24:57,713 - httpx - INFO - HTTP Request: POST https://api.openai.com/v1/traces/ingest "HTTP/1.1 204 No Content"
   ✅ Agent_2 responded (2410 chars) [6.7s]
2025-10-18 16:24:58,772 - httpx - INFO - HTTP Request: POST https://generativelanguage.googleapis.com/v1beta/openai/chat/completions "HTTP/1.1 200 OK"
2025-10-18 16:24:59,246 - httpx - INFO - HTTP Request: POST https://openrouter.ai/api/v1/chat/completions "HTTP/1.1 200 OK"
2025-10-18 16:25:03,148 - httpx - INFO - HTTP Request: POST https://api.openai.com/v1/traces/ingest "HTTP/1.1 204 No Content"
2025-10-18 16:25:19,241 - httpx - INFO - HTTP Request: POST https://openrouter.ai/api/v1/chat/completions "HTTP/1.1 200 OK"
2025-10-18 16:25:23,917 - httpx - INFO - HTTP Request: POST https://api.openai.com/v1/traces/ingest "HTTP/1.1 204 No Content"
2025-10-18 16:25:33,333 - httpx - INFO - HTTP Request: POST https://openrouter.ai/api/v1/chat/completions "HTTP/1.1 200 OK"
2025-10-18 16:25:34,433 - httpx - INFO - HTTP Request: POST https://api.openai.com/v1/traces/ingest "HTTP/1.1 204 No Content"
2025-10-18 16:25:46,843 - httpx - INFO - HTTP Request: POST https://openrouter.ai/api/v1/chat/completions "HTTP/1.1 200 OK"
2025-10-18 16:25:48,514 - httpx - INFO - HTTP Request: POST https://openrouter.ai/api/v1/chat/completions "HTTP/1.1 200 OK"
2025-10-18 16:25:50,171 - httpx - INFO - HTTP Request: POST https://api.openai.com/v1/traces/ingest "HTTP/1.1 204 No Content"
2025-10-18 16:25:50,255 - httpx - INFO - HTTP Request: POST https://openrouter.ai/api/v1/chat/completions "HTTP/1.1 200 OK"
2025-10-18 16:25:50,463 - httpx - INFO - HTTP Request: POST https://api.openai.com/v1/traces/ingest "HTTP/1.1 204 No Content"
   ✅ Round 3 complete - 1m 46s

🗣️  Round 4 (4/10)
   Speaking order: Agent_1 → Agent_3 → Agent_2
   💭 Agent_1 is thinking...
2025-10-18 16:25:51,938 - httpx - INFO - HTTP Request: POST https://openrouter.ai/api/v1/chat/completions "HTTP/1.1 200 OK"
2025-10-18 16:25:55,917 - httpx - INFO - HTTP Request: POST https://api.openai.com/v1/traces/ingest "HTTP/1.1 204 No Content"
2025-10-18 16:26:00,935 - httpx - INFO - HTTP Request: POST https://openrouter.ai/api/v1/chat/completions "HTTP/1.1 200 OK"
2025-10-18 16:26:01,374 - httpx - INFO - HTTP Request: POST https://api.openai.com/v1/traces/ingest "HTTP/1.1 204 No Content"
   ✅ Agent_1 responded (2306 chars) [14.5s]
2025-10-18 16:26:06,755 - httpx - INFO - HTTP Request: POST https://generativelanguage.googleapis.com/v1beta/openai/chat/completions "HTTP/1.1 200 OK"
   💭 Agent_3 is thinking...
2025-10-18 16:26:06,802 - httpx - INFO - HTTP Request: POST https://api.openai.com/v1/traces/ingest "HTTP/1.1 204 No Content"
2025-10-18 16:26:07,290 - httpx - INFO - HTTP Request: POST https://openrouter.ai/api/v1/chat/completions "HTTP/1.1 200 OK"
2025-10-18 16:26:13,740 - httpx - INFO - HTTP Request: POST https://openrouter.ai/api/v1/chat/completions "HTTP/1.1 200 OK"
2025-10-18 16:26:17,381 - httpx - INFO - HTTP Request: POST https://api.openai.com/v1/traces/ingest "HTTP/1.1 204 No Content"
   ✅ Agent_3 responded (2411 chars) [11.9s]
2025-10-18 16:26:19,461 - httpx - INFO - HTTP Request: POST https://generativelanguage.googleapis.com/v1beta/openai/chat/completions "HTTP/1.1 200 OK"
   💭 Agent_2 is thinking...
2025-10-18 16:26:20,061 - httpx - INFO - HTTP Request: POST https://openrouter.ai/api/v1/chat/completions "HTTP/1.1 200 OK"
2025-10-18 16:26:22,834 - httpx - INFO - HTTP Request: POST https://api.openai.com/v1/traces/ingest "HTTP/1.1 204 No Content"
2025-10-18 16:26:32,708 - httpx - INFO - HTTP Request: POST https://openrouter.ai/api/v1/chat/completions "HTTP/1.1 200 OK"
2025-10-18 16:26:33,375 - httpx - INFO - HTTP Request: POST https://api.openai.com/v1/traces/ingest "HTTP/1.1 204 No Content"
   ✅ Agent_2 responded (2504 chars) [17.7s]
2025-10-18 16:26:37,937 - httpx - INFO - HTTP Request: POST https://generativelanguage.googleapis.com/v1beta/openai/chat/completions "HTTP/1.1 200 OK"
2025-10-18 16:26:38,579 - httpx - INFO - HTTP Request: POST https://openrouter.ai/api/v1/chat/completions "HTTP/1.1 200 OK"
2025-10-18 16:26:38,843 - httpx - INFO - HTTP Request: POST https://api.openai.com/v1/traces/ingest "HTTP/1.1 204 No Content"
2025-10-18 16:26:59,433 - httpx - INFO - HTTP Request: POST https://openrouter.ai/api/v1/chat/completions "HTTP/1.1 200 OK"
2025-10-18 16:26:59,616 - httpx - INFO - HTTP Request: POST https://api.openai.com/v1/traces/ingest "HTTP/1.1 204 No Content"
2025-10-18 16:27:16,970 - httpx - INFO - HTTP Request: POST https://openrouter.ai/api/v1/chat/completions "HTTP/1.1 200 OK"
2025-10-18 16:27:20,333 - httpx - INFO - HTTP Request: POST https://api.openai.com/v1/traces/ingest "HTTP/1.1 204 No Content"
2025-10-18 16:27:30,191 - httpx - INFO - HTTP Request: POST https://openrouter.ai/api/v1/chat/completions "HTTP/1.1 200 OK"
2025-10-18 16:27:30,907 - httpx - INFO - HTTP Request: POST https://api.openai.com/v1/traces/ingest "HTTP/1.1 204 No Content"
2025-10-18 16:27:31,883 - httpx - INFO - HTTP Request: POST https://openrouter.ai/api/v1/chat/completions "HTTP/1.1 200 OK"
2025-10-18 16:27:33,509 - httpx - INFO - HTTP Request: POST https://openrouter.ai/api/v1/chat/completions "HTTP/1.1 200 OK"
   ✅ Round 4 complete - 1m 43s

🗣️  Round 5 (5/10)
   Speaking order: Agent_1 → Agent_2 → Agent_3
   💭 Agent_1 is thinking...
2025-10-18 16:27:36,194 - httpx - INFO - HTTP Request: POST https://openrouter.ai/api/v1/chat/completions "HTTP/1.1 200 OK"
2025-10-18 16:27:36,425 - httpx - INFO - HTTP Request: POST https://api.openai.com/v1/traces/ingest "HTTP/1.1 204 No Content"
2025-10-18 16:27:46,653 - httpx - INFO - HTTP Request: POST https://openrouter.ai/api/v1/chat/completions "HTTP/1.1 200 OK"
2025-10-18 16:27:47,005 - httpx - INFO - HTTP Request: POST https://api.openai.com/v1/traces/ingest "HTTP/1.1 204 No Content"
   ✅ Agent_1 responded (2029 chars) [15.1s]
2025-10-18 16:27:51,151 - httpx - INFO - HTTP Request: POST https://generativelanguage.googleapis.com/v1beta/openai/chat/completions "HTTP/1.1 200 OK"
   💭 Agent_2 is thinking...
2025-10-18 16:27:51,830 - httpx - INFO - HTTP Request: POST https://openrouter.ai/api/v1/chat/completions "HTTP/1.1 200 OK"
2025-10-18 16:27:52,444 - httpx - INFO - HTTP Request: POST https://api.openai.com/v1/traces/ingest "HTTP/1.1 204 No Content"
2025-10-18 16:28:03,863 - httpx - INFO - HTTP Request: POST https://openrouter.ai/api/v1/chat/completions "HTTP/1.1 200 OK"
   ✅ Agent_2 responded (1712 chars) [16.5s]
2025-10-18 16:28:08,174 - httpx - INFO - HTTP Request: POST https://api.openai.com/v1/traces/ingest "HTTP/1.1 204 No Content"
2025-10-18 16:28:08,505 - httpx - INFO - HTTP Request: POST https://generativelanguage.googleapis.com/v1beta/openai/chat/completions "HTTP/1.1 200 OK"
   💭 Agent_3 is thinking...
2025-10-18 16:28:09,112 - httpx - INFO - HTTP Request: POST https://openrouter.ai/api/v1/chat/completions "HTTP/1.1 200 OK"
2025-10-18 16:28:16,249 - httpx - INFO - HTTP Request: POST https://openrouter.ai/api/v1/chat/completions "HTTP/1.1 200 OK"
2025-10-18 16:28:18,733 - httpx - INFO - HTTP Request: POST https://api.openai.com/v1/traces/ingest "HTTP/1.1 204 No Content"
   ✅ Agent_3 responded (2200 chars) [12.2s]
2025-10-18 16:28:21,568 - httpx - INFO - HTTP Request: POST https://generativelanguage.googleapis.com/v1beta/openai/chat/completions "HTTP/1.1 200 OK"
2025-10-18 16:28:21,979 - httpx - INFO - HTTP Request: POST https://openrouter.ai/api/v1/chat/completions "HTTP/1.1 200 OK"
2025-10-18 16:28:24,286 - httpx - INFO - HTTP Request: POST https://api.openai.com/v1/traces/ingest "HTTP/1.1 204 No Content"
2025-10-18 16:28:40,731 - httpx - INFO - HTTP Request: POST https://openrouter.ai/api/v1/chat/completions "HTTP/1.1 200 OK"
2025-10-18 16:28:45,146 - httpx - INFO - HTTP Request: POST https://api.openai.com/v1/traces/ingest "HTTP/1.1 204 No Content"
2025-10-18 16:28:57,749 - httpx - INFO - HTTP Request: POST https://openrouter.ai/api/v1/chat/completions "HTTP/1.1 200 OK"
2025-10-18 16:29:00,939 - httpx - INFO - HTTP Request: POST https://api.openai.com/v1/traces/ingest "HTTP/1.1 204 No Content"
2025-10-18 16:29:13,399 - httpx - INFO - HTTP Request: POST https://openrouter.ai/api/v1/chat/completions "HTTP/1.1 200 OK"
2025-10-18 16:29:15,359 - httpx - INFO - HTTP Request: POST https://openrouter.ai/api/v1/chat/completions "HTTP/1.1 200 OK"
2025-10-18 16:29:16,694 - httpx - INFO - HTTP Request: POST https://api.openai.com/v1/traces/ingest "HTTP/1.1 204 No Content"
2025-10-18 16:29:16,751 - httpx - INFO - HTTP Request: POST https://openrouter.ai/api/v1/chat/completions "HTTP/1.1 200 OK"
2025-10-18 16:29:17,101 - httpx - INFO - HTTP Request: POST https://api.openai.com/v1/traces/ingest "HTTP/1.1 204 No Content"
   ✅ Round 5 complete - 1m 42s

🗣️  Round 6 (6/10)
   Speaking order: Agent_1 → Agent_3 → Agent_2
   💭 Agent_1 is thinking...
2025-10-18 16:29:18,601 - httpx - INFO - HTTP Request: POST https://openrouter.ai/api/v1/chat/completions "HTTP/1.1 200 OK"
2025-10-18 16:29:22,526 - httpx - INFO - HTTP Request: POST https://api.openai.com/v1/traces/ingest "HTTP/1.1 204 No Content"
2025-10-18 16:29:25,860 - httpx - INFO - HTTP Request: POST https://openrouter.ai/api/v1/chat/completions "HTTP/1.1 200 OK"
2025-10-18 16:29:28,005 - httpx - INFO - HTTP Request: POST https://api.openai.com/v1/traces/ingest "HTTP/1.1 204 No Content"
   ✅ Agent_1 responded (2036 chars) [12.4s]
2025-10-18 16:29:31,297 - httpx - INFO - HTTP Request: POST https://generativelanguage.googleapis.com/v1beta/openai/chat/completions "HTTP/1.1 200 OK"
   💭 Agent_3 is thinking...
2025-10-18 16:29:31,974 - httpx - INFO - HTTP Request: POST https://openrouter.ai/api/v1/chat/completions "HTTP/1.1 200 OK"
2025-10-18 16:29:33,547 - httpx - INFO - HTTP Request: POST https://api.openai.com/v1/traces/ingest "HTTP/1.1 204 No Content"
2025-10-18 16:29:39,793 - httpx - INFO - HTTP Request: POST https://openrouter.ai/api/v1/chat/completions "HTTP/1.1 200 OK"
2025-10-18 16:29:44,128 - httpx - INFO - HTTP Request: POST https://api.openai.com/v1/traces/ingest "HTTP/1.1 204 No Content"
   ✅ Agent_3 responded (2451 chars) [13.1s]
2025-10-18 16:29:45,174 - httpx - INFO - HTTP Request: POST https://generativelanguage.googleapis.com/v1beta/openai/chat/completions "HTTP/1.1 200 OK"
   💭 Agent_2 is thinking...
2025-10-18 16:29:45,892 - httpx - INFO - HTTP Request: POST https://openrouter.ai/api/v1/chat/completions "HTTP/1.1 200 OK"
2025-10-18 16:29:49,643 - httpx - INFO - HTTP Request: POST https://api.openai.com/v1/traces/ingest "HTTP/1.1 204 No Content"
2025-10-18 16:29:56,494 - httpx - INFO - HTTP Request: POST https://openrouter.ai/api/v1/chat/completions "HTTP/1.1 200 OK"
2025-10-18 16:30:00,242 - httpx - INFO - HTTP Request: POST https://api.openai.com/v1/traces/ingest "HTTP/1.1 204 No Content"
   ✅ Agent_2 responded (2668 chars) [16.3s]
2025-10-18 16:30:02,265 - httpx - INFO - HTTP Request: POST https://generativelanguage.googleapis.com/v1beta/openai/chat/completions "HTTP/1.1 200 OK"
2025-10-18 16:30:02,274 - utils.memory_manager - INFO - Memory approaching limit for Agent_1, attempting compression...
2025-10-18 16:30:02,688 - httpx - INFO - HTTP Request: POST https://openrouter.ai/api/v1/chat/completions "HTTP/1.1 200 OK"
2025-10-18 16:30:05,761 - httpx - INFO - HTTP Request: POST https://api.openai.com/v1/traces/ingest "HTTP/1.1 204 No Content"
2025-10-18 16:30:16,962 - utils.memory_manager - INFO - Memory compressed from 20523 to 6849 characters
2025-10-18 16:30:17,525 - httpx - INFO - HTTP Request: POST https://openrouter.ai/api/v1/chat/completions "HTTP/1.1 200 OK"
2025-10-18 16:30:21,388 - httpx - INFO - HTTP Request: POST https://api.openai.com/v1/traces/ingest "HTTP/1.1 204 No Content"
2025-10-18 16:30:28,437 - httpx - INFO - HTTP Request: POST https://openrouter.ai/api/v1/chat/completions "HTTP/1.1 200 OK"
2025-10-18 16:30:31,930 - httpx - INFO - HTTP Request: POST https://api.openai.com/v1/traces/ingest "HTTP/1.1 204 No Content"
2025-10-18 16:30:46,381 - httpx - INFO - HTTP Request: POST https://openrouter.ai/api/v1/chat/completions "HTTP/1.1 200 OK"
2025-10-18 16:30:47,580 - httpx - INFO - HTTP Request: POST https://api.openai.com/v1/traces/ingest "HTTP/1.1 204 No Content"
2025-10-18 16:31:11,285 - httpx - INFO - HTTP Request: POST https://openrouter.ai/api/v1/chat/completions "HTTP/1.1 200 OK"
2025-10-18 16:31:13,450 - httpx - INFO - HTTP Request: POST https://api.openai.com/v1/traces/ingest "HTTP/1.1 204 No Content"
2025-10-18 16:31:13,466 - httpx - INFO - HTTP Request: POST https://openrouter.ai/api/v1/chat/completions "HTTP/1.1 200 OK"
2025-10-18 16:31:14,980 - httpx - INFO - HTTP Request: POST https://openrouter.ai/api/v1/chat/completions "HTTP/1.1 200 OK"
   ✅ Round 6 complete - 1m 57s

🗣️  Round 7 (7/10)
   Speaking order: Agent_3 → Agent_1 → Agent_2
   💭 Agent_3 is thinking...
2025-10-18 16:31:16,756 - httpx - INFO - HTTP Request: POST https://openrouter.ai/api/v1/chat/completions "HTTP/1.1 200 OK"
2025-10-18 16:31:18,925 - httpx - INFO - HTTP Request: POST https://api.openai.com/v1/traces/ingest "HTTP/1.1 204 No Content"
2025-10-18 16:31:27,589 - httpx - INFO - HTTP Request: POST https://openrouter.ai/api/v1/chat/completions "HTTP/1.1 200 OK"
2025-10-18 16:31:29,535 - httpx - INFO - HTTP Request: POST https://api.openai.com/v1/traces/ingest "HTTP/1.1 204 No Content"
   ✅ Agent_3 responded (2518 chars) [15.9s]
2025-10-18 16:31:32,538 - httpx - INFO - HTTP Request: POST https://generativelanguage.googleapis.com/v1beta/openai/chat/completions "HTTP/1.1 200 OK"
   💭 Agent_1 is thinking...
2025-10-18 16:31:33,253 - httpx - INFO - HTTP Request: POST https://openrouter.ai/api/v1/chat/completions "HTTP/1.1 200 OK"
2025-10-18 16:31:35,098 - httpx - INFO - HTTP Request: POST https://api.openai.com/v1/traces/ingest "HTTP/1.1 204 No Content"
2025-10-18 16:31:42,437 - httpx - INFO - HTTP Request: POST https://openrouter.ai/api/v1/chat/completions "HTTP/1.1 200 OK"
2025-10-18 16:31:45,728 - httpx - INFO - HTTP Request: POST https://api.openai.com/v1/traces/ingest "HTTP/1.1 204 No Content"
   ✅ Agent_1 responded (1969 chars) [13.5s]
2025-10-18 16:31:46,874 - httpx - INFO - HTTP Request: POST https://generativelanguage.googleapis.com/v1beta/openai/chat/completions "HTTP/1.1 200 OK"
   💭 Agent_2 is thinking...
2025-10-18 16:31:47,691 - httpx - INFO - HTTP Request: POST https://openrouter.ai/api/v1/chat/completions "HTTP/1.1 200 OK"
2025-10-18 16:31:51,215 - httpx - INFO - HTTP Request: POST https://api.openai.com/v1/traces/ingest "HTTP/1.1 204 No Content"
2025-10-18 16:31:57,638 - httpx - INFO - HTTP Request: POST https://openrouter.ai/api/v1/chat/completions "HTTP/1.1 200 OK"
2025-10-18 16:32:01,779 - httpx - INFO - HTTP Request: POST https://api.openai.com/v1/traces/ingest "HTTP/1.1 204 No Content"
   ✅ Agent_2 responded (2532 chars) [15.8s]
2025-10-18 16:32:03,563 - httpx - INFO - HTTP Request: POST https://generativelanguage.googleapis.com/v1beta/openai/chat/completions "HTTP/1.1 200 OK"
2025-10-18 16:32:04,063 - httpx - INFO - HTTP Request: POST https://openrouter.ai/api/v1/chat/completions "HTTP/1.1 200 OK"
2025-10-18 16:32:07,246 - httpx - INFO - HTTP Request: POST https://api.openai.com/v1/traces/ingest "HTTP/1.1 204 No Content"
2025-10-18 16:32:15,083 - utils.memory_manager - INFO - Memory approaching limit for Agent_2, attempting compression...
2025-10-18 16:32:15,576 - httpx - INFO - HTTP Request: POST https://openrouter.ai/api/v1/chat/completions "HTTP/1.1 200 OK"
2025-10-18 16:32:17,770 - httpx - INFO - HTTP Request: POST https://api.openai.com/v1/traces/ingest "HTTP/1.1 204 No Content"
2025-10-18 16:32:28,280 - utils.memory_manager - INFO - Memory compressed from 21078 to 10898 characters
2025-10-18 16:32:28,910 - httpx - INFO - HTTP Request: POST https://openrouter.ai/api/v1/chat/completions "HTTP/1.1 200 OK"
2025-10-18 16:32:33,375 - httpx - INFO - HTTP Request: POST https://api.openai.com/v1/traces/ingest "HTTP/1.1 204 No Content"
2025-10-18 16:32:41,774 - httpx - INFO - HTTP Request: POST https://openrouter.ai/api/v1/chat/completions "HTTP/1.1 200 OK"
2025-10-18 16:32:43,970 - httpx - INFO - HTTP Request: POST https://api.openai.com/v1/traces/ingest "HTTP/1.1 204 No Content"
2025-10-18 16:33:02,841 - httpx - INFO - HTTP Request: POST https://openrouter.ai/api/v1/chat/completions "HTTP/1.1 200 OK"
2025-10-18 16:33:04,705 - httpx - INFO - HTTP Request: POST https://api.openai.com/v1/traces/ingest "HTTP/1.1 204 No Content"
2025-10-18 16:33:11,298 - httpx - INFO - HTTP Request: POST https://openrouter.ai/api/v1/chat/completions "HTTP/1.1 200 OK"
2025-10-18 16:33:12,799 - httpx - INFO - HTTP Request: POST https://openrouter.ai/api/v1/chat/completions "HTTP/1.1 200 OK"
   ✅ Round 7 complete - 1m 58s

🗣️  Round 8 (8/10)
   Speaking order: Agent_1 → Agent_2 → Agent_3
   💭 Agent_1 is thinking...
2025-10-18 16:33:14,974 - httpx - INFO - HTTP Request: POST https://openrouter.ai/api/v1/chat/completions "HTTP/1.1 200 OK"
2025-10-18 16:33:15,314 - httpx - INFO - HTTP Request: POST https://api.openai.com/v1/traces/ingest "HTTP/1.1 204 No Content"
2025-10-18 16:33:26,042 - httpx - INFO - HTTP Request: POST https://api.openai.com/v1/traces/ingest "HTTP/1.1 204 No Content"
2025-10-18 16:33:26,098 - httpx - INFO - HTTP Request: POST https://openrouter.ai/api/v1/chat/completions "HTTP/1.1 200 OK"
   ✅ Agent_1 responded (1968 chars) [17.2s]
2025-10-18 16:33:32,139 - httpx - INFO - HTTP Request: POST https://generativelanguage.googleapis.com/v1beta/openai/chat/completions "HTTP/1.1 200 OK"
   💭 Agent_2 is thinking...
2025-10-18 16:33:33,378 - httpx - INFO - HTTP Request: POST https://openrouter.ai/api/v1/chat/completions "HTTP/1.1 200 OK"
2025-10-18 16:33:36,678 - httpx - INFO - HTTP Request: POST https://api.openai.com/v1/traces/ingest "HTTP/1.1 204 No Content"
2025-10-18 16:33:44,012 - httpx - INFO - HTTP Request: POST https://openrouter.ai/api/v1/chat/completions "HTTP/1.1 200 OK"
2025-10-18 16:33:47,256 - httpx - INFO - HTTP Request: POST https://api.openai.com/v1/traces/ingest "HTTP/1.1 204 No Content"
   ✅ Agent_2 responded (2690 chars) [17.8s]
2025-10-18 16:33:50,726 - httpx - INFO - HTTP Request: POST https://generativelanguage.googleapis.com/v1beta/openai/chat/completions "HTTP/1.1 200 OK"
   💭 Agent_3 is thinking...
2025-10-18 16:33:51,689 - httpx - INFO - HTTP Request: POST https://openrouter.ai/api/v1/chat/completions "HTTP/1.1 200 OK"
2025-10-18 16:33:52,736 - httpx - INFO - HTTP Request: POST https://api.openai.com/v1/traces/ingest "HTTP/1.1 204 No Content"
2025-10-18 16:34:02,049 - httpx - INFO - HTTP Request: POST https://openrouter.ai/api/v1/chat/completions "HTTP/1.1 200 OK"
2025-10-18 16:34:03,379 - httpx - INFO - HTTP Request: POST https://api.openai.com/v1/traces/ingest "HTTP/1.1 204 No Content"
   ✅ Agent_3 responded (2513 chars) [18.7s]
2025-10-18 16:34:10,570 - httpx - INFO - HTTP Request: POST https://generativelanguage.googleapis.com/v1beta/openai/chat/completions "HTTP/1.1 200 OK"
2025-10-18 16:34:11,011 - httpx - INFO - HTTP Request: POST https://openrouter.ai/api/v1/chat/completions "HTTP/1.1 200 OK"
2025-10-18 16:34:13,996 - httpx - INFO - HTTP Request: POST https://api.openai.com/v1/traces/ingest "HTTP/1.1 204 No Content"
2025-10-18 16:34:24,536 - httpx - INFO - HTTP Request: POST https://openrouter.ai/api/v1/chat/completions "HTTP/1.1 200 OK"
2025-10-18 16:34:24,571 - httpx - INFO - HTTP Request: POST https://api.openai.com/v1/traces/ingest "HTTP/1.1 204 No Content"
2025-10-18 16:34:38,290 - httpx - INFO - HTTP Request: POST https://openrouter.ai/api/v1/chat/completions "HTTP/1.1 200 OK"
2025-10-18 16:34:40,234 - httpx - INFO - HTTP Request: POST https://api.openai.com/v1/traces/ingest "HTTP/1.1 204 No Content"
2025-10-18 16:34:54,552 - httpx - INFO - HTTP Request: POST https://openrouter.ai/api/v1/chat/completions "HTTP/1.1 200 OK"
2025-10-18 16:34:55,842 - httpx - INFO - HTTP Request: POST https://api.openai.com/v1/traces/ingest "HTTP/1.1 204 No Content"
2025-10-18 16:34:56,416 - httpx - INFO - HTTP Request: POST https://openrouter.ai/api/v1/chat/completions "HTTP/1.1 200 OK"
2025-10-18 16:34:58,409 - httpx - INFO - HTTP Request: POST https://openrouter.ai/api/v1/chat/completions "HTTP/1.1 200 OK"
   ✅ Round 8 complete - 1m 46s

🗣️  Round 9 (9/10)
   Speaking order: Agent_2 → Agent_1 → Agent_3
   💭 Agent_2 is thinking...
2025-10-18 16:35:01,129 - httpx - INFO - HTTP Request: POST https://openrouter.ai/api/v1/chat/completions "HTTP/1.1 200 OK"
2025-10-18 16:35:01,353 - httpx - INFO - HTTP Request: POST https://api.openai.com/v1/traces/ingest "HTTP/1.1 204 No Content"
2025-10-18 16:35:12,531 - httpx - INFO - HTTP Request: POST https://openrouter.ai/api/v1/chat/completions "HTTP/1.1 200 OK"
2025-10-18 16:35:17,020 - httpx - INFO - HTTP Request: POST https://api.openai.com/v1/traces/ingest "HTTP/1.1 204 No Content"
   ✅ Agent_2 responded (2380 chars) [18.0s]
2025-10-18 16:35:19,224 - httpx - INFO - HTTP Request: POST https://generativelanguage.googleapis.com/v1beta/openai/chat/completions "HTTP/1.1 200 OK"
   💭 Agent_1 is thinking...
2025-10-18 16:35:19,880 - httpx - INFO - HTTP Request: POST https://openrouter.ai/api/v1/chat/completions "HTTP/1.1 200 OK"
2025-10-18 16:35:22,499 - httpx - INFO - HTTP Request: POST https://api.openai.com/v1/traces/ingest "HTTP/1.1 204 No Content"
2025-10-18 16:35:30,542 - httpx - INFO - HTTP Request: POST https://openrouter.ai/api/v1/chat/completions "HTTP/1.1 200 OK"
2025-10-18 16:35:33,031 - httpx - INFO - HTTP Request: POST https://api.openai.com/v1/traces/ingest "HTTP/1.1 204 No Content"
   ✅ Agent_1 responded (1973 chars) [15.1s]
2025-10-18 16:35:35,136 - httpx - INFO - HTTP Request: POST https://generativelanguage.googleapis.com/v1beta/openai/chat/completions "HTTP/1.1 200 OK"
   💭 Agent_3 is thinking...
2025-10-18 16:35:35,927 - httpx - INFO - HTTP Request: POST https://openrouter.ai/api/v1/chat/completions "HTTP/1.1 200 OK"
2025-10-18 16:35:38,509 - httpx - INFO - HTTP Request: POST https://api.openai.com/v1/traces/ingest "HTTP/1.1 204 No Content"
2025-10-18 16:35:47,356 - httpx - INFO - HTTP Request: POST https://openrouter.ai/api/v1/chat/completions "HTTP/1.1 200 OK"
2025-10-18 16:35:49,057 - httpx - INFO - HTTP Request: POST https://api.openai.com/v1/traces/ingest "HTTP/1.1 204 No Content"
   ✅ Agent_3 responded (2540 chars) [18.2s]
2025-10-18 16:35:54,037 - httpx - INFO - HTTP Request: POST https://generativelanguage.googleapis.com/v1beta/openai/chat/completions "HTTP/1.1 200 OK"
2025-10-18 16:35:54,447 - httpx - INFO - HTTP Request: POST https://openrouter.ai/api/v1/chat/completions "HTTP/1.1 200 OK"
2025-10-18 16:35:54,588 - httpx - INFO - HTTP Request: POST https://api.openai.com/v1/traces/ingest "HTTP/1.1 204 No Content"
2025-10-18 16:36:08,542 - httpx - INFO - HTTP Request: POST https://openrouter.ai/api/v1/chat/completions "HTTP/1.1 200 OK"
2025-10-18 16:36:10,265 - httpx - INFO - HTTP Request: POST https://api.openai.com/v1/traces/ingest "HTTP/1.1 204 No Content"
2025-10-18 16:36:25,307 - httpx - INFO - HTTP Request: POST https://openrouter.ai/api/v1/chat/completions "HTTP/1.1 200 OK"
2025-10-18 16:36:25,943 - httpx - INFO - HTTP Request: POST https://api.openai.com/v1/traces/ingest "HTTP/1.1 204 No Content"
2025-10-18 16:36:48,891 - httpx - INFO - HTTP Request: POST https://openrouter.ai/api/v1/chat/completions "HTTP/1.1 200 OK"
2025-10-18 16:36:50,833 - httpx - INFO - HTTP Request: POST https://openrouter.ai/api/v1/chat/completions "HTTP/1.1 200 OK"
2025-10-18 16:36:51,792 - httpx - INFO - HTTP Request: POST https://api.openai.com/v1/traces/ingest "HTTP/1.1 204 No Content"
2025-10-18 16:36:52,916 - httpx - INFO - HTTP Request: POST https://openrouter.ai/api/v1/chat/completions "HTTP/1.1 200 OK"
   ✅ Round 9 complete - 1m 54s

🗣️  Round 10 (10/10)
   Speaking order: Agent_2 → Agent_3 → Agent_1
   💭 Agent_2 is thinking...
2025-10-18 16:36:55,547 - httpx - INFO - HTTP Request: POST https://openrouter.ai/api/v1/chat/completions "HTTP/1.1 200 OK"
2025-10-18 16:36:57,282 - httpx - INFO - HTTP Request: POST https://api.openai.com/v1/traces/ingest "HTTP/1.1 204 No Content"
2025-10-18 16:37:09,698 - httpx - INFO - HTTP Request: POST https://openrouter.ai/api/v1/chat/completions "HTTP/1.1 200 OK"
2025-10-18 16:37:12,983 - httpx - INFO - HTTP Request: POST https://api.openai.com/v1/traces/ingest "HTTP/1.1 204 No Content"
   ✅ Agent_2 responded (1982 chars) [30.0s]
2025-10-18 16:37:25,542 - httpx - INFO - HTTP Request: POST https://generativelanguage.googleapis.com/v1beta/openai/chat/completions "HTTP/1.1 200 OK"
   💭 Agent_3 is thinking...
2025-10-18 16:37:26,401 - httpx - INFO - HTTP Request: POST https://openrouter.ai/api/v1/chat/completions "HTTP/1.1 200 OK"
2025-10-18 16:37:28,615 - httpx - INFO - HTTP Request: POST https://api.openai.com/v1/traces/ingest "HTTP/1.1 204 No Content"
2025-10-18 16:37:37,238 - httpx - INFO - HTTP Request: POST https://openrouter.ai/api/v1/chat/completions "HTTP/1.1 200 OK"
2025-10-18 16:37:39,188 - httpx - INFO - HTTP Request: POST https://api.openai.com/v1/traces/ingest "HTTP/1.1 204 No Content"
   ✅ Agent_3 responded (2710 chars) [20.2s]
2025-10-18 16:37:46,548 - httpx - INFO - HTTP Request: POST https://generativelanguage.googleapis.com/v1beta/openai/chat/completions "HTTP/1.1 200 OK"
   💭 Agent_1 is thinking...
2025-10-18 16:37:47,279 - httpx - INFO - HTTP Request: POST https://openrouter.ai/api/v1/chat/completions "HTTP/1.1 200 OK"
2025-10-18 16:37:49,779 - httpx - INFO - HTTP Request: POST https://api.openai.com/v1/traces/ingest "HTTP/1.1 204 No Content"
2025-10-18 16:38:12,031 - httpx - INFO - HTTP Request: POST https://openrouter.ai/api/v1/chat/completions "HTTP/1.1 200 OK"
2025-10-18 16:38:15,650 - httpx - INFO - HTTP Request: POST https://api.openai.com/v1/traces/ingest "HTTP/1.1 204 No Content"
   ✅ Agent_1 responded (2406 chars) [33.2s]
2025-10-18 16:38:20,500 - httpx - INFO - HTTP Request: POST https://generativelanguage.googleapis.com/v1beta/openai/chat/completions "HTTP/1.1 200 OK"
2025-10-18 16:38:21,023 - httpx - INFO - HTTP Request: POST https://openrouter.ai/api/v1/chat/completions "HTTP/1.1 200 OK"
2025-10-18 16:38:21,072 - httpx - INFO - HTTP Request: POST https://api.openai.com/v1/traces/ingest "HTTP/1.1 204 No Content"
2025-10-18 16:38:38,228 - httpx - INFO - HTTP Request: POST https://openrouter.ai/api/v1/chat/completions "HTTP/1.1 200 OK"
2025-10-18 16:38:41,842 - httpx - INFO - HTTP Request: POST https://api.openai.com/v1/traces/ingest "HTTP/1.1 204 No Content"
2025-10-18 16:38:55,124 - utils.memory_manager - INFO - Memory approaching limit for Agent_3, attempting compression...
2025-10-18 16:38:55,783 - httpx - INFO - HTTP Request: POST https://openrouter.ai/api/v1/chat/completions "HTTP/1.1 200 OK"
2025-10-18 16:38:57,487 - httpx - INFO - HTTP Request: POST https://api.openai.com/v1/traces/ingest "HTTP/1.1 204 No Content"
2025-10-18 16:39:10,232 - utils.memory_manager - INFO - Memory compressed from 20423 to 3357 characters
2025-10-18 16:39:10,788 - httpx - INFO - HTTP Request: POST https://openrouter.ai/api/v1/chat/completions "HTTP/1.1 200 OK"
2025-10-18 16:39:13,102 - httpx - INFO - HTTP Request: POST https://api.openai.com/v1/traces/ingest "HTTP/1.1 204 No Content"
2025-10-18 16:39:23,534 - httpx - INFO - HTTP Request: POST https://openrouter.ai/api/v1/chat/completions "HTTP/1.1 200 OK"
2025-10-18 16:39:23,665 - httpx - INFO - HTTP Request: POST https://api.openai.com/v1/traces/ingest "HTTP/1.1 204 No Content"
2025-10-18 16:39:27,710 - httpx - INFO - HTTP Request: POST https://openrouter.ai/api/v1/chat/completions "HTTP/1.1 200 OK"
🗳️  Voting initiated (Round 10)
2025-10-18 16:39:29,095 - httpx - INFO - HTTP Request: POST https://api.openai.com/v1/traces/ingest "HTTP/1.1 204 No Content"
2025-10-18 16:39:29,428 - httpx - INFO - HTTP Request: POST https://api.openai.com/v1/traces/ingest "HTTP/1.1 204 No Content"
2025-10-18 16:39:29,491 - httpx - INFO - HTTP Request: POST https://openrouter.ai/api/v1/chat/completions "HTTP/1.1 200 OK"
2025-10-18 16:39:36,606 - httpx - INFO - HTTP Request: POST https://openrouter.ai/api/v1/chat/completions "HTTP/1.1 200 OK"
2025-10-18 16:39:39,914 - httpx - INFO - HTTP Request: POST https://api.openai.com/v1/traces/ingest "HTTP/1.1 204 No Content"
2025-10-18 16:39:43,225 - core.two_stage_voting_manager - INFO - Starting two-stage voting for Agent_1
2025-10-18 16:39:43,661 - httpx - INFO - HTTP Request: POST https://openrouter.ai/api/v1/chat/completions "HTTP/1.1 200 OK"
2025-10-18 16:39:45,136 - core.two_stage_voting_manager - INFO - Two-stage voting success - Agent_1 principle_selection: '3' -> 3 (attempt 1)
2025-10-18 16:39:45,378 - httpx - INFO - HTTP Request: POST https://api.openai.com/v1/traces/ingest "HTTP/1.1 204 No Content"
2025-10-18 16:39:45,640 - httpx - INFO - HTTP Request: POST https://api.openai.com/v1/traces/ingest "HTTP/1.1 204 No Content"
2025-10-18 16:39:45,674 - httpx - INFO - HTTP Request: POST https://openrouter.ai/api/v1/chat/completions "HTTP/1.1 200 OK"
2025-10-18 16:39:48,122 - core.two_stage_voting_manager - INFO - Two-stage voting success - Agent_1 amount_specification: '12000' -> 12000 (attempt 1)
2025-10-18 16:39:48,122 - core.two_stage_voting_manager - INFO - Completed two-stage voting for Agent_1: principle 3, amount 12000
2025-10-18 16:39:48,123 - core.two_stage_voting_manager - INFO - Starting two-stage voting for Agent_2
2025-10-18 16:39:48,775 - httpx - INFO - HTTP Request: POST https://openrouter.ai/api/v1/chat/completions "HTTP/1.1 200 OK"
2025-10-18 16:39:49,773 - core.two_stage_voting_manager - INFO - Two-stage voting success - Agent_2 principle_selection: '3' -> 3 (attempt 1)
2025-10-18 16:39:50,286 - httpx - INFO - HTTP Request: POST https://openrouter.ai/api/v1/chat/completions "HTTP/1.1 200 OK"
2025-10-18 16:39:51,111 - httpx - INFO - HTTP Request: POST https://api.openai.com/v1/traces/ingest "HTTP/1.1 204 No Content"
2025-10-18 16:39:51,485 - core.two_stage_voting_manager - INFO - Two-stage voting success - Agent_2 amount_specification: '12000' -> 12000 (attempt 1)
2025-10-18 16:39:51,486 - core.two_stage_voting_manager - INFO - Completed two-stage voting for Agent_2: principle 3, amount 12000
2025-10-18 16:39:51,486 - core.two_stage_voting_manager - INFO - Starting two-stage voting for Agent_3
2025-10-18 16:39:52,096 - httpx - INFO - HTTP Request: POST https://openrouter.ai/api/v1/chat/completions "HTTP/1.1 200 OK"
2025-10-18 16:39:55,014 - core.two_stage_voting_manager - INFO - Two-stage voting success - Agent_3 principle_selection: '3' -> 3 (attempt 1)
2025-10-18 16:39:55,636 - httpx - INFO - HTTP Request: POST https://openrouter.ai/api/v1/chat/completions "HTTP/1.1 200 OK"
2025-10-18 16:39:56,647 - httpx - INFO - HTTP Request: POST https://api.openai.com/v1/traces/ingest "HTTP/1.1 204 No Content"
2025-10-18 16:39:57,540 - core.two_stage_voting_manager - INFO - Two-stage voting success - Agent_3 amount_specification: '12000' -> 12000 (attempt 1)
2025-10-18 16:39:57,541 - core.two_stage_voting_manager - INFO - Completed two-stage voting for Agent_3: principle 3, amount 12000
2025-10-18 16:39:57,541 - core.two_stage_voting_manager - INFO - Two-stage voting completed successfully for all participants
2025-10-18 16:39:57,541 - core.two_stage_voting_manager - INFO - Consensus reached: maximizing_average_floor_constraint with constraint 12000
🎉 Consensus Reached! Principle: maximizing_average_floor_constraint (constraint: $12000)

2025-10-18 16:39:57,558 - utils.language_manager - INFO - Language set to: English
2025-10-18 16:39:57,562 - utils.language_manager - INFO - Loaded translations for English
2025-10-18 16:39:58,059 - httpx - INFO - HTTP Request: POST https://openrouter.ai/api/v1/chat/completions "HTTP/1.1 200 OK"
2025-10-18 16:40:02,089 - httpx - INFO - HTTP Request: POST https://api.openai.com/v1/traces/ingest "HTTP/1.1 204 No Content"
2025-10-18 16:40:09,659 - utils.language_manager - INFO - Language set to: English
2025-10-18 16:40:09,662 - utils.language_manager - INFO - Loaded translations for English
2025-10-18 16:40:10,170 - httpx - INFO - HTTP Request: POST https://openrouter.ai/api/v1/chat/completions "HTTP/1.1 200 OK"
2025-10-18 16:40:12,600 - httpx - INFO - HTTP Request: POST https://api.openai.com/v1/traces/ingest "HTTP/1.1 204 No Content"
2025-10-18 16:40:27,355 - utils.language_manager - INFO - Language set to: English
2025-10-18 16:40:27,357 - utils.language_manager - INFO - Loaded translations for English
2025-10-18 16:40:27,866 - httpx - INFO - HTTP Request: POST https://openrouter.ai/api/v1/chat/completions "HTTP/1.1 200 OK"
2025-10-18 16:40:28,282 - httpx - INFO - HTTP Request: POST https://api.openai.com/v1/traces/ingest "HTTP/1.1 204 No Content"
2025-10-18 16:40:35,270 - httpx - INFO - HTTP Request: POST https://openrouter.ai/api/v1/chat/completions "HTTP/1.1 200 OK"
2025-10-18 16:40:35,326 - httpx - INFO - HTTP Request: POST https://openrouter.ai/api/v1/chat/completions "HTTP/1.1 200 OK"
2025-10-18 16:40:35,451 - httpx - INFO - HTTP Request: POST https://openrouter.ai/api/v1/chat/completions "HTTP/1.1 200 OK"
2025-10-18 16:40:38,443 - httpx - INFO - HTTP Request: POST https://generativelanguage.googleapis.com/v1beta/openai/chat/completions "HTTP/1.1 200 OK"
2025-10-18 16:40:38,799 - httpx - INFO - HTTP Request: POST https://api.openai.com/v1/traces/ingest "HTTP/1.1 204 No Content"
2025-10-18 16:40:44,156 - httpx - INFO - HTTP Request: POST https://generativelanguage.googleapis.com/v1beta/openai/chat/completions "HTTP/1.1 200 OK"
2025-10-18 16:40:44,224 - httpx - INFO - HTTP Request: POST https://api.openai.com/v1/traces/ingest "HTTP/1.1 204 No Content"
2025-10-18 16:40:45,754 - httpx - INFO - HTTP Request: POST https://generativelanguage.googleapis.com/v1beta/openai/chat/completions "HTTP/1.1 200 OK"
🏁 Phase 2 Complete with consensus - Duration: 20m 25s
   Rounds conducted: 10
   Final earnings:
     Agent_1: $7.35
     Agent_2: $7.35
     Agent_3: $7.35

[TECH] Experiment 2707c109-e05b-449f-a2ed-c51cae7a6995 completed successfully in 1350.31 seconds
2025-10-18 16:40:46,657 - httpx - INFO - HTTP Request: POST https://generativelanguage.googleapis.com/v1beta/openai/chat/completions "HTTP/1.1 200 OK"
[TECH] Consensus validation successful - discussion aligns with recorded consensus
[TECH] Transcript saved to: /Users/lucasmuller/Desktop/Githubg/Rawls_v3/transcript_2707c109-e05b-449f-a2ed-c51cae7a6995.json
2025-10-18 16:40:46,703 - core.experiment_manager - INFO - Results saved to: /Users/lucasmuller/Desktop/Githubg/Rawls_v3/hypothesis_testing/hypothesis_2/results/american/hypothesis_2_american_condition_2_config_results.json
2025-10-18 16:40:46,703 - core.experiment_manager - INFO - Seed used: 163131405 (generated)
[TECH] Results saved to: /Users/lucasmuller/Desktop/Githubg/Rawls_v3/hypothesis_testing/hypothesis_2/results/american/hypothesis_2_american_condition_2_config_results.json
[DEBUG] Trace: https://platform.openai.com/logs/trace?trace_id=trace_71d2bbc5870649059bda67593f113553
════════════════════════════════════════════════════════════
✅ EXPERIMENT COMPLETED
════════════════════════════════════════════════════════════
Total Duration: 22m 38s
Consensus: ✅ maximizing_average_floor_constraint
Transcript saved: /Users/lucasmuller/Desktop/Githubg/Rawls_v3/transcript_2707c109-e05b-449f-a2ed-c51cae7a6995.json
Errors: None
Results saved: /Users/lucasmuller/Desktop/Githubg/Rawls_v3/hypothesis_testing/hypothesis_2/results/american/hypothesis_2_american_condition_2_config_results.json
🔗 Trace: https://platform.openai.com/logs/trace?trace_id=trace_71d2bbc5870649059bda67593f113553


Frohlich Experiment Results (ID: 2707c109-e05b-449f-a2ed-c51cae7a6995)
Completed in 1350.31 seconds

PHASE 1 RESULTS:
  Agent_1: $7.50 (Initial pref: maximizing_floor, Final pref: maximizing_floor)
  Agent_2: $9.30 (Initial pref: maximizing_average_floor_constraint, Final pref: maximizing_average_floor_constraint)
  Agent_3: $7.10 (Initial pref: maximizing_floor, Final pref: maximizing_floor)
  Average Phase 1 earnings: $7.97

PHASE 2 RESULTS:
  Consensus reached on: maximizing_average_floor_constraint
  Constraint amount: $12000
  Rounds to consensus: 10
  Phase 2 earnings:
    Agent_1: $7.35
    Agent_2: $7.35
    Agent_3: $7.35
  Average Phase 2 earnings: $7.35

TOTAL EARNINGS:
  Agent_2: $16.65
  Agent_1: $14.85
  Agent_3: $14.45

HIGHEST EARNER: Agent_2 with $16.65
2025-10-18 16:40:47,176 - httpx - INFO - HTTP Request: POST https://api.openai.com/v1/traces/ingest "HTTP/1.1 204 No Content"

RETURN CODE: 0  DURATION: 1360.9s
