CMD: /Users/lucasmuller/Desktop/Githubg/Rawls_v3/.venv/bin/python /Users/lucasmuller/Desktop/Githubg/Rawls_v3/main.py /Users/lucasmuller/Desktop/Githubg/Rawls_v3/hypothesis_testing/hypothesis_2/configs/american/hypothesis_2_american_condition_22_config.yaml /Users/lucasmuller/Desktop/Githubg/Rawls_v3/hypothesis_testing/hypothesis_2/results/american/hypothesis_2_american_condition_22_config_results.json
[TECH] Loading configuration from: /Users/lucasmuller/Desktop/Githubg/Rawls_v3/hypothesis_testing/hypothesis_2/configs/american/hypothesis_2_american_condition_22_config.yaml
2025-10-18 16:36:45,189 - utils.seed_manager - INFO - Generated seed 651106250 from configuration hash
2025-10-18 16:36:45,189 - utils.language_manager - INFO - Language set to: English
[TECH] Language set to: English
════════════════════════════════════════════════════════════
🧪 FROHLICH EXPERIMENT STARTING
════════════════════════════════════════════════════════════
Experiment ID: cc42748c
Participants: 3
Language: English
Max Phase 2 rounds: 10
Configuration file: hypothesis_2_american_condition_22_config.yaml
Started at: 16:36:45

[DEBUG] ✅ FORMAL VOTING: Using structured consensus building with confirmation and secret ballot
[DEBUG]    • Voting initiated via end-of-round prompts only
[DEBUG]    • Voting requires confirmation from all participants
[DEBUG]    • Consensus reached via unanimous secret ballot
[TECH] Tracing policy: participant-only spans; utility agents untraced
🤖 Initializing Agents...
2025-10-18 16:36:45,189 - experiment_agents.participant_agent - INFO - Creating 3 participant agents with dynamic temperature detection...
2025-10-18 16:36:45,189 - experiment_agents.participant_agent - INFO - Creating agent: Agent_1 (model: openai/gpt-oss-120b, temp: 0.5585782966268191)
2025-10-18 16:36:45,189 - experiment_agents.participant_agent - INFO - Creating agent Agent_1 with dynamic temperature detection
2025-10-18 16:36:45,206 - utils.language_manager - INFO - Loaded translations for English
2025-10-18 16:36:45,773 - httpx - INFO - HTTP Request: POST https://openrouter.ai/api/v1/chat/completions "HTTP/1.1 200 OK"
2025-10-18 16:36:45,974 - utils.dynamic_model_capabilities - INFO - ✅ openai/gpt-oss-120b supports temperature (discovered during creation)
2025-10-18 16:36:45,975 - experiment_agents.participant_agent - INFO - ✅ Agent_1: Temperature 0.5585782966268191 active (method: successful_creation)
2025-10-18 16:36:45,975 - experiment_agents.participant_agent - INFO - ✅ Successfully initialized agent Agent_1
2025-10-18 16:36:45,975 - experiment_agents.participant_agent - INFO - Creating agent: Agent_2 (model: x-ai/grok-4-fast, temp: 0.5585782966268191)
2025-10-18 16:36:45,975 - experiment_agents.participant_agent - INFO - Creating agent Agent_2 with dynamic temperature detection
2025-10-18 16:36:46,255 - httpx - INFO - HTTP Request: POST https://openrouter.ai/api/v1/chat/completions "HTTP/1.1 200 OK"
2025-10-18 16:36:46,806 - utils.dynamic_model_capabilities - INFO - ✅ x-ai/grok-4-fast supports temperature (discovered during creation)
2025-10-18 16:36:46,806 - experiment_agents.participant_agent - INFO - ✅ Agent_2: Temperature 0.5585782966268191 active (method: successful_creation)
2025-10-18 16:36:46,806 - experiment_agents.participant_agent - INFO - ✅ Successfully initialized agent Agent_2
2025-10-18 16:36:46,806 - experiment_agents.participant_agent - INFO - Creating agent: Agent_3 (model: x-ai/grok-code-fast-1, temp: 0.5585782966268191)
2025-10-18 16:36:46,806 - experiment_agents.participant_agent - INFO - Creating agent Agent_3 with dynamic temperature detection
2025-10-18 16:36:47,148 - httpx - INFO - HTTP Request: POST https://openrouter.ai/api/v1/chat/completions "HTTP/1.1 200 OK"
2025-10-18 16:36:48,292 - utils.dynamic_model_capabilities - INFO - ✅ x-ai/grok-code-fast-1 supports temperature (discovered during creation)
2025-10-18 16:36:48,292 - experiment_agents.participant_agent - INFO - ✅ Agent_3: Temperature 0.5585782966268191 active (method: successful_creation)
2025-10-18 16:36:48,292 - experiment_agents.participant_agent - INFO - ✅ Successfully initialized agent Agent_3
2025-10-18 16:36:48,292 - experiment_agents.participant_agent - INFO - ✅ Successfully created 3 participant agents
2025-10-18 16:36:48,292 - experiment_agents.utility_agent - INFO - Creating utility agents with model: gemini-2.0-flash-lite (tracing disabled)
2025-10-18 16:36:48,333 - utils.gemini_client - INFO - Successfully initialized Gemini client with OpenAI-compatible endpoint
2025-10-18 16:36:48,880 - httpx - INFO - HTTP Request: POST https://generativelanguage.googleapis.com/v1beta/openai/chat/completions "HTTP/1.1 200 OK"
2025-10-18 16:36:48,883 - utils.dynamic_model_capabilities - INFO - ✅ gemini-2.0-flash-lite supports temperature (discovered during creation)
2025-10-18 16:36:49,474 - httpx - INFO - HTTP Request: POST https://generativelanguage.googleapis.com/v1beta/openai/chat/completions "HTTP/1.1 200 OK"
2025-10-18 16:36:49,478 - experiment_agents.utility_agent - INFO - ✅ Utility agents initialized successfully
2025-10-18 16:36:49,478 - core.experiment_manager - INFO - ✅ Experiment manager initialized with 3 participants
  ✅ Agent_1 (gpt-oss-120b) [0.0s]
  ✅ Agent_2 (grok-4-fast) [0.0s]
  ✅ Agent_3 (grok-code-fast-1) [0.0s]

✨ All agents ready in 4.3s

2025-10-18 16:36:49,479 - utils.seed_manager - INFO - Generated seed 651106250 from configuration hash
2025-10-18 16:36:49,479 - utils.seed_manager - INFO - Experiment random seed set to: 651106250
[TECH] Experiment seed: 651106250 (generated)
[TECH] Tracing experiment: Frohlich Experiment - cc42748c-5b25-4a0c-b811-a174a668f637
[TECH] Trace ID: trace_882671bc4faf43f2acf7f02948317057
📖 PHASE 1: Individual Familiarization
━━━━━━━━━━━━━━━━━━━━━━━━━━━━━━━━━━━━━━━━━━━━━━━━━━
Running parallel familiarization for 3 participants...

[TECH] Phase 1 executing with language: English
  Agent_1: Initial ranking [██░░░░░░░░░░░░░░░░░░] 10.0%
  Agent_2: Initial ranking [██░░░░░░░░░░░░░░░░░░] 10.0%
  Agent_3: Initial ranking [██░░░░░░░░░░░░░░░░░░] 10.0%
2025-10-18 16:36:49,784 - httpx - INFO - HTTP Request: POST https://openrouter.ai/api/v1/chat/completions "HTTP/1.1 200 OK"
2025-10-18 16:36:49,842 - httpx - INFO - HTTP Request: POST https://openrouter.ai/api/v1/chat/completions "HTTP/1.1 200 OK"
2025-10-18 16:36:49,879 - httpx - INFO - HTTP Request: POST https://openrouter.ai/api/v1/chat/completions "HTTP/1.1 200 OK"
2025-10-18 16:36:50,389 - httpx - INFO - HTTP Request: POST https://api.openai.com/v1/traces/ingest "HTTP/1.1 204 No Content"
2025-10-18 16:36:50,673 - httpx - INFO - HTTP Request: POST https://api.openai.com/v1/traces/ingest "HTTP/1.1 204 No Content"
2025-10-18 16:36:51,151 - httpx - INFO - HTTP Request: POST https://generativelanguage.googleapis.com/v1beta/openai/chat/completions "HTTP/1.1 200 OK"
2025-10-18 16:36:51,542 - httpx - INFO - HTTP Request: POST https://openrouter.ai/api/v1/chat/completions "HTTP/1.1 200 OK"
  Agent_1: Learning principles [█████░░░░░░░░░░░░░░░] 25.0%
2025-10-18 16:36:52,443 - httpx - INFO - HTTP Request: POST https://generativelanguage.googleapis.com/v1beta/openai/chat/completions "HTTP/1.1 200 OK"
2025-10-18 16:36:52,608 - httpx - INFO - HTTP Request: POST https://openrouter.ai/api/v1/chat/completions "HTTP/1.1 200 OK"
2025-10-18 16:36:52,710 - httpx - INFO - HTTP Request: POST https://openrouter.ai/api/v1/chat/completions "HTTP/1.1 200 OK"
2025-10-18 16:36:53,762 - httpx - INFO - HTTP Request: POST https://generativelanguage.googleapis.com/v1beta/openai/chat/completions "HTTP/1.1 200 OK"
2025-10-18 16:36:54,094 - httpx - INFO - HTTP Request: POST https://openrouter.ai/api/v1/chat/completions "HTTP/1.1 200 OK"
2025-10-18 16:36:55,367 - httpx - INFO - HTTP Request: POST https://openrouter.ai/api/v1/chat/completions "HTTP/1.1 200 OK"
  Agent_2: Learning principles [█████░░░░░░░░░░░░░░░] 25.0%
2025-10-18 16:36:56,049 - httpx - INFO - HTTP Request: POST https://openrouter.ai/api/v1/chat/completions "HTTP/1.1 200 OK"
2025-10-18 16:36:56,147 - httpx - INFO - HTTP Request: POST https://api.openai.com/v1/traces/ingest "HTTP/1.1 204 No Content"
  Agent_1: Post-explanation ranking [████████░░░░░░░░░░░░] 40.0%
2025-10-18 16:36:57,159 - httpx - INFO - HTTP Request: POST https://openrouter.ai/api/v1/chat/completions "HTTP/1.1 200 OK"
2025-10-18 16:36:58,480 - httpx - INFO - HTTP Request: POST https://generativelanguage.googleapis.com/v1beta/openai/chat/completions "HTTP/1.1 200 OK"
2025-10-18 16:36:58,924 - httpx - INFO - HTTP Request: POST https://openrouter.ai/api/v1/chat/completions "HTTP/1.1 200 OK"
  Agent_1: Application round 1 [██████████░░░░░░░░░░] 50.0%
2025-10-18 16:37:00,607 - httpx - INFO - HTTP Request: POST https://openrouter.ai/api/v1/chat/completions "HTTP/1.1 200 OK"
2025-10-18 16:37:01,151 - httpx - INFO - HTTP Request: POST https://openrouter.ai/api/v1/chat/completions "HTTP/1.1 200 OK"
2025-10-18 16:37:01,652 - httpx - INFO - HTTP Request: POST https://api.openai.com/v1/traces/ingest "HTTP/1.1 204 No Content"
  Agent_3: Learning principles [█████░░░░░░░░░░░░░░░] 25.0%
2025-10-18 16:37:02,777 - httpx - INFO - HTTP Request: POST https://generativelanguage.googleapis.com/v1beta/openai/chat/completions "HTTP/1.1 200 OK"
2025-10-18 16:37:02,985 - httpx - INFO - HTTP Request: POST https://openrouter.ai/api/v1/chat/completions "HTTP/1.1 200 OK"
2025-10-18 16:37:03,166 - httpx - INFO - HTTP Request: POST https://openrouter.ai/api/v1/chat/completions "HTTP/1.1 200 OK"
  Agent_1: Application round 2 [████████████░░░░░░░░] 60.0%
2025-10-18 16:37:05,728 - httpx - INFO - HTTP Request: POST https://openrouter.ai/api/v1/chat/completions "HTTP/1.1 200 OK"
  Agent_2: Post-explanation ranking [████████░░░░░░░░░░░░] 40.0%
2025-10-18 16:37:06,526 - httpx - INFO - HTTP Request: POST https://openrouter.ai/api/v1/chat/completions "HTTP/1.1 200 OK"
2025-10-18 16:37:07,116 - httpx - INFO - HTTP Request: POST https://api.openai.com/v1/traces/ingest "HTTP/1.1 204 No Content"
2025-10-18 16:37:08,901 - httpx - INFO - HTTP Request: POST https://openrouter.ai/api/v1/chat/completions "HTTP/1.1 200 OK"
2025-10-18 16:37:09,064 - httpx - INFO - HTTP Request: POST https://generativelanguage.googleapis.com/v1beta/openai/chat/completions "HTTP/1.1 200 OK"
2025-10-18 16:37:09,506 - httpx - INFO - HTTP Request: POST https://openrouter.ai/api/v1/chat/completions "HTTP/1.1 200 OK"
2025-10-18 16:37:09,912 - httpx - INFO - HTTP Request: POST https://generativelanguage.googleapis.com/v1beta/openai/chat/completions "HTTP/1.1 200 OK"
2025-10-18 16:37:10,418 - httpx - INFO - HTTP Request: POST https://openrouter.ai/api/v1/chat/completions "HTTP/1.1 200 OK"
2025-10-18 16:37:12,701 - httpx - INFO - HTTP Request: POST https://api.openai.com/v1/traces/ingest "HTTP/1.1 204 No Content"
  Agent_1: Application round 3 [██████████████░░░░░░] 70.0%
2025-10-18 16:37:13,314 - httpx - INFO - HTTP Request: POST https://openrouter.ai/api/v1/chat/completions "HTTP/1.1 200 OK"
  Agent_3: Post-explanation ranking [████████░░░░░░░░░░░░] 40.0%
2025-10-18 16:37:14,418 - httpx - INFO - HTTP Request: POST https://openrouter.ai/api/v1/chat/completions "HTTP/1.1 200 OK"
  Agent_2: Application round 1 [██████████░░░░░░░░░░] 50.0%
2025-10-18 16:37:15,775 - httpx - INFO - HTTP Request: POST https://openrouter.ai/api/v1/chat/completions "HTTP/1.1 200 OK"
2025-10-18 16:37:15,862 - httpx - INFO - HTTP Request: POST https://generativelanguage.googleapis.com/v1beta/openai/chat/completions "HTTP/1.1 200 OK"
2025-10-18 16:37:16,508 - httpx - INFO - HTTP Request: POST https://openrouter.ai/api/v1/chat/completions "HTTP/1.1 200 OK"
2025-10-18 16:37:18,207 - httpx - INFO - HTTP Request: POST https://api.openai.com/v1/traces/ingest "HTTP/1.1 204 No Content"
2025-10-18 16:37:18,290 - httpx - INFO - HTTP Request: POST https://generativelanguage.googleapis.com/v1beta/openai/chat/completions "HTTP/1.1 200 OK"
2025-10-18 16:37:18,710 - httpx - INFO - HTTP Request: POST https://openrouter.ai/api/v1/chat/completions "HTTP/1.1 200 OK"
  Agent_1: Application round 4 [████████████████░░░░] 80.0%
2025-10-18 16:37:19,667 - httpx - INFO - HTTP Request: POST https://openrouter.ai/api/v1/chat/completions "HTTP/1.1 200 OK"
2025-10-18 16:37:20,627 - httpx - INFO - HTTP Request: POST https://generativelanguage.googleapis.com/v1beta/openai/chat/completions "HTTP/1.1 200 OK"
2025-10-18 16:37:21,087 - httpx - INFO - HTTP Request: POST https://openrouter.ai/api/v1/chat/completions "HTTP/1.1 200 OK"
2025-10-18 16:37:21,310 - httpx - INFO - HTTP Request: POST https://generativelanguage.googleapis.com/v1beta/openai/chat/completions "HTTP/1.1 200 OK"
2025-10-18 16:37:21,901 - httpx - INFO - HTTP Request: POST https://openrouter.ai/api/v1/chat/completions "HTTP/1.1 200 OK"
2025-10-18 16:37:23,656 - httpx - INFO - HTTP Request: POST https://api.openai.com/v1/traces/ingest "HTTP/1.1 204 No Content"
  Agent_1: Final ranking [██████████████████░░] 90.0%
2025-10-18 16:37:25,121 - httpx - INFO - HTTP Request: POST https://openrouter.ai/api/v1/chat/completions "HTTP/1.1 200 OK"
  Agent_2: Application round 2 [████████████░░░░░░░░] 60.0%
2025-10-18 16:37:26,567 - httpx - INFO - HTTP Request: POST https://openrouter.ai/api/v1/chat/completions "HTTP/1.1 200 OK"
2025-10-18 16:37:26,693 - httpx - INFO - HTTP Request: POST https://generativelanguage.googleapis.com/v1beta/openai/chat/completions "HTTP/1.1 200 OK"
2025-10-18 16:37:27,075 - httpx - INFO - HTTP Request: POST https://openrouter.ai/api/v1/chat/completions "HTTP/1.1 200 OK"
  Agent_3: Application round 1 [██████████░░░░░░░░░░] 50.0%
2025-10-18 16:37:27,782 - httpx - INFO - HTTP Request: POST https://openrouter.ai/api/v1/chat/completions "HTTP/1.1 200 OK"
2025-10-18 16:37:28,970 - httpx - INFO - HTTP Request: POST https://generativelanguage.googleapis.com/v1beta/openai/chat/completions "HTTP/1.1 200 OK"
2025-10-18 16:37:29,157 - httpx - INFO - HTTP Request: POST https://api.openai.com/v1/traces/ingest "HTTP/1.1 204 No Content"
2025-10-18 16:37:29,441 - httpx - INFO - HTTP Request: POST https://openrouter.ai/api/v1/chat/completions "HTTP/1.1 200 OK"
  Agent_1: Completed [████████████████████] 100.0%
2025-10-18 16:37:34,568 - httpx - INFO - HTTP Request: POST https://api.openai.com/v1/traces/ingest "HTTP/1.1 204 No Content"
2025-10-18 16:37:38,996 - httpx - INFO - HTTP Request: POST https://generativelanguage.googleapis.com/v1beta/openai/chat/completions "HTTP/1.1 200 OK"
  Agent_2: Application round 3 [██████████████░░░░░░] 70.0%
2025-10-18 16:37:39,811 - httpx - INFO - HTTP Request: POST https://openrouter.ai/api/v1/chat/completions "HTTP/1.1 200 OK"
2025-10-18 16:37:40,014 - httpx - INFO - HTTP Request: POST https://openrouter.ai/api/v1/chat/completions "HTTP/1.1 200 OK"
2025-10-18 16:37:40,059 - httpx - INFO - HTTP Request: POST https://api.openai.com/v1/traces/ingest "HTTP/1.1 204 No Content"
2025-10-18 16:37:42,274 - httpx - INFO - HTTP Request: POST https://generativelanguage.googleapis.com/v1beta/openai/chat/completions "HTTP/1.1 200 OK"
2025-10-18 16:37:42,837 - httpx - INFO - HTTP Request: POST https://openrouter.ai/api/v1/chat/completions "HTTP/1.1 200 OK"
2025-10-18 16:37:45,440 - httpx - INFO - HTTP Request: POST https://api.openai.com/v1/traces/ingest "HTTP/1.1 204 No Content"
  Agent_3: Application round 2 [████████████░░░░░░░░] 60.0%
2025-10-18 16:37:48,674 - httpx - INFO - HTTP Request: POST https://openrouter.ai/api/v1/chat/completions "HTTP/1.1 200 OK"
2025-10-18 16:37:50,832 - httpx - INFO - HTTP Request: POST https://api.openai.com/v1/traces/ingest "HTTP/1.1 204 No Content"
  Agent_2: Application round 4 [████████████████░░░░] 80.0%
2025-10-18 16:37:54,800 - httpx - INFO - HTTP Request: POST https://openrouter.ai/api/v1/chat/completions "HTTP/1.1 200 OK"
2025-10-18 16:37:56,246 - httpx - INFO - HTTP Request: POST https://api.openai.com/v1/traces/ingest "HTTP/1.1 204 No Content"
2025-10-18 16:37:57,565 - httpx - INFO - HTTP Request: POST https://generativelanguage.googleapis.com/v1beta/openai/chat/completions "HTTP/1.1 200 OK"
2025-10-18 16:37:58,044 - httpx - INFO - HTTP Request: POST https://openrouter.ai/api/v1/chat/completions "HTTP/1.1 200 OK"
2025-10-18 16:38:01,699 - httpx - INFO - HTTP Request: POST https://api.openai.com/v1/traces/ingest "HTTP/1.1 204 No Content"
2025-10-18 16:38:06,003 - httpx - INFO - HTTP Request: POST https://generativelanguage.googleapis.com/v1beta/openai/chat/completions "HTTP/1.1 200 OK"
2025-10-18 16:38:06,570 - httpx - INFO - HTTP Request: POST https://openrouter.ai/api/v1/chat/completions "HTTP/1.1 200 OK"
2025-10-18 16:38:07,109 - httpx - INFO - HTTP Request: POST https://api.openai.com/v1/traces/ingest "HTTP/1.1 204 No Content"
  Agent_2: Final ranking [██████████████████░░] 90.0%
2025-10-18 16:38:13,215 - httpx - INFO - HTTP Request: POST https://openrouter.ai/api/v1/chat/completions "HTTP/1.1 200 OK"
2025-10-18 16:38:15,478 - httpx - INFO - HTTP Request: POST https://generativelanguage.googleapis.com/v1beta/openai/chat/completions "HTTP/1.1 200 OK"
  Agent_3: Application round 3 [██████████████░░░░░░] 70.0%
2025-10-18 16:38:15,884 - httpx - INFO - HTTP Request: POST https://openrouter.ai/api/v1/chat/completions "HTTP/1.1 200 OK"
2025-10-18 16:38:16,222 - httpx - INFO - HTTP Request: POST https://openrouter.ai/api/v1/chat/completions "HTTP/1.1 200 OK"
2025-10-18 16:38:17,697 - httpx - INFO - HTTP Request: POST https://api.openai.com/v1/traces/ingest "HTTP/1.1 204 No Content"
  Agent_2: Completed [████████████████████] 100.0%
2025-10-18 16:38:37,892 - httpx - INFO - HTTP Request: POST https://generativelanguage.googleapis.com/v1beta/openai/chat/completions "HTTP/1.1 200 OK"
2025-10-18 16:38:38,343 - httpx - INFO - HTTP Request: POST https://openrouter.ai/api/v1/chat/completions "HTTP/1.1 200 OK"
2025-10-18 16:38:38,424 - httpx - INFO - HTTP Request: POST https://api.openai.com/v1/traces/ingest "HTTP/1.1 204 No Content"
  Agent_3: Application round 4 [████████████████░░░░] 80.0%
2025-10-18 16:38:52,175 - httpx - INFO - HTTP Request: POST https://openrouter.ai/api/v1/chat/completions "HTTP/1.1 200 OK"
2025-10-18 16:38:53,994 - httpx - INFO - HTTP Request: POST https://api.openai.com/v1/traces/ingest "HTTP/1.1 204 No Content"
2025-10-18 16:38:58,256 - httpx - INFO - HTTP Request: POST https://generativelanguage.googleapis.com/v1beta/openai/chat/completions "HTTP/1.1 200 OK"
2025-10-18 16:38:58,755 - httpx - INFO - HTTP Request: POST https://openrouter.ai/api/v1/chat/completions "HTTP/1.1 200 OK"
2025-10-18 16:38:59,358 - httpx - INFO - HTTP Request: POST https://api.openai.com/v1/traces/ingest "HTTP/1.1 204 No Content"
  Agent_3: Final ranking [██████████████████░░] 90.0%
2025-10-18 16:39:14,976 - httpx - INFO - HTTP Request: POST https://api.openai.com/v1/traces/ingest "HTTP/1.1 204 No Content"
2025-10-18 16:39:14,994 - httpx - INFO - HTTP Request: POST https://openrouter.ai/api/v1/chat/completions "HTTP/1.1 200 OK"
2025-10-18 16:39:23,327 - httpx - INFO - HTTP Request: POST https://generativelanguage.googleapis.com/v1beta/openai/chat/completions "HTTP/1.1 200 OK"
2025-10-18 16:39:23,899 - httpx - INFO - HTTP Request: POST https://openrouter.ai/api/v1/chat/completions "HTTP/1.1 200 OK"
2025-10-18 16:39:25,493 - httpx - INFO - HTTP Request: POST https://api.openai.com/v1/traces/ingest "HTTP/1.1 204 No Content"
  Agent_3: Completed [████████████████████] 100.0%

🎯 Phase 1 Complete - Duration: 2m 56s
  Agent_1: $12.10 earned
  Agent_2: $7.80 earned
  Agent_3: $8.80 earned

💬 PHASE 2: Group Discussion
━━━━━━━━━━━━━━━━━━━━━━━━━━━━━━━━━━━━━━━━━━━━━━━━━━
Beginning group discussion (max 10 rounds)...

🗣️  Round 1 (1/10)
   Speaking order: Agent_3 → Agent_2 → Agent_1
   💭 Agent_3 is thinking...
2025-10-18 16:39:46,738 - httpx - INFO - HTTP Request: POST https://openrouter.ai/api/v1/chat/completions "HTTP/1.1 200 OK"
2025-10-18 16:39:51,254 - httpx - INFO - HTTP Request: POST https://api.openai.com/v1/traces/ingest "HTTP/1.1 204 No Content"
2025-10-18 16:40:03,923 - httpx - INFO - HTTP Request: POST https://openrouter.ai/api/v1/chat/completions "HTTP/1.1 200 OK"
2025-10-18 16:40:06,823 - httpx - INFO - HTTP Request: POST https://api.openai.com/v1/traces/ingest "HTTP/1.1 204 No Content"
   ✅ Agent_3 responded (834 chars) [20.8s]
2025-10-18 16:40:07,799 - httpx - INFO - HTTP Request: POST https://generativelanguage.googleapis.com/v1beta/openai/chat/completions "HTTP/1.1 200 OK"
   💭 Agent_2 is thinking...
2025-10-18 16:40:08,464 - httpx - INFO - HTTP Request: POST https://openrouter.ai/api/v1/chat/completions "HTTP/1.1 200 OK"
2025-10-18 16:40:12,281 - httpx - INFO - HTTP Request: POST https://api.openai.com/v1/traces/ingest "HTTP/1.1 204 No Content"
2025-10-18 16:40:16,948 - httpx - INFO - HTTP Request: POST https://openrouter.ai/api/v1/chat/completions "HTTP/1.1 200 OK"
2025-10-18 16:40:17,622 - httpx - INFO - HTTP Request: POST https://api.openai.com/v1/traces/ingest "HTTP/1.1 204 No Content"
   ✅ Agent_2 responded (1663 chars) [12.5s]
2025-10-18 16:40:21,262 - httpx - INFO - HTTP Request: POST https://generativelanguage.googleapis.com/v1beta/openai/chat/completions "HTTP/1.1 200 OK"
   💭 Agent_1 is thinking...
2025-10-18 16:40:21,841 - httpx - INFO - HTTP Request: POST https://openrouter.ai/api/v1/chat/completions "HTTP/1.1 200 OK"
2025-10-18 16:40:23,196 - httpx - INFO - HTTP Request: POST https://api.openai.com/v1/traces/ingest "HTTP/1.1 204 No Content"
2025-10-18 16:40:25,508 - httpx - INFO - HTTP Request: POST https://openrouter.ai/api/v1/chat/completions "HTTP/1.1 200 OK"
   ✅ Agent_1 responded (2127 chars) [5.3s]
2025-10-18 16:40:27,516 - httpx - INFO - HTTP Request: POST https://generativelanguage.googleapis.com/v1beta/openai/chat/completions "HTTP/1.1 200 OK"
2025-10-18 16:40:28,007 - httpx - INFO - HTTP Request: POST https://openrouter.ai/api/v1/chat/completions "HTTP/1.1 200 OK"
2025-10-18 16:40:28,666 - httpx - INFO - HTTP Request: POST https://api.openai.com/v1/traces/ingest "HTTP/1.1 204 No Content"
2025-10-18 16:40:31,129 - httpx - INFO - HTTP Request: POST https://openrouter.ai/api/v1/chat/completions "HTTP/1.1 200 OK"
2025-10-18 16:40:34,102 - httpx - INFO - HTTP Request: POST https://api.openai.com/v1/traces/ingest "HTTP/1.1 204 No Content"
2025-10-18 16:40:48,264 - httpx - INFO - HTTP Request: POST https://openrouter.ai/api/v1/chat/completions "HTTP/1.1 200 OK"
2025-10-18 16:40:49,788 - httpx - INFO - HTTP Request: POST https://api.openai.com/v1/traces/ingest "HTTP/1.1 204 No Content"
2025-10-18 16:41:14,059 - httpx - INFO - HTTP Request: POST https://openrouter.ai/api/v1/chat/completions "HTTP/1.1 200 OK"
2025-10-18 16:41:14,810 - httpx - INFO - HTTP Request: POST https://openrouter.ai/api/v1/chat/completions "HTTP/1.1 200 OK"
2025-10-18 16:41:15,589 - httpx - INFO - HTTP Request: POST https://api.openai.com/v1/traces/ingest "HTTP/1.1 204 No Content"
2025-10-18 16:41:16,269 - httpx - INFO - HTTP Request: POST https://openrouter.ai/api/v1/chat/completions "HTTP/1.1 200 OK"
   ✅ Round 1 complete - 1m 31s

🗣️  Round 2 (2/10)
   Speaking order: Agent_2 → Agent_3 → Agent_1
   💭 Agent_2 is thinking...
2025-10-18 16:41:18,546 - httpx - INFO - HTTP Request: POST https://openrouter.ai/api/v1/chat/completions "HTTP/1.1 200 OK"
2025-10-18 16:41:21,058 - httpx - INFO - HTTP Request: POST https://api.openai.com/v1/traces/ingest "HTTP/1.1 204 No Content"
2025-10-18 16:41:29,289 - httpx - INFO - HTTP Request: POST https://openrouter.ai/api/v1/chat/completions "HTTP/1.1 200 OK"
2025-10-18 16:41:31,587 - httpx - INFO - HTTP Request: POST https://api.openai.com/v1/traces/ingest "HTTP/1.1 204 No Content"
   ✅ Agent_2 responded (1684 chars) [14.2s]
2025-10-18 16:41:33,097 - httpx - INFO - HTTP Request: POST https://generativelanguage.googleapis.com/v1beta/openai/chat/completions "HTTP/1.1 200 OK"
   💭 Agent_3 is thinking...
2025-10-18 16:41:33,631 - httpx - INFO - HTTP Request: POST https://openrouter.ai/api/v1/chat/completions "HTTP/1.1 200 OK"
2025-10-18 16:41:37,031 - httpx - INFO - HTTP Request: POST https://api.openai.com/v1/traces/ingest "HTTP/1.1 204 No Content"
2025-10-18 16:41:57,759 - httpx - INFO - HTTP Request: POST https://api.openai.com/v1/traces/ingest "HTTP/1.1 204 No Content"
2025-10-18 16:41:58,022 - httpx - INFO - HTTP Request: POST https://openrouter.ai/api/v1/chat/completions "HTTP/1.1 200 OK"
   ✅ Agent_3 responded (1867 chars) [30.7s]
2025-10-18 16:42:04,698 - httpx - INFO - HTTP Request: POST https://generativelanguage.googleapis.com/v1beta/openai/chat/completions "HTTP/1.1 200 OK"
   💭 Agent_1 is thinking...
2025-10-18 16:42:05,253 - httpx - INFO - HTTP Request: POST https://openrouter.ai/api/v1/chat/completions "HTTP/1.1 200 OK"
2025-10-18 16:42:08,279 - httpx - INFO - HTTP Request: POST https://api.openai.com/v1/traces/ingest "HTTP/1.1 204 No Content"
2025-10-18 16:42:10,714 - httpx - INFO - HTTP Request: POST https://openrouter.ai/api/v1/chat/completions "HTTP/1.1 200 OK"
   ✅ Agent_1 responded (2278 chars) [7.3s]
2025-10-18 16:42:12,913 - httpx - INFO - HTTP Request: POST https://generativelanguage.googleapis.com/v1beta/openai/chat/completions "HTTP/1.1 200 OK"
2025-10-18 16:42:13,361 - httpx - INFO - HTTP Request: POST https://openrouter.ai/api/v1/chat/completions "HTTP/1.1 200 OK"
2025-10-18 16:42:13,731 - httpx - INFO - HTTP Request: POST https://api.openai.com/v1/traces/ingest "HTTP/1.1 204 No Content"
2025-10-18 16:42:16,124 - httpx - INFO - HTTP Request: POST https://openrouter.ai/api/v1/chat/completions "HTTP/1.1 200 OK"
2025-10-18 16:42:19,182 - httpx - INFO - HTTP Request: POST https://api.openai.com/v1/traces/ingest "HTTP/1.1 204 No Content"
2025-10-18 16:42:33,487 - httpx - INFO - HTTP Request: POST https://openrouter.ai/api/v1/chat/completions "HTTP/1.1 200 OK"
2025-10-18 16:42:34,789 - httpx - INFO - HTTP Request: POST https://api.openai.com/v1/traces/ingest "HTTP/1.1 204 No Content"
2025-10-18 16:43:02,314 - httpx - INFO - HTTP Request: POST https://openrouter.ai/api/v1/chat/completions "HTTP/1.1 200 OK"
🗳️  Voting initiated (Round 2)
2025-10-18 16:43:03,469 - httpx - INFO - HTTP Request: POST https://openrouter.ai/api/v1/chat/completions "HTTP/1.1 200 OK"
2025-10-18 16:43:05,741 - httpx - INFO - HTTP Request: POST https://api.openai.com/v1/traces/ingest "HTTP/1.1 204 No Content"
2025-10-18 16:43:08,593 - httpx - INFO - HTTP Request: POST https://openrouter.ai/api/v1/chat/completions "HTTP/1.1 200 OK"
2025-10-18 16:43:11,145 - httpx - INFO - HTTP Request: POST https://api.openai.com/v1/traces/ingest "HTTP/1.1 204 No Content"
⏳ No consensus yet - continuing discussion...

   ✅ Round 2 complete - 1m 58s

🗣️  Round 3 (3/10)
   Speaking order: Agent_3 → Agent_2 → Agent_1
   💭 Agent_3 is thinking...
2025-10-18 16:43:16,948 - httpx - INFO - HTTP Request: POST https://openrouter.ai/api/v1/chat/completions "HTTP/1.1 200 OK"
2025-10-18 16:43:21,675 - httpx - INFO - HTTP Request: POST https://api.openai.com/v1/traces/ingest "HTTP/1.1 204 No Content"
2025-10-18 16:43:31,312 - httpx - INFO - HTTP Request: POST https://openrouter.ai/api/v1/chat/completions "HTTP/1.1 200 OK"
2025-10-18 16:43:32,199 - httpx - INFO - HTTP Request: POST https://api.openai.com/v1/traces/ingest "HTTP/1.1 204 No Content"
   ✅ Agent_3 responded (2146 chars) [22.3s]
2025-10-18 16:43:39,508 - httpx - INFO - HTTP Request: POST https://generativelanguage.googleapis.com/v1beta/openai/chat/completions "HTTP/1.1 200 OK"
   💭 Agent_2 is thinking...
2025-10-18 16:43:40,107 - httpx - INFO - HTTP Request: POST https://openrouter.ai/api/v1/chat/completions "HTTP/1.1 200 OK"
2025-10-18 16:43:42,737 - httpx - INFO - HTTP Request: POST https://api.openai.com/v1/traces/ingest "HTTP/1.1 204 No Content"
2025-10-18 16:43:51,631 - httpx - INFO - HTTP Request: POST https://openrouter.ai/api/v1/chat/completions "HTTP/1.1 200 OK"
2025-10-18 16:43:53,268 - httpx - INFO - HTTP Request: POST https://api.openai.com/v1/traces/ingest "HTTP/1.1 204 No Content"
   ✅ Agent_2 responded (2186 chars) [16.7s]
2025-10-18 16:43:56,952 - httpx - INFO - HTTP Request: POST https://generativelanguage.googleapis.com/v1beta/openai/chat/completions "HTTP/1.1 200 OK"
   💭 Agent_1 is thinking...
2025-10-18 16:43:57,482 - httpx - INFO - HTTP Request: POST https://openrouter.ai/api/v1/chat/completions "HTTP/1.1 200 OK"
2025-10-18 16:43:58,744 - httpx - INFO - HTTP Request: POST https://api.openai.com/v1/traces/ingest "HTTP/1.1 204 No Content"
2025-10-18 16:43:59,707 - httpx - INFO - HTTP Request: POST https://openrouter.ai/api/v1/chat/completions "HTTP/1.1 200 OK"
   ✅ Agent_1 responded (1856 chars) [4.0s]
2025-10-18 16:44:01,612 - httpx - INFO - HTTP Request: POST https://generativelanguage.googleapis.com/v1beta/openai/chat/completions "HTTP/1.1 200 OK"
2025-10-18 16:44:02,102 - httpx - INFO - HTTP Request: POST https://openrouter.ai/api/v1/chat/completions "HTTP/1.1 200 OK"
2025-10-18 16:44:04,194 - httpx - INFO - HTTP Request: POST https://api.openai.com/v1/traces/ingest "HTTP/1.1 204 No Content"
2025-10-18 16:44:05,616 - httpx - INFO - HTTP Request: POST https://openrouter.ai/api/v1/chat/completions "HTTP/1.1 200 OK"
2025-10-18 16:44:09,633 - httpx - INFO - HTTP Request: POST https://api.openai.com/v1/traces/ingest "HTTP/1.1 204 No Content"
2025-10-18 16:44:23,777 - httpx - INFO - HTTP Request: POST https://openrouter.ai/api/v1/chat/completions "HTTP/1.1 200 OK"
2025-10-18 16:44:25,260 - httpx - INFO - HTTP Request: POST https://api.openai.com/v1/traces/ingest "HTTP/1.1 204 No Content"
2025-10-18 16:44:50,083 - httpx - INFO - HTTP Request: POST https://openrouter.ai/api/v1/chat/completions "HTTP/1.1 200 OK"
2025-10-18 16:44:51,117 - httpx - INFO - HTTP Request: POST https://api.openai.com/v1/traces/ingest "HTTP/1.1 204 No Content"
🗳️  Voting initiated (Round 3)
2025-10-18 16:44:54,016 - httpx - INFO - HTTP Request: POST https://openrouter.ai/api/v1/chat/completions "HTTP/1.1 200 OK"
2025-10-18 16:44:56,527 - httpx - INFO - HTTP Request: POST https://api.openai.com/v1/traces/ingest "HTTP/1.1 204 No Content"
2025-10-18 16:44:59,921 - httpx - INFO - HTTP Request: POST https://openrouter.ai/api/v1/chat/completions "HTTP/1.1 200 OK"
2025-10-18 16:45:01,999 - httpx - INFO - HTTP Request: POST https://api.openai.com/v1/traces/ingest "HTTP/1.1 204 No Content"
⏳ No consensus yet - continuing discussion...

   ✅ Round 3 complete - 1m 54s

🗣️  Round 4 (4/10)
   Speaking order: Agent_2 → Agent_1 → Agent_3
   💭 Agent_2 is thinking...
2025-10-18 16:45:11,673 - httpx - INFO - HTTP Request: POST https://openrouter.ai/api/v1/chat/completions "HTTP/1.1 200 OK"
2025-10-18 16:45:12,564 - httpx - INFO - HTTP Request: POST https://api.openai.com/v1/traces/ingest "HTTP/1.1 204 No Content"
2025-10-18 16:45:23,443 - httpx - INFO - HTTP Request: POST https://openrouter.ai/api/v1/chat/completions "HTTP/1.1 200 OK"
   ✅ Agent_2 responded (1986 chars) [16.8s]
2025-10-18 16:45:28,327 - httpx - INFO - HTTP Request: POST https://api.openai.com/v1/traces/ingest "HTTP/1.1 204 No Content"
2025-10-18 16:45:28,483 - httpx - INFO - HTTP Request: POST https://generativelanguage.googleapis.com/v1beta/openai/chat/completions "HTTP/1.1 200 OK"
   💭 Agent_1 is thinking...
2025-10-18 16:45:28,979 - httpx - INFO - HTTP Request: POST https://openrouter.ai/api/v1/chat/completions "HTTP/1.1 200 OK"
2025-10-18 16:45:31,217 - httpx - INFO - HTTP Request: POST https://openrouter.ai/api/v1/chat/completions "HTTP/1.1 200 OK"
   ✅ Agent_1 responded (2663 chars) [4.2s]
2025-10-18 16:45:33,377 - httpx - INFO - HTTP Request: POST https://generativelanguage.googleapis.com/v1beta/openai/chat/completions "HTTP/1.1 200 OK"
   💭 Agent_3 is thinking...
2025-10-18 16:45:33,852 - httpx - INFO - HTTP Request: POST https://api.openai.com/v1/traces/ingest "HTTP/1.1 204 No Content"
2025-10-18 16:45:34,056 - httpx - INFO - HTTP Request: POST https://openrouter.ai/api/v1/chat/completions "HTTP/1.1 200 OK"
2025-10-18 16:45:55,630 - httpx - INFO - HTTP Request: POST https://openrouter.ai/api/v1/chat/completions "HTTP/1.1 200 OK"
2025-10-18 16:45:59,670 - httpx - INFO - HTTP Request: POST https://api.openai.com/v1/traces/ingest "HTTP/1.1 204 No Content"
   ✅ Agent_3 responded (1837 chars) [27.0s]
2025-10-18 16:46:01,170 - httpx - INFO - HTTP Request: POST https://generativelanguage.googleapis.com/v1beta/openai/chat/completions "HTTP/1.1 200 OK"
2025-10-18 16:46:01,664 - httpx - INFO - HTTP Request: POST https://openrouter.ai/api/v1/chat/completions "HTTP/1.1 200 OK"
2025-10-18 16:46:05,177 - httpx - INFO - HTTP Request: POST https://api.openai.com/v1/traces/ingest "HTTP/1.1 204 No Content"
2025-10-18 16:46:07,779 - utils.memory_manager - INFO - Memory approaching limit for Agent_2, attempting compression...
2025-10-18 16:46:08,317 - httpx - INFO - HTTP Request: POST https://openrouter.ai/api/v1/chat/completions "HTTP/1.1 200 OK"
2025-10-18 16:46:10,676 - httpx - INFO - HTTP Request: POST https://api.openai.com/v1/traces/ingest "HTTP/1.1 204 No Content"
2025-10-18 16:46:23,303 - utils.memory_manager - INFO - Memory compressed from 22173 to 9011 characters
2025-10-18 16:46:23,741 - httpx - INFO - HTTP Request: POST https://openrouter.ai/api/v1/chat/completions "HTTP/1.1 200 OK"
2025-10-18 16:46:26,265 - httpx - INFO - HTTP Request: POST https://api.openai.com/v1/traces/ingest "HTTP/1.1 204 No Content"
2025-10-18 16:46:35,055 - utils.memory_manager - INFO - Memory approaching limit for Agent_3, attempting compression...
2025-10-18 16:46:35,511 - httpx - INFO - HTTP Request: POST https://openrouter.ai/api/v1/chat/completions "HTTP/1.1 200 OK"
2025-10-18 16:46:36,805 - httpx - INFO - HTTP Request: POST https://api.openai.com/v1/traces/ingest "HTTP/1.1 204 No Content"
2025-10-18 16:46:49,937 - utils.memory_manager - INFO - Memory compressed from 22326 to 7247 characters
2025-10-18 16:46:50,504 - httpx - INFO - HTTP Request: POST https://openrouter.ai/api/v1/chat/completions "HTTP/1.1 200 OK"
2025-10-18 16:46:52,450 - httpx - INFO - HTTP Request: POST https://api.openai.com/v1/traces/ingest "HTTP/1.1 204 No Content"
2025-10-18 16:47:03,889 - httpx - INFO - HTTP Request: POST https://openrouter.ai/api/v1/chat/completions "HTTP/1.1 200 OK"
🗳️  Voting initiated (Round 4)
2025-10-18 16:47:04,836 - httpx - INFO - HTTP Request: POST https://openrouter.ai/api/v1/chat/completions "HTTP/1.1 200 OK"
2025-10-18 16:47:08,086 - httpx - INFO - HTTP Request: POST https://api.openai.com/v1/traces/ingest "HTTP/1.1 204 No Content"
2025-10-18 16:47:08,380 - httpx - INFO - HTTP Request: POST https://openrouter.ai/api/v1/chat/completions "HTTP/1.1 200 OK"
2025-10-18 16:47:08,418 - httpx - INFO - HTTP Request: POST https://api.openai.com/v1/traces/ingest "HTTP/1.1 204 No Content"
⏳ No consensus yet - continuing discussion...

   ✅ Round 4 complete - 2m 0s

🗣️  Round 5 (5/10)
   Speaking order: Agent_2 → Agent_1 → Agent_3
   💭 Agent_2 is thinking...
2025-10-18 16:47:11,928 - httpx - INFO - HTTP Request: POST https://openrouter.ai/api/v1/chat/completions "HTTP/1.1 200 OK"
2025-10-18 16:47:13,859 - httpx - INFO - HTTP Request: POST https://api.openai.com/v1/traces/ingest "HTTP/1.1 204 No Content"
2025-10-18 16:47:24,380 - httpx - INFO - HTTP Request: POST https://api.openai.com/v1/traces/ingest "HTTP/1.1 204 No Content"
2025-10-18 16:47:24,451 - httpx - INFO - HTTP Request: POST https://openrouter.ai/api/v1/chat/completions "HTTP/1.1 200 OK"
   ✅ Agent_2 responded (2363 chars) [19.9s]
2025-10-18 16:47:31,823 - httpx - INFO - HTTP Request: POST https://generativelanguage.googleapis.com/v1beta/openai/chat/completions "HTTP/1.1 200 OK"
   💭 Agent_1 is thinking...
2025-10-18 16:47:32,448 - httpx - INFO - HTTP Request: POST https://openrouter.ai/api/v1/chat/completions "HTTP/1.1 200 OK"
2025-10-18 16:47:34,986 - httpx - INFO - HTTP Request: POST https://api.openai.com/v1/traces/ingest "HTTP/1.1 204 No Content"
2025-10-18 16:47:35,330 - httpx - INFO - HTTP Request: POST https://api.openai.com/v1/traces/ingest "HTTP/1.1 204 No Content"
2025-10-18 16:47:35,399 - httpx - INFO - HTTP Request: POST https://openrouter.ai/api/v1/chat/completions "HTTP/1.1 200 OK"
   ✅ Agent_1 responded (2334 chars) [5.0s]
2025-10-18 16:47:37,690 - httpx - INFO - HTTP Request: POST https://generativelanguage.googleapis.com/v1beta/openai/chat/completions "HTTP/1.1 200 OK"
   💭 Agent_3 is thinking...
2025-10-18 16:47:38,402 - httpx - INFO - HTTP Request: POST https://openrouter.ai/api/v1/chat/completions "HTTP/1.1 200 OK"
2025-10-18 16:47:40,801 - httpx - INFO - HTTP Request: POST https://api.openai.com/v1/traces/ingest "HTTP/1.1 204 No Content"
2025-10-18 16:47:52,920 - httpx - INFO - HTTP Request: POST https://openrouter.ai/api/v1/chat/completions "HTTP/1.1 200 OK"
2025-10-18 16:47:56,424 - httpx - INFO - HTTP Request: POST https://api.openai.com/v1/traces/ingest "HTTP/1.1 204 No Content"
   ✅ Agent_3 responded (1890 chars) [22.0s]
2025-10-18 16:48:00,438 - httpx - INFO - HTTP Request: POST https://generativelanguage.googleapis.com/v1beta/openai/chat/completions "HTTP/1.1 200 OK"
2025-10-18 16:48:01,085 - httpx - INFO - HTTP Request: POST https://openrouter.ai/api/v1/chat/completions "HTTP/1.1 200 OK"
2025-10-18 16:48:01,841 - httpx - INFO - HTTP Request: POST https://api.openai.com/v1/traces/ingest "HTTP/1.1 204 No Content"
2025-10-18 16:48:04,800 - httpx - INFO - HTTP Request: POST https://openrouter.ai/api/v1/chat/completions "HTTP/1.1 200 OK"
2025-10-18 16:48:07,313 - httpx - INFO - HTTP Request: POST https://api.openai.com/v1/traces/ingest "HTTP/1.1 204 No Content"
2025-10-18 16:48:18,785 - httpx - INFO - HTTP Request: POST https://openrouter.ai/api/v1/chat/completions "HTTP/1.1 200 OK"
2025-10-18 16:48:22,918 - httpx - INFO - HTTP Request: POST https://api.openai.com/v1/traces/ingest "HTTP/1.1 204 No Content"
2025-10-18 16:48:32,826 - httpx - INFO - HTTP Request: POST https://openrouter.ai/api/v1/chat/completions "HTTP/1.1 200 OK"
2025-10-18 16:48:33,451 - httpx - INFO - HTTP Request: POST https://api.openai.com/v1/traces/ingest "HTTP/1.1 204 No Content"
2025-10-18 16:48:33,700 - httpx - INFO - HTTP Request: POST https://openrouter.ai/api/v1/chat/completions "HTTP/1.1 200 OK"
2025-10-18 16:48:33,749 - httpx - INFO - HTTP Request: POST https://api.openai.com/v1/traces/ingest "HTTP/1.1 204 No Content"
2025-10-18 16:48:35,603 - httpx - INFO - HTTP Request: POST https://openrouter.ai/api/v1/chat/completions "HTTP/1.1 200 OK"
   ✅ Round 5 complete - 1m 25s

🗣️  Round 6 (6/10)
   Speaking order: Agent_1 → Agent_3 → Agent_2
   💭 Agent_1 is thinking...
2025-10-18 16:48:37,547 - httpx - INFO - HTTP Request: POST https://openrouter.ai/api/v1/chat/completions "HTTP/1.1 200 OK"
2025-10-18 16:48:39,185 - httpx - INFO - HTTP Request: POST https://api.openai.com/v1/traces/ingest "HTTP/1.1 204 No Content"
2025-10-18 16:48:40,340 - httpx - INFO - HTTP Request: POST https://openrouter.ai/api/v1/chat/completions "HTTP/1.1 200 OK"
   ✅ Agent_1 responded (2772 chars) [4.7s]
2025-10-18 16:48:42,342 - httpx - INFO - HTTP Request: POST https://generativelanguage.googleapis.com/v1beta/openai/chat/completions "HTTP/1.1 200 OK"
   💭 Agent_3 is thinking...
2025-10-18 16:48:43,083 - httpx - INFO - HTTP Request: POST https://openrouter.ai/api/v1/chat/completions "HTTP/1.1 200 OK"
2025-10-18 16:48:44,719 - httpx - INFO - HTTP Request: POST https://api.openai.com/v1/traces/ingest "HTTP/1.1 204 No Content"
2025-10-18 16:48:55,284 - httpx - INFO - HTTP Request: POST https://api.openai.com/v1/traces/ingest "HTTP/1.1 204 No Content"
2025-10-18 16:48:55,585 - httpx - INFO - HTTP Request: POST https://openrouter.ai/api/v1/chat/completions "HTTP/1.1 200 OK"
   ✅ Agent_3 responded (1799 chars) [20.0s]
2025-10-18 16:49:03,170 - httpx - INFO - HTTP Request: POST https://generativelanguage.googleapis.com/v1beta/openai/chat/completions "HTTP/1.1 200 OK"
   💭 Agent_2 is thinking...
2025-10-18 16:49:04,365 - httpx - INFO - HTTP Request: POST https://openrouter.ai/api/v1/chat/completions "HTTP/1.1 200 OK"
2025-10-18 16:49:05,830 - httpx - INFO - HTTP Request: POST https://api.openai.com/v1/traces/ingest "HTTP/1.1 204 No Content"
2025-10-18 16:49:15,963 - httpx - INFO - HTTP Request: POST https://openrouter.ai/api/v1/chat/completions "HTTP/1.1 200 OK"
2025-10-18 16:49:16,379 - httpx - INFO - HTTP Request: POST https://api.openai.com/v1/traces/ingest "HTTP/1.1 204 No Content"
   ✅ Agent_2 responded (2318 chars) [16.5s]
2025-10-18 16:49:20,426 - httpx - INFO - HTTP Request: POST https://generativelanguage.googleapis.com/v1beta/openai/chat/completions "HTTP/1.1 200 OK"
2025-10-18 16:49:21,026 - httpx - INFO - HTTP Request: POST https://openrouter.ai/api/v1/chat/completions "HTTP/1.1 200 OK"
2025-10-18 16:49:21,900 - httpx - INFO - HTTP Request: POST https://api.openai.com/v1/traces/ingest "HTTP/1.1 204 No Content"
2025-10-18 16:49:25,329 - httpx - INFO - HTTP Request: POST https://openrouter.ai/api/v1/chat/completions "HTTP/1.1 200 OK"
2025-10-18 16:49:27,392 - httpx - INFO - HTTP Request: POST https://api.openai.com/v1/traces/ingest "HTTP/1.1 204 No Content"
2025-10-18 16:49:38,515 - httpx - INFO - HTTP Request: POST https://openrouter.ai/api/v1/chat/completions "HTTP/1.1 200 OK"
2025-10-18 16:49:43,077 - httpx - INFO - HTTP Request: POST https://api.openai.com/v1/traces/ingest "HTTP/1.1 204 No Content"
2025-10-18 16:49:58,023 - httpx - INFO - HTTP Request: POST https://openrouter.ai/api/v1/chat/completions "HTTP/1.1 200 OK"
2025-10-18 16:49:58,727 - httpx - INFO - HTTP Request: POST https://api.openai.com/v1/traces/ingest "HTTP/1.1 204 No Content"
🗳️  Voting initiated (Round 6)
2025-10-18 16:50:00,062 - httpx - INFO - HTTP Request: POST https://openrouter.ai/api/v1/chat/completions "HTTP/1.1 200 OK"
2025-10-18 16:50:02,882 - httpx - INFO - HTTP Request: POST https://openrouter.ai/api/v1/chat/completions "HTTP/1.1 200 OK"
2025-10-18 16:50:04,191 - httpx - INFO - HTTP Request: POST https://api.openai.com/v1/traces/ingest "HTTP/1.1 204 No Content"
⏳ No consensus yet - continuing discussion...

   ✅ Round 6 complete - 1m 27s

🗣️  Round 7 (7/10)
   Speaking order: Agent_1 → Agent_2 → Agent_3
   💭 Agent_1 is thinking...
2025-10-18 16:50:05,258 - httpx - INFO - HTTP Request: POST https://openrouter.ai/api/v1/chat/completions "HTTP/1.1 200 OK"
2025-10-18 16:50:08,126 - httpx - INFO - HTTP Request: POST https://openrouter.ai/api/v1/chat/completions "HTTP/1.1 200 OK"
   ✅ Agent_1 responded (2343 chars) [5.0s]
2025-10-18 16:50:09,673 - httpx - INFO - HTTP Request: POST https://api.openai.com/v1/traces/ingest "HTTP/1.1 204 No Content"
2025-10-18 16:50:10,005 - httpx - INFO - HTTP Request: POST https://api.openai.com/v1/traces/ingest "HTTP/1.1 204 No Content"
2025-10-18 16:50:10,187 - httpx - INFO - HTTP Request: POST https://generativelanguage.googleapis.com/v1beta/openai/chat/completions "HTTP/1.1 200 OK"
   💭 Agent_2 is thinking...
2025-10-18 16:50:11,068 - httpx - INFO - HTTP Request: POST https://openrouter.ai/api/v1/chat/completions "HTTP/1.1 200 OK"
2025-10-18 16:50:21,314 - httpx - INFO - HTTP Request: POST https://openrouter.ai/api/v1/chat/completions "HTTP/1.1 200 OK"
2025-10-18 16:50:25,680 - httpx - INFO - HTTP Request: POST https://api.openai.com/v1/traces/ingest "HTTP/1.1 204 No Content"
   ✅ Agent_2 responded (2292 chars) [16.6s]
2025-10-18 16:50:27,912 - httpx - INFO - HTTP Request: POST https://generativelanguage.googleapis.com/v1beta/openai/chat/completions "HTTP/1.1 200 OK"
   💭 Agent_3 is thinking...
2025-10-18 16:50:28,570 - httpx - INFO - HTTP Request: POST https://openrouter.ai/api/v1/chat/completions "HTTP/1.1 200 OK"
2025-10-18 16:50:31,172 - httpx - INFO - HTTP Request: POST https://api.openai.com/v1/traces/ingest "HTTP/1.1 204 No Content"
2025-10-18 16:50:38,923 - httpx - INFO - HTTP Request: POST https://openrouter.ai/api/v1/chat/completions "HTTP/1.1 200 OK"
2025-10-18 16:50:41,692 - httpx - INFO - HTTP Request: POST https://api.openai.com/v1/traces/ingest "HTTP/1.1 204 No Content"
   ✅ Agent_3 responded (2014 chars) [17.5s]
2025-10-18 16:50:46,253 - httpx - INFO - HTTP Request: POST https://generativelanguage.googleapis.com/v1beta/openai/chat/completions "HTTP/1.1 200 OK"
2025-10-18 16:50:46,760 - httpx - INFO - HTTP Request: POST https://openrouter.ai/api/v1/chat/completions "HTTP/1.1 200 OK"
2025-10-18 16:50:47,172 - httpx - INFO - HTTP Request: POST https://api.openai.com/v1/traces/ingest "HTTP/1.1 204 No Content"
2025-10-18 16:50:52,115 - httpx - INFO - HTTP Request: POST https://openrouter.ai/api/v1/chat/completions "HTTP/1.1 200 OK"
2025-10-18 16:50:52,687 - httpx - INFO - HTTP Request: POST https://api.openai.com/v1/traces/ingest "HTTP/1.1 204 No Content"
2025-10-18 16:51:07,086 - httpx - INFO - HTTP Request: POST https://openrouter.ai/api/v1/chat/completions "HTTP/1.1 200 OK"
2025-10-18 16:51:08,318 - httpx - INFO - HTTP Request: POST https://api.openai.com/v1/traces/ingest "HTTP/1.1 204 No Content"
2025-10-18 16:51:25,126 - httpx - INFO - HTTP Request: POST https://openrouter.ai/api/v1/chat/completions "HTTP/1.1 200 OK"
🗳️  Voting initiated (Round 7)
2025-10-18 16:51:26,738 - httpx - INFO - HTTP Request: POST https://openrouter.ai/api/v1/chat/completions "HTTP/1.1 200 OK"
2025-10-18 16:51:29,071 - httpx - INFO - HTTP Request: POST https://api.openai.com/v1/traces/ingest "HTTP/1.1 204 No Content"
2025-10-18 16:51:30,370 - httpx - INFO - HTTP Request: POST https://openrouter.ai/api/v1/chat/completions "HTTP/1.1 200 OK"
⏳ No consensus yet - continuing discussion...

   ✅ Round 7 complete - 1m 28s

🗣️  Round 8 (8/10)
   Speaking order: Agent_1 → Agent_3 → Agent_2
   💭 Agent_1 is thinking...
2025-10-18 16:51:33,675 - httpx - INFO - HTTP Request: POST https://openrouter.ai/api/v1/chat/completions "HTTP/1.1 200 OK"
2025-10-18 16:51:34,670 - httpx - INFO - HTTP Request: POST https://api.openai.com/v1/traces/ingest "HTTP/1.1 204 No Content"
2025-10-18 16:51:36,886 - httpx - INFO - HTTP Request: POST https://openrouter.ai/api/v1/chat/completions "HTTP/1.1 200 OK"
   ✅ Agent_1 responded (2272 chars) [5.4s]
2025-10-18 16:51:39,200 - httpx - INFO - HTTP Request: POST https://generativelanguage.googleapis.com/v1beta/openai/chat/completions "HTTP/1.1 200 OK"
   💭 Agent_3 is thinking...
2025-10-18 16:51:40,147 - httpx - INFO - HTTP Request: POST https://openrouter.ai/api/v1/chat/completions "HTTP/1.1 200 OK"
2025-10-18 16:51:40,303 - httpx - INFO - HTTP Request: POST https://api.openai.com/v1/traces/ingest "HTTP/1.1 204 No Content"
2025-10-18 16:51:49,643 - httpx - INFO - HTTP Request: POST https://openrouter.ai/api/v1/chat/completions "HTTP/1.1 200 OK"
2025-10-18 16:51:50,897 - httpx - INFO - HTTP Request: POST https://api.openai.com/v1/traces/ingest "HTTP/1.1 204 No Content"
   ✅ Agent_3 responded (2035 chars) [17.2s]
2025-10-18 16:51:57,286 - httpx - INFO - HTTP Request: POST https://generativelanguage.googleapis.com/v1beta/openai/chat/completions "HTTP/1.1 200 OK"
   💭 Agent_2 is thinking...
2025-10-18 16:51:58,291 - httpx - INFO - HTTP Request: POST https://openrouter.ai/api/v1/chat/completions "HTTP/1.1 200 OK"
2025-10-18 16:52:01,419 - httpx - INFO - HTTP Request: POST https://api.openai.com/v1/traces/ingest "HTTP/1.1 204 No Content"
2025-10-18 16:52:09,735 - httpx - INFO - HTTP Request: POST https://openrouter.ai/api/v1/chat/completions "HTTP/1.1 200 OK"
2025-10-18 16:52:12,005 - httpx - INFO - HTTP Request: POST https://api.openai.com/v1/traces/ingest "HTTP/1.1 204 No Content"
   ✅ Agent_2 responded (2553 chars) [18.2s]
2025-10-18 16:52:16,526 - httpx - INFO - HTTP Request: POST https://generativelanguage.googleapis.com/v1beta/openai/chat/completions "HTTP/1.1 200 OK"
2025-10-18 16:52:17,133 - httpx - INFO - HTTP Request: POST https://openrouter.ai/api/v1/chat/completions "HTTP/1.1 200 OK"
2025-10-18 16:52:17,493 - httpx - INFO - HTTP Request: POST https://api.openai.com/v1/traces/ingest "HTTP/1.1 204 No Content"
2025-10-18 16:52:22,009 - httpx - INFO - HTTP Request: POST https://openrouter.ai/api/v1/chat/completions "HTTP/1.1 200 OK"
2025-10-18 16:52:22,959 - httpx - INFO - HTTP Request: POST https://api.openai.com/v1/traces/ingest "HTTP/1.1 204 No Content"
2025-10-18 16:52:41,545 - httpx - INFO - HTTP Request: POST https://openrouter.ai/api/v1/chat/completions "HTTP/1.1 200 OK"
2025-10-18 16:52:43,751 - httpx - INFO - HTTP Request: POST https://api.openai.com/v1/traces/ingest "HTTP/1.1 204 No Content"
2025-10-18 16:52:55,310 - httpx - INFO - HTTP Request: POST https://openrouter.ai/api/v1/chat/completions "HTTP/1.1 200 OK"
🗳️  Voting initiated (Round 8)
2025-10-18 16:52:56,702 - httpx - INFO - HTTP Request: POST https://openrouter.ai/api/v1/chat/completions "HTTP/1.1 200 OK"
2025-10-18 16:52:59,418 - httpx - INFO - HTTP Request: POST https://api.openai.com/v1/traces/ingest "HTTP/1.1 204 No Content"
2025-10-18 16:52:59,762 - httpx - INFO - HTTP Request: POST https://api.openai.com/v1/traces/ingest "HTTP/1.1 204 No Content"
2025-10-18 16:53:00,421 - httpx - INFO - HTTP Request: POST https://openrouter.ai/api/v1/chat/completions "HTTP/1.1 200 OK"
⏳ No consensus yet - continuing discussion...

   ✅ Round 8 complete - 1m 29s

🗣️  Round 9 (9/10)
   Speaking order: Agent_1 → Agent_3 → Agent_2
   💭 Agent_1 is thinking...
2025-10-18 16:53:03,410 - httpx - INFO - HTTP Request: POST https://openrouter.ai/api/v1/chat/completions "HTTP/1.1 200 OK"
2025-10-18 16:53:05,210 - httpx - INFO - HTTP Request: POST https://api.openai.com/v1/traces/ingest "HTTP/1.1 204 No Content"
2025-10-18 16:53:07,168 - httpx - INFO - HTTP Request: POST https://openrouter.ai/api/v1/chat/completions "HTTP/1.1 200 OK"
   ✅ Agent_1 responded (2380 chars) [6.3s]
2025-10-18 16:53:09,844 - httpx - INFO - HTTP Request: POST https://generativelanguage.googleapis.com/v1beta/openai/chat/completions "HTTP/1.1 200 OK"
   💭 Agent_3 is thinking...
2025-10-18 16:53:10,732 - httpx - INFO - HTTP Request: POST https://openrouter.ai/api/v1/chat/completions "HTTP/1.1 200 OK"
2025-10-18 16:53:10,739 - httpx - INFO - HTTP Request: POST https://api.openai.com/v1/traces/ingest "HTTP/1.1 204 No Content"
2025-10-18 16:53:21,369 - httpx - INFO - HTTP Request: POST https://openrouter.ai/api/v1/chat/completions "HTTP/1.1 200 OK"
2025-10-18 16:53:21,376 - httpx - INFO - HTTP Request: POST https://api.openai.com/v1/traces/ingest "HTTP/1.1 204 No Content"
   ✅ Agent_3 responded (2186 chars) [19.4s]
2025-10-18 16:53:30,031 - httpx - INFO - HTTP Request: POST https://generativelanguage.googleapis.com/v1beta/openai/chat/completions "HTTP/1.1 200 OK"
   💭 Agent_2 is thinking...
2025-10-18 16:53:31,006 - httpx - INFO - HTTP Request: POST https://openrouter.ai/api/v1/chat/completions "HTTP/1.1 200 OK"
2025-10-18 16:53:31,890 - httpx - INFO - HTTP Request: POST https://api.openai.com/v1/traces/ingest "HTTP/1.1 204 No Content"
2025-10-18 16:53:45,091 - httpx - INFO - HTTP Request: POST https://openrouter.ai/api/v1/chat/completions "HTTP/1.1 200 OK"
2025-10-18 16:53:47,548 - httpx - INFO - HTTP Request: POST https://api.openai.com/v1/traces/ingest "HTTP/1.1 204 No Content"
   ✅ Agent_2 responded (2722 chars) [20.6s]
2025-10-18 16:53:51,445 - httpx - INFO - HTTP Request: POST https://generativelanguage.googleapis.com/v1beta/openai/chat/completions "HTTP/1.1 200 OK"
2025-10-18 16:53:52,019 - httpx - INFO - HTTP Request: POST https://openrouter.ai/api/v1/chat/completions "HTTP/1.1 200 OK"
2025-10-18 16:53:53,039 - httpx - INFO - HTTP Request: POST https://api.openai.com/v1/traces/ingest "HTTP/1.1 204 No Content"
2025-10-18 16:53:55,768 - httpx - INFO - HTTP Request: POST https://openrouter.ai/api/v1/chat/completions "HTTP/1.1 200 OK"
2025-10-18 16:53:58,551 - httpx - INFO - HTTP Request: POST https://api.openai.com/v1/traces/ingest "HTTP/1.1 204 No Content"
2025-10-18 16:54:19,078 - httpx - INFO - HTTP Request: POST https://openrouter.ai/api/v1/chat/completions "HTTP/1.1 200 OK"
2025-10-18 16:54:19,341 - httpx - INFO - HTTP Request: POST https://api.openai.com/v1/traces/ingest "HTTP/1.1 204 No Content"
2025-10-18 16:54:36,502 - httpx - INFO - HTTP Request: POST https://openrouter.ai/api/v1/chat/completions "HTTP/1.1 200 OK"
🗳️  Voting initiated (Round 9)
2025-10-18 16:54:38,091 - httpx - INFO - HTTP Request: POST https://openrouter.ai/api/v1/chat/completions "HTTP/1.1 200 OK"
2025-10-18 16:54:40,083 - httpx - INFO - HTTP Request: POST https://api.openai.com/v1/traces/ingest "HTTP/1.1 204 No Content"
2025-10-18 16:54:41,813 - httpx - INFO - HTTP Request: POST https://openrouter.ai/api/v1/chat/completions "HTTP/1.1 200 OK"
2025-10-18 16:54:45,522 - httpx - INFO - HTTP Request: POST https://api.openai.com/v1/traces/ingest "HTTP/1.1 204 No Content"
⏳ No consensus yet - continuing discussion...

   ✅ Round 9 complete - 1m 43s

🗣️  Round 10 (10/10)
   Speaking order: Agent_3 → Agent_2 → Agent_1
   💭 Agent_3 is thinking...
2025-10-18 16:54:46,559 - httpx - INFO - HTTP Request: POST https://openrouter.ai/api/v1/chat/completions "HTTP/1.1 200 OK"
2025-10-18 16:54:50,987 - httpx - INFO - HTTP Request: POST https://api.openai.com/v1/traces/ingest "HTTP/1.1 204 No Content"
2025-10-18 16:55:00,900 - httpx - INFO - HTTP Request: POST https://openrouter.ai/api/v1/chat/completions "HTTP/1.1 200 OK"
2025-10-18 16:55:01,576 - httpx - INFO - HTTP Request: POST https://api.openai.com/v1/traces/ingest "HTTP/1.1 204 No Content"
   ✅ Agent_3 responded (1486 chars) [25.1s]
2025-10-18 16:55:11,663 - httpx - INFO - HTTP Request: POST https://generativelanguage.googleapis.com/v1beta/openai/chat/completions "HTTP/1.1 200 OK"
   💭 Agent_2 is thinking...
2025-10-18 16:55:12,123 - httpx - INFO - HTTP Request: POST https://api.openai.com/v1/traces/ingest "HTTP/1.1 204 No Content"
2025-10-18 16:55:12,874 - httpx - INFO - HTTP Request: POST https://openrouter.ai/api/v1/chat/completions "HTTP/1.1 200 OK"
2025-10-18 16:55:24,178 - httpx - INFO - HTTP Request: POST https://openrouter.ai/api/v1/chat/completions "HTTP/1.1 200 OK"
   ✅ Agent_2 responded (1407 chars) [15.9s]
2025-10-18 16:55:27,847 - httpx - INFO - HTTP Request: POST https://api.openai.com/v1/traces/ingest "HTTP/1.1 204 No Content"
2025-10-18 16:55:28,236 - httpx - INFO - HTTP Request: POST https://api.openai.com/v1/traces/ingest "HTTP/1.1 204 No Content"
2025-10-18 16:55:28,432 - httpx - INFO - HTTP Request: POST https://generativelanguage.googleapis.com/v1beta/openai/chat/completions "HTTP/1.1 200 OK"
   💭 Agent_1 is thinking...
2025-10-18 16:55:29,558 - httpx - INFO - HTTP Request: POST https://openrouter.ai/api/v1/chat/completions "HTTP/1.1 200 OK"
2025-10-18 16:55:32,090 - httpx - INFO - HTTP Request: POST https://openrouter.ai/api/v1/chat/completions "HTTP/1.1 200 OK"
   ✅ Agent_1 responded (488 chars) [4.3s]
2025-10-18 16:55:33,448 - httpx - INFO - HTTP Request: POST https://generativelanguage.googleapis.com/v1beta/openai/chat/completions "HTTP/1.1 200 OK"
2025-10-18 16:55:33,811 - httpx - INFO - HTTP Request: POST https://api.openai.com/v1/traces/ingest "HTTP/1.1 204 No Content"
2025-10-18 16:55:34,056 - httpx - INFO - HTTP Request: POST https://openrouter.ai/api/v1/chat/completions "HTTP/1.1 200 OK"
2025-10-18 16:55:36,749 - httpx - INFO - HTTP Request: POST https://openrouter.ai/api/v1/chat/completions "HTTP/1.1 200 OK"
2025-10-18 16:55:39,274 - httpx - INFO - HTTP Request: POST https://api.openai.com/v1/traces/ingest "HTTP/1.1 204 No Content"
2025-10-18 16:55:58,343 - httpx - INFO - HTTP Request: POST https://openrouter.ai/api/v1/chat/completions "HTTP/1.1 200 OK"
2025-10-18 16:56:00,108 - httpx - INFO - HTTP Request: POST https://api.openai.com/v1/traces/ingest "HTTP/1.1 204 No Content"
2025-10-18 16:56:22,666 - httpx - INFO - HTTP Request: POST https://openrouter.ai/api/v1/chat/completions "HTTP/1.1 200 OK"
🗳️  Voting initiated (Round 10)
2025-10-18 16:56:23,943 - httpx - INFO - HTTP Request: POST https://openrouter.ai/api/v1/chat/completions "HTTP/1.1 200 OK"
2025-10-18 16:56:26,035 - httpx - INFO - HTTP Request: POST https://api.openai.com/v1/traces/ingest "HTTP/1.1 204 No Content"
2025-10-18 16:56:27,323 - httpx - INFO - HTTP Request: POST https://openrouter.ai/api/v1/chat/completions "HTTP/1.1 200 OK"
2025-10-18 16:56:31,502 - httpx - INFO - HTTP Request: POST https://api.openai.com/v1/traces/ingest "HTTP/1.1 204 No Content"
2025-10-18 16:56:35,640 - core.two_stage_voting_manager - INFO - Starting two-stage voting for Agent_1
2025-10-18 16:56:36,050 - httpx - INFO - HTTP Request: POST https://openrouter.ai/api/v1/chat/completions "HTTP/1.1 200 OK"
2025-10-18 16:56:36,166 - core.two_stage_voting_manager - INFO - Two-stage voting success - Agent_1 principle_selection: '3' -> 3 (attempt 1)
2025-10-18 16:56:36,551 - httpx - INFO - HTTP Request: POST https://openrouter.ai/api/v1/chat/completions "HTTP/1.1 200 OK"
2025-10-18 16:56:36,734 - core.two_stage_voting_manager - INFO - Two-stage voting success - Agent_1 amount_specification: '11300' -> 11300 (attempt 1)
2025-10-18 16:56:36,735 - core.two_stage_voting_manager - INFO - Completed two-stage voting for Agent_1: principle 3, amount 11300
2025-10-18 16:56:36,735 - core.two_stage_voting_manager - INFO - Starting two-stage voting for Agent_2
2025-10-18 16:56:37,014 - httpx - INFO - HTTP Request: POST https://api.openai.com/v1/traces/ingest "HTTP/1.1 204 No Content"
2025-10-18 16:56:37,303 - httpx - INFO - HTTP Request: POST https://api.openai.com/v1/traces/ingest "HTTP/1.1 204 No Content"
2025-10-18 16:56:37,652 - httpx - INFO - HTTP Request: POST https://openrouter.ai/api/v1/chat/completions "HTTP/1.1 200 OK"
2025-10-18 16:56:39,432 - core.two_stage_voting_manager - INFO - Two-stage voting success - Agent_2 principle_selection: '3' -> 3 (attempt 1)
2025-10-18 16:56:40,437 - httpx - INFO - HTTP Request: POST https://openrouter.ai/api/v1/chat/completions "HTTP/1.1 200 OK"
2025-10-18 16:56:42,445 - core.two_stage_voting_manager - INFO - Two-stage voting success - Agent_2 amount_specification: '11300' -> 11300 (attempt 1)
2025-10-18 16:56:42,445 - core.two_stage_voting_manager - INFO - Completed two-stage voting for Agent_2: principle 3, amount 11300
2025-10-18 16:56:42,445 - core.two_stage_voting_manager - INFO - Starting two-stage voting for Agent_3
2025-10-18 16:56:42,792 - httpx - INFO - HTTP Request: POST https://api.openai.com/v1/traces/ingest "HTTP/1.1 204 No Content"
2025-10-18 16:56:43,166 - httpx - INFO - HTTP Request: POST https://api.openai.com/v1/traces/ingest "HTTP/1.1 204 No Content"
2025-10-18 16:56:43,368 - httpx - INFO - HTTP Request: POST https://openrouter.ai/api/v1/chat/completions "HTTP/1.1 200 OK"
2025-10-18 16:56:47,777 - core.two_stage_voting_manager - INFO - Two-stage voting success - Agent_3 principle_selection: '3' -> 3 (attempt 1)
2025-10-18 16:56:48,654 - httpx - INFO - HTTP Request: POST https://api.openai.com/v1/traces/ingest "HTTP/1.1 204 No Content"
2025-10-18 16:56:48,672 - httpx - INFO - HTTP Request: POST https://openrouter.ai/api/v1/chat/completions "HTTP/1.1 200 OK"
2025-10-18 16:56:50,528 - core.two_stage_voting_manager - INFO - Two-stage voting success - Agent_3 amount_specification: '11300' -> 11300 (attempt 1)
2025-10-18 16:56:50,529 - core.two_stage_voting_manager - INFO - Completed two-stage voting for Agent_3: principle 3, amount 11300
2025-10-18 16:56:50,529 - core.two_stage_voting_manager - INFO - Two-stage voting completed successfully for all participants
2025-10-18 16:56:50,529 - core.two_stage_voting_manager - INFO - Consensus reached: maximizing_average_floor_constraint with constraint 11300
🎉 Consensus Reached! Principle: maximizing_average_floor_constraint (constraint: $11300)

2025-10-18 16:56:50,544 - utils.language_manager - INFO - Language set to: English
2025-10-18 16:56:50,548 - utils.language_manager - INFO - Loaded translations for English
2025-10-18 16:56:50,987 - httpx - INFO - HTTP Request: POST https://openrouter.ai/api/v1/chat/completions "HTTP/1.1 200 OK"
2025-10-18 16:56:54,120 - httpx - INFO - HTTP Request: POST https://api.openai.com/v1/traces/ingest "HTTP/1.1 204 No Content"
2025-10-18 16:56:54,167 - utils.language_manager - INFO - Language set to: English
2025-10-18 16:56:54,168 - utils.language_manager - INFO - Loaded translations for English
2025-10-18 16:56:54,582 - httpx - INFO - HTTP Request: POST https://openrouter.ai/api/v1/chat/completions "HTTP/1.1 200 OK"
2025-10-18 16:56:59,559 - httpx - INFO - HTTP Request: POST https://api.openai.com/v1/traces/ingest "HTTP/1.1 204 No Content"
2025-10-18 16:57:18,924 - utils.language_manager - INFO - Language set to: English
2025-10-18 16:57:18,926 - utils.language_manager - INFO - Loaded translations for English
2025-10-18 16:57:19,385 - httpx - INFO - HTTP Request: POST https://openrouter.ai/api/v1/chat/completions "HTTP/1.1 200 OK"
2025-10-18 16:57:20,272 - httpx - INFO - HTTP Request: POST https://api.openai.com/v1/traces/ingest "HTTP/1.1 204 No Content"
2025-10-18 16:57:40,307 - httpx - INFO - HTTP Request: POST https://openrouter.ai/api/v1/chat/completions "HTTP/1.1 200 OK"
2025-10-18 16:57:40,312 - httpx - INFO - HTTP Request: POST https://openrouter.ai/api/v1/chat/completions "HTTP/1.1 200 OK"
2025-10-18 16:57:40,391 - httpx - INFO - HTTP Request: POST https://openrouter.ai/api/v1/chat/completions "HTTP/1.1 200 OK"
2025-10-18 16:57:41,012 - httpx - INFO - HTTP Request: POST https://api.openai.com/v1/traces/ingest "HTTP/1.1 204 No Content"
2025-10-18 16:57:41,672 - httpx - INFO - HTTP Request: POST https://generativelanguage.googleapis.com/v1beta/openai/chat/completions "HTTP/1.1 200 OK"
2025-10-18 16:57:42,890 - httpx - INFO - HTTP Request: POST https://generativelanguage.googleapis.com/v1beta/openai/chat/completions "HTTP/1.1 200 OK"
2025-10-18 16:57:46,495 - httpx - INFO - HTTP Request: POST https://api.openai.com/v1/traces/ingest "HTTP/1.1 204 No Content"
2025-10-18 16:57:46,873 - httpx - INFO - HTTP Request: POST https://generativelanguage.googleapis.com/v1beta/openai/chat/completions "HTTP/1.1 200 OK"
🏁 Phase 2 Complete with consensus - Duration: 18m 0s
   Rounds conducted: 10
   Final earnings:
     Agent_1: $7.36
     Agent_2: $7.36
     Agent_3: $3.99

[TECH] Experiment cc42748c-5b25-4a0c-b811-a174a668f637 completed successfully in 1257.41 seconds
2025-10-18 16:57:47,808 - httpx - INFO - HTTP Request: POST https://generativelanguage.googleapis.com/v1beta/openai/chat/completions "HTTP/1.1 200 OK"
[TECH] Consensus validation successful - discussion aligns with recorded consensus
[TECH] Transcript saved to: /Users/lucasmuller/Desktop/Githubg/Rawls_v3/transcript_cc42748c-5b25-4a0c-b811-a174a668f637.json
2025-10-18 16:57:47,850 - core.experiment_manager - INFO - Results saved to: /Users/lucasmuller/Desktop/Githubg/Rawls_v3/hypothesis_testing/hypothesis_2/results/american/hypothesis_2_american_condition_22_config_results.json
2025-10-18 16:57:47,850 - core.experiment_manager - INFO - Seed used: 651106250 (generated)
[TECH] Results saved to: /Users/lucasmuller/Desktop/Githubg/Rawls_v3/hypothesis_testing/hypothesis_2/results/american/hypothesis_2_american_condition_22_config_results.json
[DEBUG] Trace: https://platform.openai.com/logs/trace?trace_id=trace_882671bc4faf43f2acf7f02948317057
════════════════════════════════════════════════════════════
✅ EXPERIMENT COMPLETED
════════════════════════════════════════════════════════════
Total Duration: 21m 2s
Consensus: ✅ maximizing_average_floor_constraint
Transcript saved: /Users/lucasmuller/Desktop/Githubg/Rawls_v3/transcript_cc42748c-5b25-4a0c-b811-a174a668f637.json
Errors: None
Results saved: /Users/lucasmuller/Desktop/Githubg/Rawls_v3/hypothesis_testing/hypothesis_2/results/american/hypothesis_2_american_condition_22_config_results.json
🔗 Trace: https://platform.openai.com/logs/trace?trace_id=trace_882671bc4faf43f2acf7f02948317057


Frohlich Experiment Results (ID: cc42748c-5b25-4a0c-b811-a174a668f637)
Completed in 1257.41 seconds

PHASE 1 RESULTS:
  Agent_1: $12.10 (Initial pref: maximizing_floor, Final pref: maximizing_floor)
  Agent_2: $7.80 (Initial pref: maximizing_floor, Final pref: maximizing_floor)
  Agent_3: $8.80 (Initial pref: maximizing_average_floor_constraint, Final pref: maximizing_average)
  Average Phase 1 earnings: $9.57

PHASE 2 RESULTS:
  Consensus reached on: maximizing_average_floor_constraint
  Constraint amount: $11300
  Rounds to consensus: 10
  Phase 2 earnings:
    Agent_1: $7.36
    Agent_2: $7.36
    Agent_3: $3.99
  Average Phase 2 earnings: $6.24

TOTAL EARNINGS:
  Agent_1: $19.46
  Agent_2: $15.16
  Agent_3: $12.79

HIGHEST EARNER: Agent_1 with $19.46

RETURN CODE: 0  DURATION: 1263.5s
