CMD: /Users/lucasmuller/Desktop/Githubg/Rawls_v3/.venv/bin/python /Users/lucasmuller/Desktop/Githubg/Rawls_v3/main.py /Users/lucasmuller/Desktop/Githubg/Rawls_v3/hypothesis_testing/hypothesis_2/configs/chinese/hypothesis_2_chinese_condition_26_config.yaml /Users/lucasmuller/Desktop/Githubg/Rawls_v3/hypothesis_testing/hypothesis_2/results/chinese/hypothesis_2_chinese_condition_26_config_results.json
[TECH] Loading configuration from: /Users/lucasmuller/Desktop/Githubg/Rawls_v3/hypothesis_testing/hypothesis_2/configs/chinese/hypothesis_2_chinese_condition_26_config.yaml
2025-10-14 08:59:59,284 - utils.seed_manager - INFO - Generated seed 494069720 from configuration hash
2025-10-14 08:59:59,284 - utils.language_manager - INFO - Language set to: English
[TECH] Language set to: English
════════════════════════════════════════════════════════════
🧪 FROHLICH EXPERIMENT STARTING
════════════════════════════════════════════════════════════
Experiment ID: 867ab4c3
Participants: 3
Language: English
Max Phase 2 rounds: 10
Configuration file: hypothesis_2_chinese_condition_26_config.yaml
Started at: 08:59:59

[DEBUG] ✅ FORMAL VOTING: Using structured consensus building with confirmation and secret ballot
[DEBUG]    • Voting initiated via end-of-round prompts only
[DEBUG]    • Voting requires confirmation from all participants
[DEBUG]    • Consensus reached via unanimous secret ballot
[TECH] Tracing policy: participant-only spans; utility agents untraced
🤖 Initializing Agents...
2025-10-14 08:59:59,284 - experiment_agents.participant_agent - INFO - Creating 3 participant agents with dynamic temperature detection...
2025-10-14 08:59:59,284 - experiment_agents.participant_agent - INFO - Creating agent: Agent_1 (model: qwen/qwen3-next-80b-a3b-thinking, temp: 0.2088977231433743)
2025-10-14 08:59:59,284 - experiment_agents.participant_agent - INFO - Creating agent Agent_1 with dynamic temperature detection
2025-10-14 08:59:59,303 - utils.language_manager - INFO - Loaded translations for English
2025-10-14 09:00:00,249 - httpx - INFO - HTTP Request: POST https://openrouter.ai/api/v1/chat/completions "HTTP/1.1 200 OK"
2025-10-14 09:00:00,806 - utils.dynamic_model_capabilities - INFO - ✅ qwen/qwen3-next-80b-a3b-thinking supports temperature (discovered during creation)
2025-10-14 09:00:00,807 - experiment_agents.participant_agent - INFO - ✅ Agent_1: Temperature 0.2088977231433743 active (method: successful_creation)
2025-10-14 09:00:00,807 - experiment_agents.participant_agent - INFO - ✅ Successfully initialized agent Agent_1
2025-10-14 09:00:00,807 - experiment_agents.participant_agent - INFO - Creating agent: Agent_2 (model: deepseek/deepseek-v3.2-exp, temp: 0.2088977231433743)
2025-10-14 09:00:00,807 - experiment_agents.participant_agent - INFO - Creating agent Agent_2 with dynamic temperature detection
2025-10-14 09:00:01,977 - httpx - INFO - HTTP Request: POST https://openrouter.ai/api/v1/chat/completions "HTTP/1.1 200 OK"
2025-10-14 09:00:02,024 - utils.dynamic_model_capabilities - INFO - ✅ deepseek/deepseek-v3.2-exp supports temperature (discovered during creation)
2025-10-14 09:00:02,024 - experiment_agents.participant_agent - INFO - ✅ Agent_2: Temperature 0.2088977231433743 active (method: successful_creation)
2025-10-14 09:00:02,024 - experiment_agents.participant_agent - INFO - ✅ Successfully initialized agent Agent_2
2025-10-14 09:00:02,024 - experiment_agents.participant_agent - INFO - Creating agent: Agent_3 (model: deepseek/deepseek-v3.2-exp, temp: 0.2088977231433743)
2025-10-14 09:00:02,024 - experiment_agents.participant_agent - INFO - Creating agent Agent_3 with dynamic temperature detection
2025-10-14 09:00:03,311 - httpx - INFO - HTTP Request: POST https://openrouter.ai/api/v1/chat/completions "HTTP/1.1 200 OK"
2025-10-14 09:00:03,462 - experiment_agents.participant_agent - INFO - ✅ Agent_3: Temperature 0.2088977231433743 active (method: successful_creation)
2025-10-14 09:00:03,462 - experiment_agents.participant_agent - INFO - ✅ Successfully initialized agent Agent_3
2025-10-14 09:00:03,462 - experiment_agents.participant_agent - INFO - ✅ Successfully created 3 participant agents
2025-10-14 09:00:03,462 - experiment_agents.utility_agent - INFO - Creating utility agents with model: gemini-2.0-flash-lite (tracing disabled)
2025-10-14 09:00:03,482 - utils.gemini_client - INFO - Successfully initialized Gemini client with OpenAI-compatible endpoint
2025-10-14 09:00:03,948 - httpx - INFO - HTTP Request: POST https://generativelanguage.googleapis.com/v1beta/openai/chat/completions "HTTP/1.1 200 OK"
2025-10-14 09:00:03,949 - utils.dynamic_model_capabilities - INFO - ✅ gemini-2.0-flash-lite supports temperature (discovered during creation)
2025-10-14 09:00:04,348 - httpx - INFO - HTTP Request: POST https://generativelanguage.googleapis.com/v1beta/openai/chat/completions "HTTP/1.1 200 OK"
2025-10-14 09:00:04,350 - experiment_agents.utility_agent - INFO - ✅ Utility agents initialized successfully
2025-10-14 09:00:04,350 - core.experiment_manager - INFO - ✅ Experiment manager initialized with 3 participants
  ✅ Agent_1 (qwen3-next-80b-a3b-thinking) [0.0s]
  ✅ Agent_2 (deepseek-v3.2-exp) [0.0s]
  ✅ Agent_3 (deepseek-v3.2-exp) [0.0s]

✨ All agents ready in 5.1s

2025-10-14 09:00:04,350 - utils.seed_manager - INFO - Generated seed 494069720 from configuration hash
2025-10-14 09:00:04,350 - utils.seed_manager - INFO - Experiment random seed set to: 494069720
[TECH] Experiment seed: 494069720 (generated)
[TECH] Tracing experiment: Frohlich Experiment - 867ab4c3-34ad-4dc3-bb45-372c7ab0fb07
[TECH] Trace ID: trace_7b9c23a62a9d44b2844bd2f4f09ce951
📖 PHASE 1: Individual Familiarization
━━━━━━━━━━━━━━━━━━━━━━━━━━━━━━━━━━━━━━━━━━━━━━━━━━
Running parallel familiarization for 3 participants...

[TECH] Phase 1 executing with language: English
  Agent_1: Initial ranking [██░░░░░░░░░░░░░░░░░░] 10.0%
  Agent_2: Initial ranking [██░░░░░░░░░░░░░░░░░░] 10.0%
  Agent_3: Initial ranking [██░░░░░░░░░░░░░░░░░░] 10.0%
2025-10-14 09:00:05,109 - httpx - INFO - HTTP Request: POST https://openrouter.ai/api/v1/chat/completions "HTTP/1.1 200 OK"
2025-10-14 09:00:05,152 - httpx - INFO - HTTP Request: POST https://openrouter.ai/api/v1/chat/completions "HTTP/1.1 200 OK"
2025-10-14 09:00:05,238 - httpx - INFO - HTTP Request: POST https://openrouter.ai/api/v1/chat/completions "HTTP/1.1 200 OK"
2025-10-14 09:00:06,816 - httpx - INFO - HTTP Request: POST https://generativelanguage.googleapis.com/v1beta/openai/chat/completions "HTTP/1.1 200 OK"
2025-10-14 09:00:06,854 - httpx - INFO - HTTP Request: POST https://generativelanguage.googleapis.com/v1beta/openai/chat/completions "HTTP/1.1 200 OK"
2025-10-14 09:00:07,649 - httpx - INFO - HTTP Request: POST https://openrouter.ai/api/v1/chat/completions "HTTP/1.1 200 OK"
2025-10-14 09:00:07,933 - httpx - INFO - HTTP Request: POST https://openrouter.ai/api/v1/chat/completions "HTTP/1.1 200 OK"
2025-10-14 09:00:09,796 - httpx - INFO - HTTP Request: POST https://api.openai.com/v1/traces/ingest "HTTP/1.1 204 No Content"
  Agent_2: Learning principles [█████░░░░░░░░░░░░░░░] 25.0%
2025-10-14 09:00:15,232 - httpx - INFO - HTTP Request: POST https://api.openai.com/v1/traces/ingest "HTTP/1.1 204 No Content"
2025-10-14 09:00:15,376 - httpx - INFO - HTTP Request: POST https://openrouter.ai/api/v1/chat/completions "HTTP/1.1 200 OK"
  Agent_3: Learning principles [█████░░░░░░░░░░░░░░░] 25.0%
2025-10-14 09:00:16,549 - httpx - INFO - HTTP Request: POST https://openrouter.ai/api/v1/chat/completions "HTTP/1.1 200 OK"
2025-10-14 09:00:20,796 - httpx - INFO - HTTP Request: POST https://api.openai.com/v1/traces/ingest "HTTP/1.1 204 No Content"
2025-10-14 09:00:20,826 - httpx - INFO - HTTP Request: POST https://generativelanguage.googleapis.com/v1beta/openai/chat/completions "HTTP/1.1 200 OK"
2025-10-14 09:00:21,728 - httpx - INFO - HTTP Request: POST https://openrouter.ai/api/v1/chat/completions "HTTP/1.1 200 OK"
2025-10-14 09:00:23,183 - httpx - INFO - HTTP Request: POST https://openrouter.ai/api/v1/chat/completions "HTTP/1.1 200 OK"
2025-10-14 09:00:25,828 - httpx - INFO - HTTP Request: POST https://openrouter.ai/api/v1/chat/completions "HTTP/1.1 200 OK"
  Agent_1: Learning principles [█████░░░░░░░░░░░░░░░] 25.0%
2025-10-14 09:00:26,452 - httpx - INFO - HTTP Request: POST https://api.openai.com/v1/traces/ingest "HTTP/1.1 204 No Content"
2025-10-14 09:00:26,724 - httpx - INFO - HTTP Request: POST https://openrouter.ai/api/v1/chat/completions "HTTP/1.1 200 OK"
  Agent_2: Post-explanation ranking [████████░░░░░░░░░░░░] 40.0%
2025-10-14 09:00:40,135 - httpx - INFO - HTTP Request: POST https://openrouter.ai/api/v1/chat/completions "HTTP/1.1 200 OK"
2025-10-14 09:00:41,018 - httpx - INFO - HTTP Request: POST https://openrouter.ai/api/v1/chat/completions "HTTP/1.1 200 OK"
2025-10-14 09:00:42,242 - httpx - INFO - HTTP Request: POST https://api.openai.com/v1/traces/ingest "HTTP/1.1 204 No Content"
  Agent_3: Post-explanation ranking [████████░░░░░░░░░░░░] 40.0%
2025-10-14 09:00:43,424 - httpx - INFO - HTTP Request: POST https://openrouter.ai/api/v1/chat/completions "HTTP/1.1 200 OK"
2025-10-14 09:00:43,606 - httpx - INFO - HTTP Request: POST https://generativelanguage.googleapis.com/v1beta/openai/chat/completions "HTTP/1.1 200 OK"
2025-10-14 09:00:44,258 - httpx - INFO - HTTP Request: POST https://openrouter.ai/api/v1/chat/completions "HTTP/1.1 200 OK"
2025-10-14 09:00:45,872 - httpx - INFO - HTTP Request: POST https://generativelanguage.googleapis.com/v1beta/openai/chat/completions "HTTP/1.1 200 OK"
2025-10-14 09:00:46,954 - httpx - INFO - HTTP Request: POST https://openrouter.ai/api/v1/chat/completions "HTTP/1.1 200 OK"
2025-10-14 09:00:47,800 - httpx - INFO - HTTP Request: POST https://api.openai.com/v1/traces/ingest "HTTP/1.1 204 No Content"
  Agent_1: Post-explanation ranking [████████░░░░░░░░░░░░] 40.0%
2025-10-14 09:00:54,111 - httpx - INFO - HTTP Request: POST https://openrouter.ai/api/v1/chat/completions "HTTP/1.1 200 OK"
2025-10-14 09:00:58,473 - httpx - INFO - HTTP Request: POST https://api.openai.com/v1/traces/ingest "HTTP/1.1 204 No Content"
  Agent_2: Application round 1 [██████████░░░░░░░░░░] 50.0%
  Agent_3: Application round 1 [██████████░░░░░░░░░░] 50.0%
2025-10-14 09:01:02,208 - httpx - INFO - HTTP Request: POST https://openrouter.ai/api/v1/chat/completions "HTTP/1.1 200 OK"
2025-10-14 09:01:02,671 - httpx - INFO - HTTP Request: POST https://openrouter.ai/api/v1/chat/completions "HTTP/1.1 200 OK"
2025-10-14 09:01:03,305 - httpx - INFO - HTTP Request: POST https://generativelanguage.googleapis.com/v1beta/openai/chat/completions "HTTP/1.1 200 OK"
2025-10-14 09:01:04,007 - httpx - INFO - HTTP Request: POST https://openrouter.ai/api/v1/chat/completions "HTTP/1.1 200 OK"
2025-10-14 09:01:04,035 - httpx - INFO - HTTP Request: POST https://generativelanguage.googleapis.com/v1beta/openai/chat/completions "HTTP/1.1 200 OK"
2025-10-14 09:01:04,059 - httpx - INFO - HTTP Request: POST https://api.openai.com/v1/traces/ingest "HTTP/1.1 204 No Content"
2025-10-14 09:01:04,943 - httpx - INFO - HTTP Request: POST https://openrouter.ai/api/v1/chat/completions "HTTP/1.1 200 OK"
2025-10-14 09:01:21,737 - httpx - INFO - HTTP Request: POST https://generativelanguage.googleapis.com/v1beta/openai/chat/completions "HTTP/1.1 200 OK"
  Agent_3: Application round 2 [████████████░░░░░░░░] 60.0%
  Agent_2: Application round 2 [████████████░░░░░░░░] 60.0%
2025-10-14 09:01:22,637 - httpx - INFO - HTTP Request: POST https://openrouter.ai/api/v1/chat/completions "HTTP/1.1 200 OK"
2025-10-14 09:01:22,886 - httpx - INFO - HTTP Request: POST https://openrouter.ai/api/v1/chat/completions "HTTP/1.1 200 OK"
2025-10-14 09:01:23,048 - httpx - INFO - HTTP Request: POST https://openrouter.ai/api/v1/chat/completions "HTTP/1.1 200 OK"
2025-10-14 09:01:24,331 - httpx - INFO - HTTP Request: POST https://generativelanguage.googleapis.com/v1beta/openai/chat/completions "HTTP/1.1 200 OK"
2025-10-14 09:01:24,548 - httpx - INFO - HTTP Request: POST https://generativelanguage.googleapis.com/v1beta/openai/chat/completions "HTTP/1.1 200 OK"
2025-10-14 09:01:25,100 - httpx - INFO - HTTP Request: POST https://openrouter.ai/api/v1/chat/completions "HTTP/1.1 200 OK"
2025-10-14 09:01:25,142 - httpx - INFO - HTTP Request: POST https://api.openai.com/v1/traces/ingest "HTTP/1.1 204 No Content"
2025-10-14 09:01:25,567 - httpx - INFO - HTTP Request: POST https://openrouter.ai/api/v1/chat/completions "HTTP/1.1 200 OK"
  Agent_1: Application round 1 [██████████░░░░░░░░░░] 50.0%
2025-10-14 09:01:32,414 - httpx - INFO - HTTP Request: POST https://openrouter.ai/api/v1/chat/completions "HTTP/1.1 200 OK"
2025-10-14 09:01:35,751 - httpx - INFO - HTTP Request: POST https://api.openai.com/v1/traces/ingest "HTTP/1.1 204 No Content"
2025-10-14 09:01:49,606 - httpx - INFO - HTTP Request: POST https://generativelanguage.googleapis.com/v1beta/openai/chat/completions "HTTP/1.1 200 OK"
2025-10-14 09:01:50,438 - httpx - INFO - HTTP Request: POST https://openrouter.ai/api/v1/chat/completions "HTTP/1.1 200 OK"
  Agent_3: Application round 3 [██████████████░░░░░░] 70.0%
2025-10-14 09:01:51,521 - httpx - INFO - HTTP Request: POST https://api.openai.com/v1/traces/ingest "HTTP/1.1 204 No Content"
2025-10-14 09:01:51,589 - httpx - INFO - HTTP Request: POST https://openrouter.ai/api/v1/chat/completions "HTTP/1.1 200 OK"
2025-10-14 09:01:53,711 - httpx - INFO - HTTP Request: POST https://generativelanguage.googleapis.com/v1beta/openai/chat/completions "HTTP/1.1 200 OK"
2025-10-14 09:01:54,445 - httpx - INFO - HTTP Request: POST https://openrouter.ai/api/v1/chat/completions "HTTP/1.1 200 OK"
  Agent_2: Application round 3 [██████████████░░░░░░] 70.0%
2025-10-14 09:01:55,778 - httpx - INFO - HTTP Request: POST https://openrouter.ai/api/v1/chat/completions "HTTP/1.1 200 OK"
2025-10-14 09:01:56,855 - httpx - INFO - HTTP Request: POST https://generativelanguage.googleapis.com/v1beta/openai/chat/completions "HTTP/1.1 200 OK"
2025-10-14 09:01:57,211 - httpx - INFO - HTTP Request: POST https://api.openai.com/v1/traces/ingest "HTTP/1.1 204 No Content"
2025-10-14 09:01:57,775 - httpx - INFO - HTTP Request: POST https://openrouter.ai/api/v1/chat/completions "HTTP/1.1 200 OK"
  Agent_1: Application round 2 [████████████░░░░░░░░] 60.0%
2025-10-14 09:02:17,769 - httpx - INFO - HTTP Request: POST https://openrouter.ai/api/v1/chat/completions "HTTP/1.1 200 OK"
2025-10-14 09:02:18,163 - httpx - INFO - HTTP Request: POST https://api.openai.com/v1/traces/ingest "HTTP/1.1 204 No Content"
  Agent_2: Application round 4 [████████████████░░░░] 80.0%
  Agent_3: Application round 4 [████████████████░░░░] 80.0%
2025-10-14 09:02:32,662 - httpx - INFO - HTTP Request: POST https://openrouter.ai/api/v1/chat/completions "HTTP/1.1 200 OK"
2025-10-14 09:02:33,388 - httpx - INFO - HTTP Request: POST https://openrouter.ai/api/v1/chat/completions "HTTP/1.1 200 OK"
2025-10-14 09:02:33,934 - httpx - INFO - HTTP Request: POST https://api.openai.com/v1/traces/ingest "HTTP/1.1 204 No Content"
2025-10-14 09:02:34,250 - httpx - INFO - HTTP Request: POST https://api.openai.com/v1/traces/ingest "HTTP/1.1 204 No Content"
2025-10-14 09:02:34,510 - httpx - INFO - HTTP Request: POST https://generativelanguage.googleapis.com/v1beta/openai/chat/completions "HTTP/1.1 200 OK"
2025-10-14 09:02:34,566 - httpx - INFO - HTTP Request: POST https://generativelanguage.googleapis.com/v1beta/openai/chat/completions "HTTP/1.1 200 OK"
2025-10-14 09:02:34,879 - httpx - INFO - HTTP Request: POST https://api.openai.com/v1/traces/ingest "HTTP/1.1 204 No Content"
2025-10-14 09:02:35,219 - httpx - INFO - HTTP Request: POST https://openrouter.ai/api/v1/chat/completions "HTTP/1.1 200 OK"
2025-10-14 09:02:35,241 - httpx - INFO - HTTP Request: POST https://openrouter.ai/api/v1/chat/completions "HTTP/1.1 200 OK"
2025-10-14 09:02:35,954 - httpx - INFO - HTTP Request: POST https://generativelanguage.googleapis.com/v1beta/openai/chat/completions "HTTP/1.1 200 OK"
2025-10-14 09:02:37,266 - httpx - INFO - HTTP Request: POST https://openrouter.ai/api/v1/chat/completions "HTTP/1.1 200 OK"
2025-10-14 09:02:40,432 - httpx - INFO - HTTP Request: POST https://api.openai.com/v1/traces/ingest "HTTP/1.1 204 No Content"
  Agent_1: Application round 3 [██████████████░░░░░░] 70.0%
2025-10-14 09:03:00,959 - httpx - INFO - HTTP Request: POST https://openrouter.ai/api/v1/chat/completions "HTTP/1.1 200 OK"
2025-10-14 09:03:01,310 - httpx - INFO - HTTP Request: POST https://api.openai.com/v1/traces/ingest "HTTP/1.1 204 No Content"
  Agent_3: Final ranking [██████████████████░░] 90.0%
2025-10-14 09:03:16,864 - httpx - INFO - HTTP Request: POST https://generativelanguage.googleapis.com/v1beta/openai/chat/completions "HTTP/1.1 200 OK"
2025-10-14 09:03:17,087 - httpx - INFO - HTTP Request: POST https://api.openai.com/v1/traces/ingest "HTTP/1.1 204 No Content"
2025-10-14 09:03:17,519 - httpx - INFO - HTTP Request: POST https://openrouter.ai/api/v1/chat/completions "HTTP/1.1 200 OK"
2025-10-14 09:03:17,755 - httpx - INFO - HTTP Request: POST https://openrouter.ai/api/v1/chat/completions "HTTP/1.1 200 OK"
2025-10-14 09:03:24,142 - httpx - INFO - HTTP Request: POST https://generativelanguage.googleapis.com/v1beta/openai/chat/completions "HTTP/1.1 200 OK"
2025-10-14 09:03:24,890 - httpx - INFO - HTTP Request: POST https://openrouter.ai/api/v1/chat/completions "HTTP/1.1 200 OK"
2025-10-14 09:03:27,696 - httpx - INFO - HTTP Request: POST https://api.openai.com/v1/traces/ingest "HTTP/1.1 204 No Content"
  Agent_2: Final ranking [██████████████████░░] 90.0%
2025-10-14 09:03:29,049 - httpx - INFO - HTTP Request: POST https://openrouter.ai/api/v1/chat/completions "HTTP/1.1 200 OK"
2025-10-14 09:03:33,183 - httpx - INFO - HTTP Request: POST https://api.openai.com/v1/traces/ingest "HTTP/1.1 204 No Content"
2025-10-14 09:03:34,644 - httpx - INFO - HTTP Request: POST https://generativelanguage.googleapis.com/v1beta/openai/chat/completions "HTTP/1.1 200 OK"
2025-10-14 09:03:36,072 - httpx - INFO - HTTP Request: POST https://openrouter.ai/api/v1/chat/completions "HTTP/1.1 200 OK"
  Agent_1: Application round 4 [████████████████░░░░] 80.0%
2025-10-14 09:03:37,784 - httpx - INFO - HTTP Request: POST https://openrouter.ai/api/v1/chat/completions "HTTP/1.1 200 OK"
2025-10-14 09:03:38,800 - httpx - INFO - HTTP Request: POST https://api.openai.com/v1/traces/ingest "HTTP/1.1 204 No Content"
2025-10-14 09:03:57,291 - httpx - INFO - HTTP Request: POST https://generativelanguage.googleapis.com/v1beta/openai/chat/completions "HTTP/1.1 200 OK"
2025-10-14 09:03:57,941 - httpx - INFO - HTTP Request: POST https://openrouter.ai/api/v1/chat/completions "HTTP/1.1 200 OK"
2025-10-14 09:03:59,778 - httpx - INFO - HTTP Request: POST https://api.openai.com/v1/traces/ingest "HTTP/1.1 204 No Content"
  Agent_1: Final ranking [██████████████████░░] 90.0%
2025-10-14 09:04:09,080 - httpx - INFO - HTTP Request: POST https://openrouter.ai/api/v1/chat/completions "HTTP/1.1 200 OK"
2025-10-14 09:04:10,466 - httpx - INFO - HTTP Request: POST https://api.openai.com/v1/traces/ingest "HTTP/1.1 204 No Content"
  Agent_3: Completed [████████████████████] 100.0%
2025-10-14 09:04:15,986 - httpx - INFO - HTTP Request: POST https://api.openai.com/v1/traces/ingest "HTTP/1.1 204 No Content"
  Agent_2: Completed [████████████████████] 100.0%
2025-10-14 09:04:21,502 - httpx - INFO - HTTP Request: POST https://api.openai.com/v1/traces/ingest "HTTP/1.1 204 No Content"
2025-10-14 09:04:25,424 - httpx - INFO - HTTP Request: POST https://generativelanguage.googleapis.com/v1beta/openai/chat/completions "HTTP/1.1 200 OK"
2025-10-14 09:04:25,904 - httpx - INFO - HTTP Request: POST https://openrouter.ai/api/v1/chat/completions "HTTP/1.1 200 OK"
2025-10-14 09:04:27,127 - httpx - INFO - HTTP Request: POST https://api.openai.com/v1/traces/ingest "HTTP/1.1 204 No Content"
  Agent_1: Completed [████████████████████] 100.0%

🎯 Phase 1 Complete - Duration: 4m 28s
  Agent_1: $6.80 earned
  Agent_2: $6.80 earned
  Agent_3: $7.70 earned

💬 PHASE 2: Group Discussion
━━━━━━━━━━━━━━━━━━━━━━━━━━━━━━━━━━━━━━━━━━━━━━━━━━
Beginning group discussion (max 10 rounds)...

🗣️  Round 1 (1/10)
   Speaking order: Agent_1 → Agent_2 → Agent_3
   💭 Agent_1 is thinking...
2025-10-14 09:04:33,647 - httpx - INFO - HTTP Request: POST https://openrouter.ai/api/v1/chat/completions "HTTP/1.1 200 OK"
2025-10-14 09:04:37,731 - httpx - INFO - HTTP Request: POST https://api.openai.com/v1/traces/ingest "HTTP/1.1 204 No Content"
2025-10-14 09:04:50,068 - httpx - INFO - HTTP Request: POST https://openrouter.ai/api/v1/chat/completions "HTTP/1.1 200 OK"
   ✅ Agent_1 responded (590 chars) [19.5s]
2025-10-14 09:04:53,252 - httpx - INFO - HTTP Request: POST https://generativelanguage.googleapis.com/v1beta/openai/chat/completions "HTTP/1.1 200 OK"
   💭 Agent_2 is thinking...
2025-10-14 09:04:53,493 - httpx - INFO - HTTP Request: POST https://api.openai.com/v1/traces/ingest "HTTP/1.1 204 No Content"
2025-10-14 09:04:54,077 - httpx - INFO - HTTP Request: POST https://openrouter.ai/api/v1/chat/completions "HTTP/1.1 200 OK"
2025-10-14 09:05:20,606 - httpx - INFO - HTTP Request: POST https://openrouter.ai/api/v1/chat/completions "HTTP/1.1 200 OK"
   ✅ Agent_2 responded (421 chars) [29.1s]
2025-10-14 09:05:23,237 - httpx - INFO - HTTP Request: POST https://generativelanguage.googleapis.com/v1beta/openai/chat/completions "HTTP/1.1 200 OK"
   💭 Agent_3 is thinking...
2025-10-14 09:05:24,450 - httpx - INFO - HTTP Request: POST https://api.openai.com/v1/traces/ingest "HTTP/1.1 204 No Content"
2025-10-14 09:05:25,383 - httpx - INFO - HTTP Request: POST https://openrouter.ai/api/v1/chat/completions "HTTP/1.1 200 OK"
2025-10-14 09:05:46,327 - httpx - INFO - HTTP Request: POST https://openrouter.ai/api/v1/chat/completions "HTTP/1.1 200 OK"
   ✅ Agent_3 responded (746 chars) [26.4s]
2025-10-14 09:05:50,404 - httpx - INFO - HTTP Request: POST https://api.openai.com/v1/traces/ingest "HTTP/1.1 204 No Content"
2025-10-14 09:05:50,404 - httpx - INFO - HTTP Request: POST https://generativelanguage.googleapis.com/v1beta/openai/chat/completions "HTTP/1.1 200 OK"
2025-10-14 09:05:51,005 - httpx - INFO - HTTP Request: POST https://openrouter.ai/api/v1/chat/completions "HTTP/1.1 200 OK"
2025-10-14 09:06:09,942 - httpx - INFO - HTTP Request: POST https://openrouter.ai/api/v1/chat/completions "HTTP/1.1 200 OK"
2025-10-14 09:06:11,287 - httpx - INFO - HTTP Request: POST https://api.openai.com/v1/traces/ingest "HTTP/1.1 204 No Content"
2025-10-14 09:07:30,031 - httpx - INFO - HTTP Request: POST https://openrouter.ai/api/v1/chat/completions "HTTP/1.1 200 OK"
2025-10-14 09:07:33,218 - httpx - INFO - HTTP Request: POST https://api.openai.com/v1/traces/ingest "HTTP/1.1 204 No Content"
2025-10-14 09:07:45,511 - httpx - INFO - HTTP Request: POST https://openrouter.ai/api/v1/chat/completions "HTTP/1.1 200 OK"
2025-10-14 09:07:48,910 - httpx - INFO - HTTP Request: POST https://api.openai.com/v1/traces/ingest "HTTP/1.1 204 No Content"
🗳️  Voting initiated (Round 1)
2025-10-14 09:07:51,293 - httpx - INFO - HTTP Request: POST https://openrouter.ai/api/v1/chat/completions "HTTP/1.1 200 OK"
2025-10-14 09:07:52,299 - httpx - INFO - HTTP Request: POST https://openrouter.ai/api/v1/chat/completions "HTTP/1.1 200 OK"
⏳ No consensus yet - continuing discussion...

   ✅ Round 1 complete - 3m 19s

🗣️  Round 2 (2/10)
   Speaking order: Agent_2 → Agent_3 → Agent_1
   💭 Agent_2 is thinking...
2025-10-14 09:07:53,021 - httpx - INFO - HTTP Request: POST https://openrouter.ai/api/v1/chat/completions "HTTP/1.1 200 OK"
2025-10-14 09:07:54,521 - httpx - INFO - HTTP Request: POST https://api.openai.com/v1/traces/ingest "HTTP/1.1 204 No Content"
2025-10-14 09:08:26,486 - httpx - INFO - HTTP Request: POST https://openrouter.ai/api/v1/chat/completions "HTTP/1.1 200 OK"
2025-10-14 09:08:30,614 - httpx - INFO - HTTP Request: POST https://api.openai.com/v1/traces/ingest "HTTP/1.1 204 No Content"
   ✅ Agent_2 responded (1304 chars) [40.9s]
2025-10-14 09:08:33,888 - httpx - INFO - HTTP Request: POST https://generativelanguage.googleapis.com/v1beta/openai/chat/completions "HTTP/1.1 200 OK"
   💭 Agent_3 is thinking...
2025-10-14 09:08:34,655 - httpx - INFO - HTTP Request: POST https://openrouter.ai/api/v1/chat/completions "HTTP/1.1 200 OK"
2025-10-14 09:08:36,139 - httpx - INFO - HTTP Request: POST https://api.openai.com/v1/traces/ingest "HTTP/1.1 204 No Content"
2025-10-14 09:09:03,144 - httpx - INFO - HTTP Request: POST https://openrouter.ai/api/v1/chat/completions "HTTP/1.1 200 OK"
2025-10-14 09:09:07,083 - httpx - INFO - HTTP Request: POST https://api.openai.com/v1/traces/ingest "HTTP/1.1 204 No Content"
   ✅ Agent_3 responded (1401 chars) [33.9s]
2025-10-14 09:09:08,379 - httpx - INFO - HTTP Request: POST https://generativelanguage.googleapis.com/v1beta/openai/chat/completions "HTTP/1.1 200 OK"
   💭 Agent_1 is thinking...
2025-10-14 09:09:08,849 - httpx - INFO - HTTP Request: POST https://openrouter.ai/api/v1/chat/completions "HTTP/1.1 200 OK"
2025-10-14 09:09:12,577 - httpx - INFO - HTTP Request: POST https://api.openai.com/v1/traces/ingest "HTTP/1.1 204 No Content"
2025-10-14 09:09:28,333 - httpx - INFO - HTTP Request: POST https://api.openai.com/v1/traces/ingest "HTTP/1.1 204 No Content"
2025-10-14 09:09:28,333 - httpx - INFO - HTTP Request: POST https://openrouter.ai/api/v1/chat/completions "HTTP/1.1 200 OK"
   ✅ Agent_1 responded (1594 chars) [30.0s]
2025-10-14 09:09:38,966 - httpx - INFO - HTTP Request: POST https://api.openai.com/v1/traces/ingest "HTTP/1.1 204 No Content"
2025-10-14 09:09:39,137 - httpx - INFO - HTTP Request: POST https://generativelanguage.googleapis.com/v1beta/openai/chat/completions "HTTP/1.1 200 OK"
2025-10-14 09:09:39,747 - httpx - INFO - HTTP Request: POST https://openrouter.ai/api/v1/chat/completions "HTTP/1.1 200 OK"
2025-10-14 09:09:55,593 - httpx - INFO - HTTP Request: POST https://openrouter.ai/api/v1/chat/completions "HTTP/1.1 200 OK"
2025-10-14 09:09:59,858 - httpx - INFO - HTTP Request: POST https://api.openai.com/v1/traces/ingest "HTTP/1.1 204 No Content"
2025-10-14 09:11:05,860 - httpx - INFO - HTTP Request: POST https://openrouter.ai/api/v1/chat/completions "HTTP/1.1 200 OK"
2025-10-14 09:11:06,634 - httpx - INFO - HTTP Request: POST https://api.openai.com/v1/traces/ingest "HTTP/1.1 204 No Content"
2025-10-14 09:11:23,262 - httpx - INFO - HTTP Request: POST https://openrouter.ai/api/v1/chat/completions "HTTP/1.1 200 OK"
2025-10-14 09:11:27,344 - httpx - INFO - HTTP Request: POST https://api.openai.com/v1/traces/ingest "HTTP/1.1 204 No Content"
🗳️  Voting initiated (Round 2)
2025-10-14 09:11:28,974 - httpx - INFO - HTTP Request: POST https://openrouter.ai/api/v1/chat/completions "HTTP/1.1 200 OK"
2025-10-14 09:11:29,880 - httpx - INFO - HTTP Request: POST https://openrouter.ai/api/v1/chat/completions "HTTP/1.1 200 OK"
⏳ No consensus yet - continuing discussion...

   ✅ Round 2 complete - 3m 37s

🗣️  Round 3 (3/10)
   Speaking order: Agent_2 → Agent_3 → Agent_1
   💭 Agent_2 is thinking...
2025-10-14 09:11:31,423 - httpx - INFO - HTTP Request: POST https://openrouter.ai/api/v1/chat/completions "HTTP/1.1 200 OK"
2025-10-14 09:11:32,957 - httpx - INFO - HTTP Request: POST https://api.openai.com/v1/traces/ingest "HTTP/1.1 204 No Content"
2025-10-14 09:12:04,508 - httpx - INFO - HTTP Request: POST https://openrouter.ai/api/v1/chat/completions "HTTP/1.1 200 OK"
2025-10-14 09:12:09,074 - httpx - INFO - HTTP Request: POST https://api.openai.com/v1/traces/ingest "HTTP/1.1 204 No Content"
   ✅ Agent_2 responded (1796 chars) [43.4s]
2025-10-14 09:12:14,085 - httpx - INFO - HTTP Request: POST https://generativelanguage.googleapis.com/v1beta/openai/chat/completions "HTTP/1.1 200 OK"
   💭 Agent_3 is thinking...
2025-10-14 09:12:14,573 - httpx - INFO - HTTP Request: POST https://api.openai.com/v1/traces/ingest "HTTP/1.1 204 No Content"
2025-10-14 09:12:15,028 - httpx - INFO - HTTP Request: POST https://openrouter.ai/api/v1/chat/completions "HTTP/1.1 200 OK"
2025-10-14 09:12:54,953 - httpx - INFO - HTTP Request: POST https://openrouter.ai/api/v1/chat/completions "HTTP/1.1 200 OK"
2025-10-14 09:12:55,736 - httpx - INFO - HTTP Request: POST https://api.openai.com/v1/traces/ingest "HTTP/1.1 204 No Content"
   ✅ Agent_3 responded (1973 chars) [50.0s]
2025-10-14 09:13:04,867 - httpx - INFO - HTTP Request: POST https://generativelanguage.googleapis.com/v1beta/openai/chat/completions "HTTP/1.1 200 OK"
   💭 Agent_1 is thinking...
2025-10-14 09:13:05,518 - httpx - INFO - HTTP Request: POST https://openrouter.ai/api/v1/chat/completions "HTTP/1.1 200 OK"
2025-10-14 09:13:06,330 - httpx - INFO - HTTP Request: POST https://api.openai.com/v1/traces/ingest "HTTP/1.1 204 No Content"
2025-10-14 09:13:19,314 - httpx - INFO - HTTP Request: POST https://openrouter.ai/api/v1/chat/completions "HTTP/1.1 200 OK"
2025-10-14 09:13:22,149 - httpx - INFO - HTTP Request: POST https://api.openai.com/v1/traces/ingest "HTTP/1.1 204 No Content"
   ✅ Agent_1 responded (1522 chars) [31.5s]
2025-10-14 09:13:37,303 - httpx - INFO - HTTP Request: POST https://generativelanguage.googleapis.com/v1beta/openai/chat/completions "HTTP/1.1 200 OK"
2025-10-14 09:13:37,889 - httpx - INFO - HTTP Request: POST https://api.openai.com/v1/traces/ingest "HTTP/1.1 204 No Content"
2025-10-14 09:13:37,951 - httpx - INFO - HTTP Request: POST https://openrouter.ai/api/v1/chat/completions "HTTP/1.1 200 OK"
2025-10-14 09:13:56,553 - httpx - INFO - HTTP Request: POST https://openrouter.ai/api/v1/chat/completions "HTTP/1.1 200 OK"
2025-10-14 09:13:58,802 - httpx - INFO - HTTP Request: POST https://api.openai.com/v1/traces/ingest "HTTP/1.1 204 No Content"
2025-10-14 09:15:48,456 - httpx - INFO - HTTP Request: POST https://openrouter.ai/api/v1/chat/completions "HTTP/1.1 200 OK"
2025-10-14 09:15:51,278 - httpx - INFO - HTTP Request: POST https://api.openai.com/v1/traces/ingest "HTTP/1.1 204 No Content"
2025-10-14 09:16:33,351 - httpx - INFO - HTTP Request: POST https://openrouter.ai/api/v1/chat/completions "HTTP/1.1 200 OK"
🗳️  Voting initiated (Round 3)
2025-10-14 09:16:37,598 - httpx - INFO - HTTP Request: POST https://openrouter.ai/api/v1/chat/completions "HTTP/1.1 200 OK"
2025-10-14 09:16:37,743 - httpx - INFO - HTTP Request: POST https://api.openai.com/v1/traces/ingest "HTTP/1.1 204 No Content"
2025-10-14 09:16:38,887 - httpx - INFO - HTTP Request: POST https://openrouter.ai/api/v1/chat/completions "HTTP/1.1 200 OK"
⏳ No consensus yet - continuing discussion...

   ✅ Round 3 complete - 5m 9s

🗣️  Round 4 (4/10)
   Speaking order: Agent_3 → Agent_2 → Agent_1
   💭 Agent_3 is thinking...
2025-10-14 09:16:40,436 - httpx - INFO - HTTP Request: POST https://openrouter.ai/api/v1/chat/completions "HTTP/1.1 200 OK"
2025-10-14 09:16:43,370 - httpx - INFO - HTTP Request: POST https://api.openai.com/v1/traces/ingest "HTTP/1.1 204 No Content"
2025-10-14 09:17:45,073 - httpx - INFO - HTTP Request: POST https://api.openai.com/v1/traces/ingest "HTTP/1.1 204 No Content"
2025-10-14 09:17:45,408 - httpx - INFO - HTTP Request: POST https://openrouter.ai/api/v1/chat/completions "HTTP/1.1 200 OK"
   ✅ Agent_3 responded (2234 chars) [1m 30s]
2025-10-14 09:18:10,051 - httpx - INFO - HTTP Request: POST https://generativelanguage.googleapis.com/v1beta/openai/chat/completions "HTTP/1.1 200 OK"
   💭 Agent_2 is thinking...
2025-10-14 09:18:10,982 - httpx - INFO - HTTP Request: POST https://api.openai.com/v1/traces/ingest "HTTP/1.1 204 No Content"
2025-10-14 09:18:11,273 - httpx - INFO - HTTP Request: POST https://openrouter.ai/api/v1/chat/completions "HTTP/1.1 200 OK"
2025-10-14 09:19:12,706 - httpx - INFO - HTTP Request: POST https://api.openai.com/v1/traces/ingest "HTTP/1.1 204 No Content"
2025-10-14 09:19:12,974 - httpx - INFO - HTTP Request: POST https://openrouter.ai/api/v1/chat/completions "HTTP/1.1 200 OK"
   ✅ Agent_2 responded (2080 chars) [1m 11s]
2025-10-14 09:19:22,842 - httpx - INFO - HTTP Request: POST https://generativelanguage.googleapis.com/v1beta/openai/chat/completions "HTTP/1.1 200 OK"
   💭 Agent_1 is thinking...
2025-10-14 09:19:23,354 - httpx - INFO - HTTP Request: POST https://api.openai.com/v1/traces/ingest "HTTP/1.1 204 No Content"
2025-10-14 09:19:23,530 - httpx - INFO - HTTP Request: POST https://openrouter.ai/api/v1/chat/completions "HTTP/1.1 200 OK"
2025-10-14 09:19:34,745 - httpx - INFO - HTTP Request: POST https://openrouter.ai/api/v1/chat/completions "HTTP/1.1 200 OK"
2025-10-14 09:19:39,096 - httpx - INFO - HTTP Request: POST https://api.openai.com/v1/traces/ingest "HTTP/1.1 204 No Content"
   ✅ Agent_1 responded (2100 chars) [22.0s]
2025-10-14 09:19:45,577 - httpx - INFO - HTTP Request: POST https://generativelanguage.googleapis.com/v1beta/openai/chat/completions "HTTP/1.1 200 OK"
2025-10-14 09:19:46,357 - httpx - INFO - HTTP Request: POST https://openrouter.ai/api/v1/chat/completions "HTTP/1.1 200 OK"
2025-10-14 09:19:49,745 - httpx - INFO - HTTP Request: POST https://api.openai.com/v1/traces/ingest "HTTP/1.1 204 No Content"
2025-10-14 09:20:02,075 - httpx - INFO - HTTP Request: POST https://openrouter.ai/api/v1/chat/completions "HTTP/1.1 200 OK"
2025-10-14 09:20:05,498 - httpx - INFO - HTTP Request: POST https://api.openai.com/v1/traces/ingest "HTTP/1.1 204 No Content"
2025-10-14 09:21:52,815 - httpx - INFO - HTTP Request: POST https://api.openai.com/v1/traces/ingest "HTTP/1.1 204 No Content"
2025-10-14 09:21:54,937 - httpx - INFO - HTTP Request: POST https://openrouter.ai/api/v1/chat/completions "HTTP/1.1 200 OK"
2025-10-14 09:22:10,583 - httpx - INFO - HTTP Request: POST https://openrouter.ai/api/v1/chat/completions "HTTP/1.1 200 OK"
2025-10-14 09:22:13,690 - httpx - INFO - HTTP Request: POST https://api.openai.com/v1/traces/ingest "HTTP/1.1 204 No Content"
🗳️  Voting initiated (Round 4)
2025-10-14 09:22:18,309 - httpx - INFO - HTTP Request: POST https://openrouter.ai/api/v1/chat/completions "HTTP/1.1 200 OK"
2025-10-14 09:22:19,299 - httpx - INFO - HTTP Request: POST https://api.openai.com/v1/traces/ingest "HTTP/1.1 204 No Content"
2025-10-14 09:22:19,367 - httpx - INFO - HTTP Request: POST https://openrouter.ai/api/v1/chat/completions "HTTP/1.1 200 OK"
⏳ No consensus yet - continuing discussion...

   ✅ Round 4 complete - 5m 40s

🗣️  Round 5 (5/10)
   Speaking order: Agent_3 → Agent_2 → Agent_1
   💭 Agent_3 is thinking...
2025-10-14 09:22:20,537 - httpx - INFO - HTTP Request: POST https://openrouter.ai/api/v1/chat/completions "HTTP/1.1 200 OK"
2025-10-14 09:22:24,878 - httpx - INFO - HTTP Request: POST https://api.openai.com/v1/traces/ingest "HTTP/1.1 204 No Content"
2025-10-14 09:22:45,639 - httpx - INFO - HTTP Request: POST https://api.openai.com/v1/traces/ingest "HTTP/1.1 204 No Content"
2025-10-14 09:22:46,101 - httpx - INFO - HTTP Request: POST https://openrouter.ai/api/v1/chat/completions "HTTP/1.1 200 OK"
   ✅ Agent_3 responded (1468 chars) [33.8s]
2025-10-14 09:22:54,154 - httpx - INFO - HTTP Request: POST https://generativelanguage.googleapis.com/v1beta/openai/chat/completions "HTTP/1.1 200 OK"
   💭 Agent_2 is thinking...
2025-10-14 09:22:55,262 - httpx - INFO - HTTP Request: POST https://openrouter.ai/api/v1/chat/completions "HTTP/1.1 200 OK"
2025-10-14 09:22:56,193 - httpx - INFO - HTTP Request: POST https://api.openai.com/v1/traces/ingest "HTTP/1.1 204 No Content"
2025-10-14 09:23:29,636 - httpx - INFO - HTTP Request: POST https://openrouter.ai/api/v1/chat/completions "HTTP/1.1 200 OK"
2025-10-14 09:23:32,585 - httpx - INFO - HTTP Request: POST https://api.openai.com/v1/traces/ingest "HTTP/1.1 204 No Content"
   ✅ Agent_2 responded (1688 chars) [41.2s]
2025-10-14 09:23:36,083 - httpx - INFO - HTTP Request: POST https://generativelanguage.googleapis.com/v1beta/openai/chat/completions "HTTP/1.1 200 OK"
   💭 Agent_1 is thinking...
2025-10-14 09:23:37,024 - httpx - INFO - HTTP Request: POST https://openrouter.ai/api/v1/chat/completions "HTTP/1.1 200 OK"
2025-10-14 09:23:38,419 - httpx - INFO - HTTP Request: POST https://api.openai.com/v1/traces/ingest "HTTP/1.1 204 No Content"
2025-10-14 09:23:51,890 - httpx - INFO - HTTP Request: POST https://openrouter.ai/api/v1/chat/completions "HTTP/1.1 200 OK"
2025-10-14 09:23:54,151 - httpx - INFO - HTTP Request: POST https://api.openai.com/v1/traces/ingest "HTTP/1.1 204 No Content"
   ✅ Agent_1 responded (1273 chars) [28.8s]
2025-10-14 09:24:05,811 - httpx - INFO - HTTP Request: POST https://generativelanguage.googleapis.com/v1beta/openai/chat/completions "HTTP/1.1 200 OK"
2025-10-14 09:24:06,616 - httpx - INFO - HTTP Request: POST https://openrouter.ai/api/v1/chat/completions "HTTP/1.1 200 OK"
2025-10-14 09:24:10,129 - httpx - INFO - HTTP Request: POST https://api.openai.com/v1/traces/ingest "HTTP/1.1 204 No Content"
2025-10-14 09:24:32,425 - httpx - INFO - HTTP Request: POST https://openrouter.ai/api/v1/chat/completions "HTTP/1.1 200 OK"
2025-10-14 09:24:36,216 - httpx - INFO - HTTP Request: POST https://api.openai.com/v1/traces/ingest "HTTP/1.1 204 No Content"
2025-10-14 09:27:24,816 - httpx - INFO - HTTP Request: POST https://api.openai.com/v1/traces/ingest "HTTP/1.1 204 No Content"
2025-10-14 09:27:25,214 - httpx - INFO - HTTP Request: POST https://openrouter.ai/api/v1/chat/completions "HTTP/1.1 200 OK"
2025-10-14 09:27:59,006 - httpx - INFO - HTTP Request: POST https://openrouter.ai/api/v1/chat/completions "HTTP/1.1 200 OK"
2025-10-14 09:28:00,944 - httpx - INFO - HTTP Request: POST https://api.openai.com/v1/traces/ingest "HTTP/1.1 204 No Content"
2025-10-14 09:28:10,694 - httpx - INFO - HTTP Request: POST https://openrouter.ai/api/v1/chat/completions "HTTP/1.1 200 OK"
2025-10-14 09:28:11,543 - httpx - INFO - HTTP Request: POST https://api.openai.com/v1/traces/ingest "HTTP/1.1 204 No Content"
2025-10-14 09:28:12,204 - httpx - INFO - HTTP Request: POST https://openrouter.ai/api/v1/chat/completions "HTTP/1.1 200 OK"
   ✅ Round 5 complete - 5m 52s

🗣️  Round 6 (6/10)
   Speaking order: Agent_3 → Agent_1 → Agent_2
   💭 Agent_3 is thinking...
2025-10-14 09:28:13,213 - httpx - INFO - HTTP Request: POST https://openrouter.ai/api/v1/chat/completions "HTTP/1.1 200 OK"
2025-10-14 09:28:16,996 - httpx - INFO - HTTP Request: POST https://api.openai.com/v1/traces/ingest "HTTP/1.1 204 No Content"
2025-10-14 09:29:22,567 - httpx - INFO - HTTP Request: POST https://openrouter.ai/api/v1/chat/completions "HTTP/1.1 200 OK"
2025-10-14 09:29:23,722 - httpx - INFO - HTTP Request: POST https://api.openai.com/v1/traces/ingest "HTTP/1.1 204 No Content"
   ✅ Agent_3 responded (1692 chars) [1m 26s]
2025-10-14 09:29:39,063 - httpx - INFO - HTTP Request: POST https://generativelanguage.googleapis.com/v1beta/openai/chat/completions "HTTP/1.1 200 OK"
   💭 Agent_1 is thinking...
2025-10-14 09:29:39,440 - httpx - INFO - HTTP Request: POST https://api.openai.com/v1/traces/ingest "HTTP/1.1 204 No Content"
2025-10-14 09:29:40,103 - httpx - INFO - HTTP Request: POST https://openrouter.ai/api/v1/chat/completions "HTTP/1.1 200 OK"
2025-10-14 09:29:49,609 - httpx - INFO - HTTP Request: POST https://openrouter.ai/api/v1/chat/completions "HTTP/1.1 200 OK"
2025-10-14 09:29:50,107 - httpx - INFO - HTTP Request: POST https://api.openai.com/v1/traces/ingest "HTTP/1.1 204 No Content"
   ✅ Agent_1 responded (1557 chars) [15.8s]
2025-10-14 09:29:55,629 - httpx - INFO - HTTP Request: POST https://generativelanguage.googleapis.com/v1beta/openai/chat/completions "HTTP/1.1 200 OK"
   💭 Agent_2 is thinking...
2025-10-14 09:29:55,650 - httpx - INFO - HTTP Request: POST https://api.openai.com/v1/traces/ingest "HTTP/1.1 204 No Content"
2025-10-14 09:29:57,797 - httpx - INFO - HTTP Request: POST https://openrouter.ai/api/v1/chat/completions "HTTP/1.1 200 OK"
2025-10-14 09:30:49,474 - httpx - INFO - HTTP Request: POST https://openrouter.ai/api/v1/chat/completions "HTTP/1.1 200 OK"
2025-10-14 09:30:52,084 - httpx - INFO - HTTP Request: POST https://api.openai.com/v1/traces/ingest "HTTP/1.1 204 No Content"
   ✅ Agent_2 responded (1611 chars) [1m 2s]
2025-10-14 09:31:02,784 - httpx - INFO - HTTP Request: POST https://api.openai.com/v1/traces/ingest "HTTP/1.1 204 No Content"
2025-10-14 09:31:05,157 - httpx - INFO - HTTP Request: POST https://generativelanguage.googleapis.com/v1beta/openai/chat/completions "HTTP/1.1 200 OK"
2025-10-14 09:31:06,439 - httpx - INFO - HTTP Request: POST https://openrouter.ai/api/v1/chat/completions "HTTP/1.1 200 OK"
2025-10-14 09:31:30,730 - utils.memory_manager - INFO - Memory approaching limit for Agent_2, attempting compression...
2025-10-14 09:31:33,571 - httpx - INFO - HTTP Request: POST https://openrouter.ai/api/v1/chat/completions "HTTP/1.1 200 OK"
2025-10-14 09:31:33,984 - httpx - INFO - HTTP Request: POST https://api.openai.com/v1/traces/ingest "HTTP/1.1 204 No Content"
2025-10-14 09:32:12,773 - utils.memory_manager - INFO - Memory compressed from 20590 to 3869 characters
2025-10-14 09:32:14,009 - httpx - INFO - HTTP Request: POST https://openrouter.ai/api/v1/chat/completions "HTTP/1.1 200 OK"
2025-10-14 09:32:15,189 - httpx - INFO - HTTP Request: POST https://api.openai.com/v1/traces/ingest "HTTP/1.1 204 No Content"
2025-10-14 09:32:49,112 - httpx - INFO - HTTP Request: POST https://openrouter.ai/api/v1/chat/completions "HTTP/1.1 200 OK"
2025-10-14 09:32:51,347 - httpx - INFO - HTTP Request: POST https://api.openai.com/v1/traces/ingest "HTTP/1.1 204 No Content"
2025-10-14 09:33:16,608 - httpx - INFO - HTTP Request: POST https://openrouter.ai/api/v1/chat/completions "HTTP/1.1 200 OK"
2025-10-14 09:33:17,648 - httpx - INFO - HTTP Request: POST https://api.openai.com/v1/traces/ingest "HTTP/1.1 204 No Content"
🗳️  Voting initiated (Round 6)
2025-10-14 09:33:23,110 - httpx - INFO - HTTP Request: POST https://openrouter.ai/api/v1/chat/completions "HTTP/1.1 200 OK"
2025-10-14 09:33:23,162 - httpx - INFO - HTTP Request: POST https://api.openai.com/v1/traces/ingest "HTTP/1.1 204 No Content"
2025-10-14 09:33:23,497 - httpx - INFO - HTTP Request: POST https://api.openai.com/v1/traces/ingest "HTTP/1.1 204 No Content"
2025-10-14 09:33:24,276 - httpx - INFO - HTTP Request: POST https://openrouter.ai/api/v1/chat/completions "HTTP/1.1 200 OK"
2025-10-14 09:33:24,427 - core.two_stage_voting_manager - INFO - Starting two-stage voting for Agent_1
2025-10-14 09:33:25,207 - httpx - INFO - HTTP Request: POST https://openrouter.ai/api/v1/chat/completions "HTTP/1.1 200 OK"
2025-10-14 09:33:28,359 - core.two_stage_voting_manager - INFO - Two-stage voting success - Agent_1 principle_selection: '3' -> 3 (attempt 1)
2025-10-14 09:33:29,402 - httpx - INFO - HTTP Request: POST https://openrouter.ai/api/v1/chat/completions "HTTP/1.1 200 OK"
2025-10-14 09:33:29,403 - httpx - INFO - HTTP Request: POST https://api.openai.com/v1/traces/ingest "HTTP/1.1 204 No Content"
2025-10-14 09:33:30,456 - core.two_stage_voting_manager - INFO - Two-stage voting success - Agent_1 amount_specification: '13000' -> 13000 (attempt 1)
2025-10-14 09:33:30,457 - core.two_stage_voting_manager - INFO - Completed two-stage voting for Agent_1: principle 3, amount 13000
2025-10-14 09:33:30,457 - core.two_stage_voting_manager - INFO - Starting two-stage voting for Agent_2
2025-10-14 09:33:31,844 - httpx - INFO - HTTP Request: POST https://openrouter.ai/api/v1/chat/completions "HTTP/1.1 200 OK"
2025-10-14 09:33:31,883 - core.two_stage_voting_manager - INFO - Two-stage voting success - Agent_2 principle_selection: '3' -> 3 (attempt 1)
2025-10-14 09:33:33,727 - httpx - INFO - HTTP Request: POST https://openrouter.ai/api/v1/chat/completions "HTTP/1.1 200 OK"
2025-10-14 09:33:33,817 - core.two_stage_voting_manager - INFO - Two-stage voting success - Agent_2 amount_specification: '$13,000' -> 13000 (attempt 1)
2025-10-14 09:33:33,817 - core.two_stage_voting_manager - INFO - Completed two-stage voting for Agent_2: principle 3, amount 13000
2025-10-14 09:33:33,817 - core.two_stage_voting_manager - INFO - Starting two-stage voting for Agent_3
2025-10-14 09:33:35,166 - httpx - INFO - HTTP Request: POST https://api.openai.com/v1/traces/ingest "HTTP/1.1 204 No Content"
2025-10-14 09:33:35,388 - httpx - INFO - HTTP Request: POST https://openrouter.ai/api/v1/chat/completions "HTTP/1.1 200 OK"
2025-10-14 09:33:35,438 - core.two_stage_voting_manager - INFO - Two-stage voting success - Agent_3 principle_selection: '3' -> 3 (attempt 1)
2025-10-14 09:33:36,742 - httpx - INFO - HTTP Request: POST https://openrouter.ai/api/v1/chat/completions "HTTP/1.1 200 OK"
2025-10-14 09:33:36,932 - core.two_stage_voting_manager - INFO - Two-stage voting success - Agent_3 amount_specification: '$13,000' -> 13000 (attempt 1)
2025-10-14 09:33:36,933 - core.two_stage_voting_manager - INFO - Completed two-stage voting for Agent_3: principle 3, amount 13000
2025-10-14 09:33:36,933 - core.two_stage_voting_manager - INFO - Two-stage voting completed successfully for all participants
2025-10-14 09:33:36,933 - core.two_stage_voting_manager - INFO - Consensus reached: maximizing_average_floor_constraint with constraint 13000
🎉 Consensus Reached! Principle: maximizing_average_floor_constraint (constraint: $13000)

2025-10-14 09:33:36,945 - utils.language_manager - INFO - Language set to: English
2025-10-14 09:33:36,948 - utils.language_manager - INFO - Loaded translations for English
2025-10-14 09:33:37,792 - httpx - INFO - HTTP Request: POST https://openrouter.ai/api/v1/chat/completions "HTTP/1.1 200 OK"
2025-10-14 09:33:41,857 - httpx - INFO - HTTP Request: POST https://api.openai.com/v1/traces/ingest "HTTP/1.1 204 No Content"
2025-10-14 09:33:52,345 - utils.language_manager - INFO - Language set to: English
2025-10-14 09:33:52,347 - utils.language_manager - INFO - Loaded translations for English
2025-10-14 09:33:53,420 - httpx - INFO - HTTP Request: POST https://openrouter.ai/api/v1/chat/completions "HTTP/1.1 200 OK"
2025-10-14 09:33:57,752 - httpx - INFO - HTTP Request: POST https://api.openai.com/v1/traces/ingest "HTTP/1.1 204 No Content"
2025-10-14 09:34:51,473 - utils.language_manager - INFO - Language set to: English
2025-10-14 09:34:51,475 - utils.language_manager - INFO - Loaded translations for English
2025-10-14 09:34:52,527 - httpx - INFO - HTTP Request: POST https://openrouter.ai/api/v1/chat/completions "HTTP/1.1 200 OK"
2025-10-14 09:34:54,074 - httpx - INFO - HTTP Request: POST https://api.openai.com/v1/traces/ingest "HTTP/1.1 204 No Content"
2025-10-14 09:35:39,049 - httpx - INFO - HTTP Request: POST https://openrouter.ai/api/v1/chat/completions "HTTP/1.1 200 OK"
2025-10-14 09:35:39,071 - httpx - INFO - HTTP Request: POST https://openrouter.ai/api/v1/chat/completions "HTTP/1.1 200 OK"
2025-10-14 09:35:39,247 - httpx - INFO - HTTP Request: POST https://openrouter.ai/api/v1/chat/completions "HTTP/1.1 200 OK"
2025-10-14 09:35:40,293 - httpx - INFO - HTTP Request: POST https://api.openai.com/v1/traces/ingest "HTTP/1.1 204 No Content"
2025-10-14 09:35:49,640 - httpx - INFO - HTTP Request: POST https://generativelanguage.googleapis.com/v1beta/openai/chat/completions "HTTP/1.1 200 OK"
2025-10-14 09:35:50,832 - httpx - INFO - HTTP Request: POST https://api.openai.com/v1/traces/ingest "HTTP/1.1 204 No Content"
2025-10-14 09:35:51,874 - httpx - INFO - HTTP Request: POST https://generativelanguage.googleapis.com/v1beta/openai/chat/completions "HTTP/1.1 200 OK"
2025-10-14 09:35:55,453 - httpx - INFO - HTTP Request: POST https://generativelanguage.googleapis.com/v1beta/openai/chat/completions "HTTP/1.1 200 OK"
🏁 Phase 2 Complete with consensus - Duration: 31m 22s
   Rounds conducted: 6
   Final earnings:
     Agent_1: $14.38
     Agent_2: $14.38
     Agent_3: $14.38

[TECH] Experiment 867ab4c3-34ad-4dc3-bb45-372c7ab0fb07 completed successfully in 2151.12 seconds
2025-10-14 09:35:56,085 - httpx - INFO - HTTP Request: POST https://generativelanguage.googleapis.com/v1beta/openai/chat/completions "HTTP/1.1 200 OK"
[TECH] Consensus validation successful - discussion aligns with recorded consensus
[TECH] Transcript saved to: /Users/lucasmuller/Desktop/Githubg/Rawls_v3/transcript_867ab4c3-34ad-4dc3-bb45-372c7ab0fb07.json
2025-10-14 09:35:56,117 - core.experiment_manager - INFO - Results saved to: /Users/lucasmuller/Desktop/Githubg/Rawls_v3/hypothesis_testing/hypothesis_2/results/chinese/hypothesis_2_chinese_condition_26_config_results.json
2025-10-14 09:35:56,117 - core.experiment_manager - INFO - Seed used: 494069720 (generated)
[TECH] Results saved to: /Users/lucasmuller/Desktop/Githubg/Rawls_v3/hypothesis_testing/hypothesis_2/results/chinese/hypothesis_2_chinese_condition_26_config_results.json
[DEBUG] Trace: https://platform.openai.com/logs/trace?trace_id=trace_7b9c23a62a9d44b2844bd2f4f09ce951
════════════════════════════════════════════════════════════
✅ EXPERIMENT COMPLETED
════════════════════════════════════════════════════════════
Total Duration: 35m 56s
Consensus: ✅ maximizing_average_floor_constraint
Transcript saved: /Users/lucasmuller/Desktop/Githubg/Rawls_v3/transcript_867ab4c3-34ad-4dc3-bb45-372c7ab0fb07.json
Errors: None
Results saved: /Users/lucasmuller/Desktop/Githubg/Rawls_v3/hypothesis_testing/hypothesis_2/results/chinese/hypothesis_2_chinese_condition_26_config_results.json
🔗 Trace: https://platform.openai.com/logs/trace?trace_id=trace_7b9c23a62a9d44b2844bd2f4f09ce951


Frohlich Experiment Results (ID: 867ab4c3-34ad-4dc3-bb45-372c7ab0fb07)
Completed in 2151.12 seconds

PHASE 1 RESULTS:
  Agent_1: $6.80 (Initial pref: maximizing_floor, Final pref: maximizing_average_floor_constraint)
  Agent_2: $6.80 (Initial pref: maximizing_floor, Final pref: maximizing_average_floor_constraint)
  Agent_3: $7.70 (Initial pref: maximizing_floor, Final pref: maximizing_floor)
  Average Phase 1 earnings: $7.10

PHASE 2 RESULTS:
  Consensus reached on: maximizing_average_floor_constraint
  Constraint amount: $13000
  Rounds to consensus: 6
  Phase 2 earnings:
    Agent_1: $14.38
    Agent_2: $14.38
    Agent_3: $14.38
  Average Phase 2 earnings: $14.38

TOTAL EARNINGS:
  Agent_3: $22.08
  Agent_1: $21.18
  Agent_2: $21.18

HIGHEST EARNER: Agent_3 with $22.08
2025-10-14 09:35:56,378 - httpx - INFO - HTTP Request: POST https://api.openai.com/v1/traces/ingest "HTTP/1.1 204 No Content"

RETURN CODE: 0  DURATION: 2158.2s
